"Columbia, Town of",1/25/2022,Water Supply Well,"$1,360,000",Columbia,Houston,Yes,1/0/1900,"$1,360,000","$1,360,000",$0
"Dothan, City of",2/1/2022,Ross Clark Circle and Red Water Main Replacement,"$12,528,272",Dothan,Houston,Yes,1/0/1900,"$12,528,272","$2,528,272","$10,000,000"
"Bridgeport, The Utilities Board of the City of",1/28/2022,Bridgeport WTP and System Improvements,"$36,000,000",Bridgeport,Jackson,,1/0/1900,$0,$0,$0
Jackson County Water and Sewer Authority,2/16/2022,Water System Improvements,"$2,238,000",Scottsboro,Jackson,,1/0/1900,$0,$0,$0
"Pisgah, Town of",2/18/2022,Water System Improvements,"$1,385,600",Pisgah,Jackson,Yes,1/0/1900,"$1,000,000","$1,000,000","$385,600"
Scottsboro Water Sewer &  Gas Board,1/31/2022,Hwy 35 WTP Intake PS Imp.,"$840,000",Scottsboro,Jackson,Yes,1/0/1900,"$840,000","$840,000",$0
Scottsboro Water Sewer &  Gas Board,2/1/2022,Water System Improvements,"$2,209,080",Scottsboro,Jackson,,1/0/1900,$0,$0,$0
"Stevenson, Utilities Board of the Town",3/31/2022,Water System Improvements,"$3,925,700",Stevenson,Jackson,,1/0/1900,$0,$0,$0
Bessemer Water Services,3/31/2022,"AMI Meter Replacement, General Main/Service Line Rehabilitation,  Steel Tank Rehabilitation, and Lakeshore Secondary Supply Line  and Booster Station","$42,223,750",Bessemer,Jefferson,,1/0/1900,$0,$0,$0
"Bessemer, GUSC of the City of",3/31/2022,Raw Water Pump Upgrade and High Service Pump Control Valve  Replacement,"$2,399,002",Bessemer,Jefferson,,1/0/1900,$0,$0,$0
Birmingham Water Works Board,2/1/2022,Lead Service Line Repair,"$43,514,703",Birmingham,Jefferson,Yes,1/0/1900,"$43,514,703","$13,771,563","$29,743,140"
"Brookside, Town of",2/1/2022,Water System Improvements,"$472,433",Brookside,Jefferson,,1/0/1900,$0,$0,$0
"Irondale, City of",1/31/2022,"Well 6 Improvements, Meter Replacement, and General Water  Distribution System Rehabilitation","$7,910,625",Irondale,Jefferson,,1/0/1900,$0,$0,$0
Leeds Water Works Board,1/31/2022,Isbell Town Water System Replacement,"$750,000",Leeds,Jefferson,,1/0/1900,$0,$0,$0
Mulga Water and Gas Board,2/1/2022,Mulga Water System Improvement Project,"$810,000",Mulga,Jefferson,,1/0/1900,$0,$0,$0
Warrior River Authority,9/13/2022,#1 of 4 WTP Improvements,"$9,500,000",Bessemer,Jefferson,,1/0/1900,$0,$0,$0
Warrior River Authority,9/13/2022,#2 of 4 Well #3 Rehabilitation,"$1,061,000",Bessemer,Jefferson,,1/0/1900,$0,$0,$0
Warrior River Authority,9/13/2022,#3 of 4 Million Dollar Lakes Subdivision PVC Line Replacement,"$3,477,000",Bessemer,Jefferson,,1/0/1900,$0,$0,$0
Warrior River Authority,9/13/2022,#4 of 4 Million Dollar Tank,"$2,668,000",Bessemer,Jefferson,,1/0/1900,$0,$0,$0
"Millport, Town of",1/28/2022,Water Treatment Plant Upgrades,"$494,795",Millport,Lamar,,1/0/1900,$0,$0,$0
Chisholm Heights Water & fire Protection  Authority,3/31/2022,Water Improvements,"$3,023,480",Muscle Shoals,Lauderdale,,1/0/1900,$0,$0,$0
East Lauderdale County Water and Fire  Protection Authority,3/31/2022,Water Improvements,"$5,323,794",Rogersville,Lauderdale,,1/0/1900,$0,$0,$0
"Florence, City of (Supplemental)",11/8/2021,Water System Improvements,"$15,000,000",Florence,Lauderdale,Yes,1/0/1900,"$15,000,000","$2,000,000","$13,000,000"
Greenhill Water and Fire Protection Authority,3/31/2022,Water Improvements,"$2,078,371",Florence,Lauderdale,,1/0/1900,$0,$0,$0
"Rogersville, Town of",2/1/2022,Water System Improvements,"$5,520,673",Rogersville,Lauderdale,,1/0/1900,$0,$0,$0
West Lauderdale Water Authority,3/31/2022,Water Improvements,"$2,686,425",Florence,Lauderdale,,1/0/1900,$0,$0,$0
AL Department of Conservation and Natural  Resources (ADCNR),6/21/2022,"Joe Wheeler State Park Water Improvements in Rogerville, AL -  AL (Lauderdale & Lawrence Counties) Department of Conservation  and Natural Resources (ADCNR)","$562,000",Rogersville,"Lauderdale,Lawrence",,1/0/1900,$0,$0,$0
AL Department of Conservation and Natural  Resources (ADCNR),8/4/2022,"Joe Wheeler State Park Water Improvements in Rogerville, AL -  AL (Lauderdale & Lawrence Counties) Department of Conservation  and Natural Resources (ADCNR)","$401,500",Rogersville,"Lauderdale,Lawrence",,1/0/1900,$0,$0,$0
"Moulton, City of",2/1/2022,Water System Improvements,"$20,952,300",Moulton,Lawrence,,1/0/1900,$0,$0,$0
"Town Creek, Town of",2/1/2022,Proposed Town Creek Water Infrastructure Improvements Project -  Lead Service Line,"$525,000",Town Creek,Lawrence,Yes,1/0/1900,"$525,000","$525,000",$0
West Lawrence Water Authority,2/1/2022,Water System Improvements,"$10,705,850",Mount Hope,Lawrence,,1/0/1900,$0,$0,$0
West Morgan-East Lawrence Water & Sewer  Authority,3/2/2022,(Supplemental App) JD Sims-RM Hames Reverse Osmosis Water  Treatment Facility,"$15,000,000",Decatur,"Lawrence,Morgan",,1/0/1900,$0,$0,$0
West Morgan-East Lawrence Water & Sewer  Authority,1/28/2022,Courtland and North Courtland Water System Replacement,"$12,000,000",Decatur,"Lawrence,Morgan",,1/0/1900,$0,$0,$0
West Morgan-East Lawrence Water & Sewer  Authority,1/28/2022,Water Distribution System Reinforcements,"$10,000,000",Decatur,"Lawrence,Morgan",,1/0/1900,$0,$0,$0
AL Department of Conservation and Natural  Resources (ADCNR),8/4/2022,"Chewacla State Park Water Improvements in Auburn, AL - AL (Lee  County) Department of Conservation and Natural Resources  (ADCNR) - WISH LIST ITEM","$488,900",Auburn,Lee,,1/0/1900,$0,$0,$0
Beauregard Water Authority,1/31/2022,2022 DWSRF Water System Improvements,"$9,742,865",Opelika,Lee,Yes,1/0/1900,"$9,742,865","$3,200,000","$6,542,865"
"Opelika, Utilities Board of the City of",5/23/2022,R.A. Betts Water Treatment Plant Resiliency Improvements,"$12,967,000",Opelika,Lee,,1/0/1900,$0,$0,$0
Limestone County Water & Sewer Authority,3/31/2022,Water System Improvements,"$5,966,000",Athens,Limestone,,1/0/1900,$0,$0,$0
Fort Deposit Water Works and Sewer Board,2/1/2022,Water System Improvements,"$3,664,500",Fort Deposit,Lowndes,,1/0/1900,$0,$0,$0
"Hayneville, Town of",1/28/2022,Water System Improvements,"$2,899,288",Hayneville,Lowndes,Yes,1/0/1900,"$2,899,288","$2,899,288",$0
Lowndes County Water Authority,1/31/2022,Water Mains & Generators,"$735,000",Hayneville,Lowndes,Yes,1/0/1900,"$735,000","$735,000",$0
"Lowndesboro, Town of",1/20/2022,Water Main Replacement,"$1,000,000",Lowndesboro,Lowndes,Yes,1/0/1900,"$1,000,000","$1,000,000",$0
"White Hall, Town of",2/1/2022,Water System Improvements,"$7,390,423",White Hall,Lowndes,,1/0/1900,$0,$0,$0
"Franklin, Town of",3/31/2022,Water System Improvements,"$2,000,000",Franklin,Macon,Yes,1/0/1900,"$2,000,000","$2,000,000",$0
Macon County Water Authority,1/31/2022,Water Distribution Mains,"$1,290,000",Tuskegee,Macon,,1/0/1900,$0,$0,$0
"Notasulga, Town of",1/20/2022,Water Distribution Mains,"$404,000",Notasulga,Macon,,1/0/1900,$0,$0,$0
"Tuskegee, The Utilities Board of the City of",3/31/2022,Water Treatment Plant and Water Tank Improvements,"$3,100,000",Tuskegee,Macon,,1/0/1900,$0,$0,$0
"Gurley, Town of",4/1/2022,Water System Improvements,"$1,355,000",Gurley,Madison,,1/0/1900,$0,$0,$0
Huntsville Utilities (Supplemental),1/27/2022,Huntsville Utilities Water System Improvements - 2022,"$5,620,000",Huntsville,Madison,Yes,1/0/1900,"$5,620,000",$0,"$5,620,000"
Madison County Commission,1/31/2022,Meridanville Water Tank,"$6,992,391",Huntsville,Madison,,1/0/1900,$0,$0,$0
"Madison, Water and Wastewater Board of the  City (DBA Madison Utilities)",3/22/2022,Water System Improvements,"$26,744,000",Madison,Madison,,1/0/1900,$0,$0,$0
Owens Cross Roads Water Authority,2/2/2022,Water System Improvements,"$3,000,000",Owens Cross Roads,Madison,,1/0/1900,$0,$0,$0
"Linden Utilities Board, City of",1/28/2022,Linden Well & Water System Improvements,"$4,000,000",Linden,Marengo,,1/0/1900,$0,$0,$0
"Thomaston, Waterworks and Gas Board of the  Town of",4/4/2022,Knights Hill Storage Tank,"$35,000",Thomaston,Marengo,,1/0/1900,$0,$0,$0
"Bear Creek, Water Works of the Town of",3/31/2022,Water System Improvements,"$1,127,460",Bear Creek,Marion,Yes,1/0/1900,"$1,127,460","$1,127,460",$0
"Brilliant, Town of",4/21/2022,Water System Improvements,"$1,541,150",Brilliant,Marion,Yes,1/0/1900,"$1,541,150","$1,541,150",$0
Guin Waterworks and Sewer Board,2/1/2022,Guin Water System Rehabilitation and Improvements,"$20,000,000",Guin,Marion,,1/0/1900,$0,$0,$0
Marion County Public Water Authority,3/31/2022,Water Distribution Improvements and AMR Meters,"$10,000,000",Marion County,Marion,,1/0/1900,$0,$0,$0
"Twin, Town of",3/18/2022,2022 DWSRF Water System Improvements,"$2,905,725",Twin,Marion,,1/0/1900,$0,$0,$0
"Winfield, The Water Works and Sewer Board of  The City of",1/31/2022,Water System Infrastructure Improvements Project,"$815,000",Winfield,Marion,Yes,1/0/1900,"$336,000","$336,000","$479,000"
"Upper Bear Creek Water, Sewer, & Fire  Protection District",5/10/2022,Upper Bear Creek Water Treatment Plant Improvements,"$3,828,000",Haleyville,Marion,,1/0/1900,$0,$0,$0
AL Department of Conservation and Natural  Resources (ADCNR),6/21/2022,"Lake Guntersville State Park Water Improvements in Gunterville,  AL - AL (Marshall County) Department of Conservation and Natural  Resources (ADCNR)","$100,000",Gunterville,Marshall,,1/0/1900,$0,$0,$0
AL Department of Conservation and Natural  Resources (ADCNR),8/4/2022,"Lake Guntersville State Park Water Improvements in Gunterville,  AL - AL (Marshall County) Department of Conservation and Natural  Resources (ADCNR)","$435,900",Gunterville,Marshall,,1/0/1900,$0,$0,$0
AL Department of Conservation and Natural  Resources (ADCNR),6/21/2022,"Monte Sano State Park Water Improvements in Huntsville, AL - AL  (Madison County) Department of Conservation and Natural  Resources (ADCNR)","$150,000",Huntsville,Marshall,,1/0/1900,$0,$0,$0
AL Department of Conservation and Natural  Resources (ADCNR),8/4/2022,"Monte Sano State Park Water Improvements in Huntsville, AL - AL  (Madison County) Department of Conservation and Natural  Resources (ADCNR)","$138,340",Huntsville,Marshall,,1/0/1900,$0,$0,$0
"Albertville, Municipal Utilities Board of the City of",2/1/2022,Albertville WTP Improvements,"$6,790,000",Albertville,Marshall,,1/0/1900,$0,$0,$0
Douglas Water Authority,1/13/2022,Water System Improvements,"$2,043,000",Horton,Marshall,,1/0/1900,$0,$0,$0
North Marshall Utilities Board,2/1/2022,Water System Improvements,"$20,227,650",Grant,Marshall,,1/0/1900,$0,$0,$0
Arab Water Works,3/31/2022,Water Transmission Replacement and BPS Upgrades,"$23,087,500",Arab,"Marshall,  Morgan,Cullman,Blount",,1/0/1900,$0,$0,$0
"Citronelle, Utilities Board of the Town of (dba  South Alabama Utilities)",3/30/2022,Capital Improvements,"$6,415,320",Citronelle,Mobile,,1/0/1900,$0,$0,$0
Dauphin Island Water and Sewer Authority,5/17/2022,"500,000-gallon Water Storage Tank","$5,000,000",Dauphin Island,Mobile,,1/0/1900,$0,$0,$0
Kushla Water District,4/1/2022,Water Supply Well,"$2,108,270",Kushla,Mobile,,1/0/1900,$0,$0,$0
"Mobile County Water, Sewer, and Fire  Protection Authority",2/1/2022,Drinking Water Projects,"$4,055,000",Theodore,Mobile,,1/0/1900,$0,$0,$0
"Mobile, AL (MAWSS), Board of Water and  Sewer Commissioners of the City of",2/1/2022,Annual Contract for Identifying Lead and Copper Service Lines,"$2,500,000",Mobile,Mobile,Yes,1/0/1900,"$2,500,000","$1,075,000","$1,425,000"
"Mobile, AL (MAWSS), Board of Water and  Sewer Commissioners of the City of",6/7/2022,Causeway Water Main Replacements/Rehabilitation,"$6,907,700",Mobile,Mobile,Yes,1/0/1900,"$6,907,700",$0,"$6,907,700"
"Mobile, AL (MAWSS), Board of Water and  Sewer Commissioners of the City of",2/1/2022,Master Plan SRF Water Projects Phase I - Years 2019-2023,"$13,850,000",Mobile,Mobile,Yes,1/0/1900,"$13,850,000",$0,"$13,850,000"
"Mobile, AL (MAWSS), Board of Water and  Sewer Commissioners of the City of",2/1/2022,Master Plan SRF Water Projects Phase II - Years 2024-2028,"$44,700,000",Mobile,Mobile,,1/0/1900,$0,$0,$0
Saraland Water and Sewer Service,2/1/2022,Saraland Water and Sewer System,"$10,633,000",Saraland,Mobile,,1/0/1900,$0,$0,$0
Satsuma Water and Sewer,2/1/2022,Satsuma Water SRF,"$1,250,000",Satsuma,Mobile,,1/0/1900,$0,$0,$0
"Beatrice, Town of",2/1/2022,Water System Improvements,"$1,180,875",Beatrice,Monroe,,1/0/1900,$0,$0,$0
"Excel, Town of",1/31/2022,Water Main Replacement,"$658,000",Excel,Monroe,Yes,1/0/1900,"$329,000","$329,000","$329,000"
"Frisco City, Town of",1/31/2022,AMR Meter Upgrade,"$444,950",Frisco City,Monroe,Yes,1/0/1900,"$444,950","$222,475","$222,475"
"Mexia Water System, Inc.",1/21/2022,Mexia Water System DWSRF Infrastructure Improvements Project,"$1,500,000",Frisco City,Monroe,Yes,1/0/1900,"$1,500,000","$1,500,000",$0
Monroeville Water Works & Sewer Board,1/31/2022,Water Main Replacement - Lead Service Line,"$2,639,400",Monroeville,Monroe,,1/0/1900,$0,$0,$0
Southwest Alabama Water Authority,2/1/2022,Water System Improvements,"$1,955,088",Peterman,Monroe,,1/0/1900,$0,$0,$0
Decatur Utilities,2/4/2022,10 MG Water Tank Coating,"$1,600,000",Decatur,Morgan,,1/0/1900,$0,$0,$0
"Marion, City of",2/1/2022,Marion DWSRF Critical Needs Water Infrastructure Improvements  Project - Phase 1,"$6,000,000",Marion,Perry,Under Review,1/0/1900,$0,$0,$0
"Marion, City of",2/1/2022,Marion DWSRF Critical Needs Water Infrastructure Improvements  Project - Phase 1,"$100,000",Marion,Perry,Yes,1/0/1900,"$100,000","$100,000",$0
Perry County Water Authority,2/1/2022,Water System Improvements,"$11,306,088",Marion,Perry,,1/0/1900,$0,$0,$0
"Uniontown, The Waterworks and Sewer Board  of the City of",5/13/2022,Uniontown Water Rehab,"$5,353,575",Uniontown,Perry,,1/0/1900,$0,$0,$0
"Aliceville, Water Works and Sewer Board of the  City of",2/1/2022,Snoddy Well No 2,"$930,000",Aliceville,Pickens,,1/0/1900,$0,$0,$0
"Gordo Water, Gas and Sewer Board c/o The  Town of Gordo",3/31/2022,Sullivan Well Rehabilitation,"$1,999,002",Gordo,Pickens,Yes,1/0/1900,"$1,674,002","$1,674,002","$325,000"
Pickens County Water Authority,4/22/2022,600 GPM Well & WTP,"$3,163,000",Carrollton,Pickens,Yes,1/0/1900,"$3,163,000","$3,163,000",$0
"Reform, City of",1/28/2022,Water System Upgrades,"$5,500,000",Reform,Pickens,Yes,1/0/1900,"$5,500,000","$5,500,000",$0
"Brundidge, City of",2/1/2022,2022 Water Main Replacements,"$410,000",Brundidge,Pike,,1/0/1900,$0,$0,$0
"Goshen, Town of",2/1/2022,Water System Improvements,"$408,650",Goshen,Pike,,1/0/1900,$0,$0,$0
Pike County Water Authority,1/31/2022,"SRF Well, Tank, & Mains","$6,190,000",Troy,Pike,,1/0/1900,$0,$0,$0
"Randolph County Water, Sewer & Fire  Protection Authority",10/28/2022,2022 Distribution System Improvements,"$2,650,000",Wedowee,Randolph,,1/0/1900,$0,$0,$0
"Randolph County Water, Sewer & Fire  Protection Authority",6/22/2022,Randolph County Distribution System Improvements,"$390,000",Wedowee,Randolph,Yes,1/0/1900,"$359,000","$359,000","$31,000"
"Randolph County Water, Sewer & Fire  Protection Authority",1/27/2022,WTP and Distribution System Upgrades,"$25,000,000",Wedowee,Randolph,,1/0/1900,$0,$0,$0
"Woodland, Town of",3/18/2022,Water Main Replacement,"$675,000",Woodland,Randolph,,1/0/1900,$0,$0,$0
Russell County Water Authority,2/1/2022,Water System Improvements,"$7,343,491",Phenix City,Russell,Yes,1/0/1900,"$1,600,000","$1,600,000","$5,743,491"
AL Department of Conservation and Natural  Resources (ADCNR),8/4/2022,"Oak Mountain State Park Water Improvements in Pelham, AL - AL  (Shelby County) Department of Conservation and Natural  Resources (ADCNR)","$3,880,000",Pelham,Shelby,,1/0/1900,$0,$0,$0
AL Department of Conservation and Natural  Resources (ADCNR),6/21/2022,"Oak Mountain State Park Water Improvements in Pelham, AL - AL  (Shelby County) Department of Conservation and Natural  Resources (ADCNR)","$357,000",Pelham,Shelby,,1/0/1900,$0,$0,$0
Alabaster Water Board,1/31/2022,Infrastructure Improvements,"$10,700,000",Alabaster,Shelby,,1/0/1900,$0,$0,$0
"Bethel Water System, Inc.",1/27/2022,Water System Improvements,"$250,000",Wilsonville,Shelby,Yes,1/0/1900,"$250,000","$250,000",$0
"Calera, Water Works Board of the City of",1/28/2022,2022 Water System Improvements,"$11,330,000",Calera,Shelby,Yes,1/0/1900,"$6,000,000","$6,000,000","$5,330,000"
Columbiana Waterboard,1/25/2022,Water System Improvements,"$1,300,000",Columbiana,Shelby,Yes,1/0/1900,"$1,300,000","$1,300,000",$0
"Harpersville, Town of",10/28/2022,Harpersville Waterline Replacement Project 2022,"$5,265,000",Harpersville,Shelby,,1/0/1900,$0,$0,$0
Helena Utility Board,2/14/2022,Helena Water System Improvements,"$2,100,000",Helena,Shelby,,1/0/1900,$0,$0,$0
Little Waxie Water Authority,3/29/2022,Water System Improvements,"$775,000",Columbiana,Shelby,,1/0/1900,$0,$0,$0
"Sterrett Vandiver Water System, Inc.",1/20/2022,Water System Improvements,"$1,300,000",Sterrett,Shelby,Yes,1/0/1900,"$1,300,000","$1,300,000",$0
"Vincent,  Town of Waterworks Board",1/25/2022,Water System Improvements,"$840,000",Vincent,Shelby,Yes,1/0/1900,"$840,000","$840,000",$0
"Wilsonville, Town of",2/1/2022,Cast Iron Water Main/Lead Service Replacement,"$902,704",Wilsonville,Shelby,,1/0/1900,$0,$0,$0
"Ashville, City of",2/1/2022,Water System Improvements,"$3,707,570",Ashville,St. Clair,,1/0/1900,$0,$0,$0
Chandler Mt./Greasy Cove Water Authority,1/20/2022,Water Improvements,"$745,246",Steele,St. Clair,,1/0/1900,$0,$0,$0
"New London Water, Sewer, and Fire Protection  Authority",1/14/2022,Water System Improvements,"$1,484,500",New London,St. Clair,Yes,1/0/1900,"$1,484,500","$1,484,500",$0
Northwest St. Clair Water System,2/1/2022,Water System Upgrades,"$1,251,000",Steele,St. Clair,,1/0/1900,$0,$0,$0
"Odenville Utilities Board, Town of",1/31/2022,"Southern Water Improvements, Tank Painting,, Meter  Replacement, General Water Distribution System Rehabilitation","$19,568,313",Odenville,St. Clair,,1/0/1900,$0,$0,$0
"Pell City, City of",1/31/2022,"Well A to Woodhill Tank, Mill Village Water Rehabilitation, General  Water Distribution System Rehabilitation","$8,730,700",Pell City,St. Clair,,1/0/1900,$0,$0,$0
"Pinedale Water, Sewer and Fire Protection  Authority",3/11/2022,Elevated Water Storage Tank,"$1,320,000",Ashville,St. Clair,,1/0/1900,$0,$0,$0
Ragland Water Works Board,3/31/2022,Water System Improvements,"$3,233,657",Ragland,St. Clair,,1/0/1900,$0,$0,$0
"Riverside, Town of",2/1/2022,Water System Improvements,"$2,374,515",Riverside,St. Clair,,1/0/1900,$0,$0,$0
Wattsville Water Authority,3/29/2022,Water System Improvements,"$3,737,975",Wattsville,St. Clair,,1/0/1900,$0,$0,$0
"Wolf Creek Water, Sewer, and Fire Protection  Authority",1/31/2022,Water Storage Tank and Water Main Extensions,"$800,000",Wolf Creek,St. Clair,Yes,1/0/1900,"$800,000","$500,000","$300,000"
Livingston Utility Board,2/1/2022,Water System Improvements,"$4,845,175",Livingston,Sumter,,1/0/1900,$0,$0,$0
Sumter County Water Authority,2/1/2022,Water System Improvements,"$2,610,500",Livingston,Sumter,,1/0/1900,$0,$0,$0
"York, City of",7/13/2022,(Supplemental) DWSRF Radio Read Water Meter Improvements,"$779,300",York,Sumter,,1/0/1900,$0,$0,$0
"York, City of",2/1/2022,Proposed York Water System Infrastructure Project,"$2,248,000",York,Sumter,Under Review,1/0/1900,$0,$0,$0
"Childersburg Water Works, S & G Board",1/19/2022,Water System Improvements,"$739,000",Childersburg,Talladega,,1/0/1900,$0,$0,$0
"Lincoln, City of",2/3/2022,Water System Improvements,"$2,942,300",Lincoln,Talladega,Yes,1/0/1900,"$2,942,300","$2,942,300",$0
Stewartville Water Authority,2/1/2022,Stewartville Water System Improvements,"$2,600,000",Stewartville,Talladega,,1/0/1900,$0,$0,$0
Sycamore Water & Sewer Authority,2/8/2022,Water System Improvements,"$4,000,000",Sycamore,Talladega,,1/0/1900,$0,$0,$0
Sylacauga Utilities Board,1/27/2022,Water System Improvements,"$7,900,000",Sylacauga,Talladega,,1/0/1900,$0,$0,$0
"Talladega, Alabama, City of",2/17/2022,New Water Treatment Plant & System Improvements,"$6,000,000",Talladega,Talladega,,1/0/1900,$0,$0,$0
AL Department of Conservation and Natural  Resources (ADCNR),6/2/2022,"Wind Creek State Park Water Improvements in Alexander City, AL -  AL Department of Conservation and Natural Resources (ADCNR)","$414,500",Alexander City,Tallapoosa,Yes,1/0/1900,"$414,500","$414,500",$0
"Camp Hill, Town of",2/11/2022,2022 DWSRF WATER SYSTEM IMPROVEMENTS,"$1,839,625",Camp Hill,Tallapoosa,,1/0/1900,$0,$0,$0
"Dadeville Water and Sewer Board, City of",2/1/2022,Water System Improvements,"$809,750",Dadeville,Tallapoosa,,1/0/1900,$0,$0,$0
Hackneyville Water Authority,3/24/2022,Water System Improvements,"$734,500",Alexander City,Tallapoosa,,1/0/1900,$0,$0,$0
AL Department of Conservation and Natural  Resources (ADCNR),8/4/2022,"Lake Lurleen State Park Water Improvements in Coker, AL - AL  (Tuscaloosa County) Department of Conservation and Natural  Resources (ADCNR)","$1,108,700",Coker,Tuscaloosa,,1/0/1900,$0,$0,$0
AL Department of Conservation and Natural  Resources (ADCNR),6/21/2022,"Lake Lurleen State Park Water Improvements in Coker, AL - AL  (Tuscaloosa County) Department of Conservation and Natural  Resources (ADCNR)","$63,800",Coker,Tuscaloosa,,1/0/1900,$0,$0,$0
Carroll's Creek Water Authority,2/1/2022,Blue Creek Expansion,"$5,660,500",Northport,Tuscaloosa,,1/0/1900,$0,$0,$0
Carroll's Creek Water Authority,2/1/2022,Water System Improvements,"$2,701,300",Northport,Tuscaloosa,,1/0/1900,$0,$0,$0
Coaling Water Authority,1/31/2022,CWA - 2022 Water System Improvements,"$1,047,800",Coaling,Tuscaloosa,,1/0/1900,$0,$0,$0
Coker Water Authority,3/14/2022,Water Main Replacement,"$2,035,472",Coker,Tuscaloosa,,1/0/1900,$0,$0,$0
Englewood-Hulls Water System,1/31/2022,Water System Improvements,"$1,398,900",Tuscaloosa,Tuscaloosa,,1/0/1900,$0,$0,$0
"Lake View, City of",5/18/2022,Million Dollar Lakes Subdivision,"$3,179,657",Lake View,Tuscaloosa,,1/0/1900,$0,$0,$0
Mitchell Water System,1/31/2022,MWS - 2022 System Improvements,"$2,526,700",Duncanville,Tuscaloosa,,1/0/1900,$0,$0,$0
"Northport, City of",2/1/2022,2022 Water Meter Replacement,"$6,308,089",Northport,Tuscaloosa,,1/0/1900,$0,$0,$0
Peterson Water System,1/31/2022,Water System Improvements,"$709,400",Cottondale,Tuscaloosa,,1/0/1900,$0,$0,$0
"Tuscaloosa, City of (Supplemental)",12/21/2021,Water System Improvements,"$12,000,000",Tuscaloosa,Tuscaloosa,Yes,1/0/1900,"$12,000,000",$0,"$12,000,000"
Copeland Ferry Pumpkin Center Water Authority,4/22/2022,Water Line Replacement,"$357,600",Quinton,Walker,Yes,1/0/1900,"$84,600","$84,600","$273,000"
Copeland Ferry Pumpkin Center Water Authority,2/1/2022,Water System Improvements,"$1,105,590",Quinton,Walker,,1/0/1900,$0,$0,$0
"Cordova, City of; Water Works & Gas Board",1/25/2022,Water System Improvements,"$1,400,000",Cordova,Walker,,1/0/1900,$0,$0,$0
"Oakman, Water Works Board of the Town of",1/26/2022,Oakman Water Supply Improvements,"$1,525,400",Oakman,Walker,,1/0/1900,$0,$0,$0
"Parrish, Waterworks and Sewer Board of the  Town of",2/14/2022,Parrish Water System Improvements,"$1,757,000",Parrish,Walker,,1/0/1900,$0,$0,$0
"Sumiton, City of",1/25/2022,Sumiton Water Improvements,"$900,000",Sumiton,Walker,,1/0/1900,$0,$0,$0
St. Stephens Water System,2/1/2022,Water System Improvements,"$545,100",St. Stephens,Washington,,1/0/1900,$0,$0,$0
Washington County Water Authority,4/1/2022,Water System Improvements,"$4,591,270",Chatom,Washington,,1/0/1900,$0,$0,$0
"Camden, City of",2/1/2022,2022 Lead Service Line Inventory and Replacement,"$2,027,323",Camden,Wilcox,,1/0/1900,$0,$0,$0
"Camden, City of",1/27/2022,Water System Improvements,"$1,848,684",Camden,Wilcox,,1/0/1900,$0,$0,$0
"Pine Hill, Town of",1/31/2022,New 1.5 MGD Package WTP,"$4,882,400",Pine Hill,Wilcox,,1/0/1900,$0,$0,$0
Wilcox County Water and Sewer District,7/29/2022,Water Line Replacement Project,"$13,000,000",Camden,Wilcox,,1/0/1900,$0,$0,$0
Wilcox County Water and Sewer District,2/1/2022,Water System Improvements,"$5,918,380",Camden,Wilcox,,1/0/1900,$0,$0,$0
Wilcox County Water and Sewer District,1/28/2022,Water Well Improvements,"$5,256,080",Camden,Wilcox,Yes,1/0/1900,"$5,256,080","$5,256,080",$0
"Addison, Water Works of the Town of",3/31/2022,Water System Improvements,"$695,033",Addison,Winston,,1/0/1900,$0,$0,$0
Haleyville Water Works and Sewer Board,2/1/2022,2022 Cast Iron Water Main Replacement,"$1,151,146",Haleyville,Winston,,1/0/1900,$0,$0,$0
Haleyville Water Works and Sewer Board,1/26/2022,2022 Water System Improvements,"$3,060,740",Haleyville,Winston,,1/0/1900,$0,$0,$0
Total,0,363,"$1,554,821,564",0,0,0,0,$0,$0,0
