Project.Number,County,System.Name,Borrower,Description,Pop,Project.Cost,Score,Cumulative.Total
19814,Albany,RENSSELAERVILLE WATER DISTRICT,Rensselaerville (T),"Replacement of the WTP due to DBP violations and poor water quality, Upgrade Water Treatment Plant",200,2551786,145,2551786
18915,Onondaga,CARDIFF WATER DISTRICT,LaFayette (T),"Cardiff Water District Improvements and Consolidation Project, New Storage, New Inter-Connection",70,4894000,135,7445786
19541,Onondaga,ROUTE 11A WATER DISTRICT,Tully (T),"Route 11A WD Improvements and Consolidation Project, Upgrade Water District",26,2747000,120,10192786
19796,Oswego,TOWN OF SCHROEPPEL SOUTH WD,Schroeppel (T),"New South Water District, New Water District",8049,25450000,115,35642786
19760,Lewis,CROGHAN (V),Croghan (V),"Water System Improvements Project, Upgrade Transmission, Upgrade Distribution System, New Water District",900,10197000,110,45839786
19741,Westchester,SCOTTS CORNER WD,Pound Ridge (T),"Creation of the Scotts Corners WD to serve area with private wells contaminated by PFAS, New Water District",114,10907000,110,56746786
19781,Cattaraugus,CATTARAUGUS (V),Cattaraugus (V),"New Well Source, Replace WM, Valves and Controls, New Ground Water Source, Upgrade Distribution System",1185,10788220,105,67535006
19828,Washington,ARGYLE (V),Argyle (V),"Upgrade Source, Rehab Storage, Upgrade Distribution, Upgrade Ground Water Source, Upgrade Storage, Upgrade Distribution System",725,14800000,105,82335006
19140,Jefferson,WATERTOWN WD #3 & #4,Watertown (T),"System Water Looping to address disinfection byproducts and consolidate Northland Estates and Pine Meadows PWS, Upgrade Distribution System",660,10135200,105,92470206
19830,Clinton,PERU (T),Peru (T),"Upgrade Water Treatment Plant, New Ground Water Source, New Storage",6772,9400000,100,101870206
17978,Jefferson,NORTHEAST WATER DISTRICT,Watertown (T),"New Northeast Water District, New Water District",550,8085000,100,109955206
19525,Chautauqua,CLYMER (T),Clymer (T),"New Well, New Storage Tank, and Replacement of WM, New Ground Water Source, Upgrade Distribution System",545,10707880,100,120663086
19182,Oneida,TRENTON (T),Trenton (T),"Hamlet of Barneveld distribution and storage improvements and MVWA connection, Upgrade Storage, Upgrade Distribution System",300,11113000,100,131776086
19521,Lewis,PORT LEYDEN (V),Port Leyden (V),"Water System Improvements, Upgrade Water Treatment Plant, Upgrade Distribution System",704,10197000,95,141973086
18756,Lewis,CONSTABLEVILLE (V),Constableville (V),"Watermain replacement, raw water transmission main replacement, spring storage basin repair/upgrades, Upgrade Transmission, Upgrade Distribution System",310,13600000,95,155573086
18670,Nassau,HEMPSTEAD (V),Hempstead (V),"1,4-dioxane and PFAS removal at Clinton Street Plant, Upgrade Water Treatment Plant, Upgrade Storage",56000,53266504,90,208839590
19552,Allegany,FRIENDSHIP (T),Friendship (T),"Distribution, Source and Treatment Upgrades, Upgrade Ground Water Source, Upgrade Distribution System",1400,12450000,90,221289590
19802,Lewis,LYONSDALE (T),Lyonsdale (T),"Replacement and extension of Lyonsdale (T) Water District No. 1, New Water District",783,5871000,90,227160590
19785,Chautauqua,ELLICOTT (T),Ellicott (T),"Extend Water Service Area in Fluvanna, Upgrade Distribution System",635,10300000,90,237460590
18854,Seneca,WILLARD WD,Romulus (T),"Willard WD Distribution Improvements, Upgrade Distribution System",372,2659853,90,240120443
19798,Oneida,VIENNA FAR EAST WATER DISTRICT,Vienna (T),"New Far East Water District, New Water District",162,9925000,90,250045443
18126,Jefferson,BROWNVILLE (V),Brownville (V),"Replace Severely Aged Distribution Mains and Tank, New Storage, Upgrade Distribution System",2200,18948500,85,268993943
18681,Broome,ENDICOTT (V),Endicott (V),"Well No. 32 treatment for iron, manganese, and 1,4-dioxane, Upgrade Water Treatment Plant",46000,18473853,80,287467796
18825,Lewis,COPENHAGEN (V),Copenhagen (V),"Interconnection with Carthage / West Carthage - Source Capacity, Upgrade Water Treatment Plant",723,6264300,80,293732096
19750,Dutchess,QUAKER HILL WATER SYSTEM,DCWWA,"Quaker Hill WS Interconnection with Hyde Park Regional WS to resolve PFAS contamination at Quaker Hill, New Pump Station, New Inter-Connection",350,21875700,80,315607796
18839,Tompkins,NEWFIELD WATER DISTRICT,Newfield (T),"Phase 1 - Replacement of aged and undersized asbestos water main along Main Street & New GW Source, New Ground Water Source, Upgrade Distribution System",2300,7119751,75,322727547
19780,Chautauqua,CASSADAGA (V),Cassadaga (V),"New Well, Replace WM, Upgrade Telemetry, New Ground Water Source, Upgrade Distribution System",1500,8836370,75,331563917
19752,Allegany,BELMONT (V),Belmont (V),"Improvements on Well Source, Water Treatment Plant and Watermains, Upgrade Water Treatment Plant, Upgrade Ground Water Source, Upgrade Distribution System",1324,8712667,75,340276584
18853,Jefferson,HOUNSFIELD WSA #8,Hounsfield (T),"Water Service Area #8 to serve an area currently on individual wells, New Water District",1250,13162370,75,353438954
18406,Wyoming,WARSAW (V),Warsaw (V),"Water System Improvements, Upgrade Water Treatment Plant, Upgrade Distribution System",4200,12100000,70,365538954
19774,St. Lawrence,BORDER WATER DISTRICT,Massena (T),"Border Water District Project, New Water District",583,11330000,70,376868954
18704,St. Lawrence,POTSDAM (T),Potsdam (T),"NYS Rt. 56 WD, New Distribution System, New Water District",305,7441000,70,384309954
19804,Orleans,BARRE (T) WD NO. 10,Barre (T),"New WD No. 10, New Water District",75,2708000,70,387017954
19831,Clinton,PLATTSBURGH (C),Plattsburgh (C),"Phase 4 - New Production Well, rehab transmission main, WTP Upgrades, Upgrade Water Treatment Plant, New Ground Water Source, Upgrade Transmission",19900,8810000,65,395827954
19487,Clinton,PLATTSBURGH (C),Plattsburgh (C),"Phase 3 - drinking water system upgrades, Upgrade Water Treatment Plant, New Ground Water Source, Upgrade Transmission",19840,8832000,65,404659954
18863,Steuben,PAINTED POST VILLAGE,Painted Post (V),"Well upgrades and replacement of storage tank, Upgrade Ground Water Source, Upgrade Storage",1842,8289487,65,412949441
18900,Chenango,VILLAGE OF GREENE,Greene (V),"Phase 1 - Water main replacement, Upgrade Distribution System",1800,20566400,65,433515841
19184,Chenango,BAINBRIDGE (V),Bainbridge (V),"Water System Improvements - WM Replacement, New Well, Booster PS Improvements, New Ground Water Source, Upgrade Pump Station, Upgrade Distribution System",1600,7455600,65,440971441
19793,St. Lawrence,GOUVERNEUR (V),Gouverneur (V),"Improvements to portions of existing water distribution system, Upgrade Distribution System",1550,9749000,65,450720441
18928,Oswego,PULASKI VILLAGE,Pulaski (V),"Replacement of aged and deteriorating water main, Upgrade Distribution System",900,11962000,65,462682441
19510,Jefferson,LORRAINE WATER DISTRICT NO. 1,Lorraine (T),"Construction of WD No. 1, New Water District",160,4435000,65,467117441
18587,Niagara,NIAGARA FALLS WATER BOARD,Niagara Falls Water Board,"Beech Ave Storage Tank Replacement, Upgrade Storage",48500,15240000,60,482357441
19041,Orange,WALLKILL CONSOLIDATED WD #1,Wallkill (T),"Rykowski Well Field Expansion and Water Treatment Plant Upgrades, Upgrade Water Treatment Plant, New Ground Water Source",18500,11074560,60,493432001
19213,Allegany,WELLSVILLE (V),Wellsville (V),"Village-Wide Watermain Replacement, Upgrade Distribution System",5700,6828000,60,500260001
19742,Orange,GREENWOOD LAKE (V),Greenwood Lake (V),"Greenwood Lake (V) Water System Improvements - Phase II, Upgrade Water Treatment Plant, Upgrade Storage",3000,5017950,60,505277951
19211,Wayne,WOLCOTT (V),Wolcott (V),"Village of Wolcott WTP Upgrades, Upgrade Water Treatment Plant",2465,8400000,60,513677951
18299,Madison,DERUYTER (V),DeRuyter (V),"Water Systems Improvements - Storage, WTP, and Watermain upgrades, Upgrade Water Treatment Plant, Upgrade Storage, Upgrade Distribution System",643,3646335,60,517324286
18579,Lewis,TOWN OF DIANA WATER DISTRICT,Diana (T),"Upgrade Wells 1 and 3, Distribution Looping and New Water Meters, Upgrade Ground Water Source, Upgrade Distribution System",618,6180000,60,523504286
19149,Chemung,WELLSBURG (V),Wellsburg (V),"Tank decommissioning & replacements, distribution upgrades, new emergency ground supply, New Ground Water Source, Upgrade Storage, Upgrade Distribution System",580,6536623,60,530040909
18890,Chemung,MILLPORT (V),Millport (V),"New Well and Upgrade Tank, Meters, and Telemetry, New Other Expenses, Upgrade Ground Water Source, Upgrade Storage",292,1604100,60,531645009
18932,Oswego,COUNTY RT. 57/ HUNTLEY RD WATER DISTRICT,Schroeppel (T),"County Route 57 / Huntley Road Water District, New Distribution System",253,4903800,60,536548809
19773,Cayuga,MONTEZUMA WD 2,Montezuma (T),"Expansion of water system, creation of Town's service area no. 2, Extend Distribution System",250,9143282,60,545692091
19548,Wyoming,TOWN OF PERRY WD NO. 2,Perry (T),"New WD No. 2, Upgrade Distribution System",215,6360734,60,552052825
19645,Dutchess,SCHREIBER WATER WORKS,DCWWA,"New well and treatment for removal of gross alpha, radium, iron/manganese, and sulfate, New Water Treatment Plant, New Ground Water Source",80,4653540,60,556706365
19777,Monroe,BROCKPORT (V),Brockport (V),"Replacement of Distribution and Transmission WM, Controls and Appurtenances, Upgrade Distribution System",7300,10266010,55,566972375
18822,Dutchess,WAPPINGERS FALLS (V),Wappingers Falls (V),"New Greensand WTP for Mn Removal, New Water Treatment Plant, Upgrade Ground Water Source, Upgrade Storage",6731,3042840,55,570015215
19046,Delaware,DELHI (V),Delhi (V),"Distribution, Storage, & Pump Station Upgrades, Upgrade Storage, Upgrade Pump Station, Upgrade Distribution System",3833,6500000,55,576515215
19232,Wayne,CLYDE (V),Clyde (V),"New vertical turbine pumps, new well houses, treatment improvements, emergency backup power, Upgrade Water Treatment Plant, Upgrade Ground Water Source",2269,2544000,55,579059215
19133,Cayuga,WEEDSPORT (V),Weedsport (V),"Water Systems Improvements, Upgrade Storage, Upgrade Distribution System",1945,22008000,55,601067215
19515,Oswego,OSWEGO (C),Oswego (C),"Ellen St. and Gardiner Hill HSZ Interconnect, and rehab Gardiner Hill Tank, Upgrade Storage, Upgrade Distribution System",1700,11200000,55,612267215
19556,Montgomery,ST JOHNSVILLE (V),St. Johnsville (V),"Disinfection Upgrades, Tank Rehab, Monroe St. Main Replacement, Upgrade Storage, Upgrade Distribution System",1643,2278880,55,614546095
18814,Otsego,EDMESTON (T),Edmeston (T),"Treatment and Distribution System Improvements, Upgrade Water Treatment Plant, Upgrade Distribution System",900,9647000,55,624193095
19766,Sullivan,LIVINGSTON WD,Rockland (T),"Distribution and Storage Improvements, Upgrade Storage, Upgrade Distribution System",850,8365746,55,632558841
19574,Steuben,PRATTSBURGH WD,Prattsburgh (T),"Water distribution system improvements, Upgrade Other Expenses, Upgrade Storage, Upgrade Distribution System, Upgrade Other (OT)",594,7107000,55,639665841
19243,Steuben,COHOCTON (T),Cohocton (T),"Tank rehab, distribution upgrades and looping, well house improvements, Upgrade Ground Water Source, Upgrade Storage, Upgrade Distribution System",485,3759150,55,643424991
19847,Delaware,TREADWELL WATER DISTRICT,Treadwell,"Treadwell Water District Improvements Project, Upgrade Water Treatment Plant, New Ground Water Source, Upgrade Storage",140,1500000,55,644924991
18979,Schenectady,SCHENECTADY (C),Schenectady (C),"Phase 1 Rice Road Source and WTP Improvements, Upgrade Water Treatment Plant, New Ground Water Source",60000,7775470,50,652700461
19519,Yates,PENN YAN (V),Penn Yan (V),"Upgrades to WTP to improve water quality and system reliability, Upgrade Water Treatment Plant, Upgrade Storage",8159,5610000,50,658310461
19527,Jefferson,BLACK RIVER (V),Black River (V),"Distribution, Maple St. Well, & New Source Improvements, New Ground Water Source, Upgrade Distribution System",4170,18200000,50,676510461
19805,Saratoga,SOUTH GLENS FALLS (V),South Glens Falls (V),"Replacement of aged water main along Ferry Boulevard, Upgrade Distribution System",3744,1000000,50,677510461
19834,Chautauqua,WESTFIELD (V),Westfield (V),"Westfield (V) Distribution System Improvements, New Distribution System",2683,8795400,50,686305861
18526,Sullivan,JEFFERSONVILLE (V),Jeffersonville (V),"Construct new water storage tank, new pump/treatment building, and two new wells, New Ground Water Source, New Storage, Upgrade Distribution System",400,5314353,50,691620214
19273,Schenectady,SCHENECTADY (C),Schenectady (C),"Phase 2 Rice Road WTP Improvements, Upgrade Water Treatment Plant",60000,8221460,45,699841674
18909,Cortland,CORTLAND (C),Cortland (C),"Homer Ave Reconstruction & Water Main Replacement Project, Upgrade Distribution System",21859,11661120,45,711502794
19278,Fulton,GLOVERSVILLE (C) WATER WORKS,Gloversville (C),"New Transmission Main and upgrades to the distribution system, New Transmission, Upgrade Distribution System",15300,5309551,45,716812345
19826,Ontario,GENEVA (C),Geneva (C),"Filtration upgrade at water treatment plant, Upgrade Water Treatment Plant",14500,14667200,45,731479545
19540,Orleans,MEDINA (V),Medina (V),"Phase I Upgrade on WM, Booster Pump, SCADA and Storage, Upgrade Distribution System",6050,12025250,45,743504795
19432,Steuben,BATH (V),Bath (V),"Replacement of Mt. Washington tank and Maple Heights tank, Upgrade Storage, Upgrade Distribution System",5500,8500000,45,752004795
18927,Jefferson,ADAMS (V),Adams (V),"Water main and water meter replacement, Upgrade Distribution System",3300,6162490,45,758167285
19882,Saratoga,CORINTH (V),Corinth (V),"WTP Upgrades, WM Replacement, Upgrade Water Treatment Plant, Upgrade Distribution System",3000,14996000,45,773163285
19528,Jefferson,PAMELIA CONSOLIDATED WD NO. 1,Pamelia (T),"Water Main Replacement and Chlorine Booster Station, Upgrade Other Expenses, Upgrade Distribution System, Upgrade Other (OT)",2350,8786000,45,781949285
19542,Jefferson,DEXTER (V),Dexter (V),"Route 180 Water Line Replacement, Upgrade Distribution System",1004,3071975,45,785021260
19505,Delaware,MARGARETVILLE (V),Margaretville (V),"Hospital Tank replacement, meters, control system upgrades, Upgrade Storage, Upgrade Distribution System",514,1508801,45,786530061
19764,Sullivan,ROSCOE-ROCKLAND WD,Rockland (T),"New wells, treatment, and main replacement, New Water Treatment Plant, New Ground Water Source, Upgrade Distribution System",500,8300000,45,794830061
19514,St. Lawrence,TOWN OF EDWARDS WD NO.1,Edwards (T),"Well No.2 Improvements, Upgrade Surface Water Source",465,800000,45,795630061
18972,Suffolk,RIVERHEAD WD,Riverhead (T),"WD Extension Nos. 95 & 96 - Calverton. Extend Public Water to Address PFAS in Private Residential Wells., Extend Distribution System, Extend Water District",190,12178000,45,807808061
19546,Livingston,GENESEO (T),Geneseo (T),"Legacy WM Replacement - Crossett Rd., NYS Rts 63, 39 and 20A, Upgrade Distribution System",108,3708000,45,811516061
19127,Albany,ALBANY (C),Albany MWFA,"Basic Creek Reservoir Dam Safety Improvements, Upgrade Surface Water Source",101082,8605000,40,820121061
19157,Albany,ALBANY (C),Albany MWFA,"Water System Improvements, Upgrade Water Treatment Plant, Upgrade Storage, Upgrade Pump Station",101082,9746301,40,829867362
19558,Albany,ALBANY (C),Albany MWFA,"Rensselaer Lake Dam Safety Improvements, Upgrade Surface Water Source",98000,8003000,40,837870362
19803,Niagara,NIAGARA FALLS WATER BOARD,Niagara Falls Water Board,"2024 Capital Improvement Project, WM Replacement, Upgrade Distribution System",48500,6560000,40,844430362
19210,Cayuga,AUBURN (C),Auburn (C),"Raw Water Transmission Main Replacement, Upgrade Transmission",43000,12300000,40,856730362
18829,Madison,ONEIDA (C),Oneida (C),"Construction of a new clear well, and rehab existing clear well, Upgrade Storage",20516,3357800,40,860088162
19776,Genesee,BATAVIA (C),Batavia (C),"Replacement of WM on Walnut St, Upgrade Distribution System",15600,4170000,40,864258162
19746,St. Lawrence,MASSENA (V),Massena (V),"Raquette River Bridge Crossing Water Main, Upgrade Distribution System",10839,1537790,40,865795952
18908,Steuben,HORNELL (C),Hornell (C),"Transmission main replacement., Upgrade Transmission",9592,2375000,40,868170952
19261,Herkimer,LITTLE FALLS (C),Little Falls (C),"Distribution system improvements, WTP improvements, Spruce Lake Dam rehab, Upgrade Other Expenses, Upgrade Water Treatment Plant, Upgrade Distribution System, Upgrade Other (OT)",4946,28428000,40,896598952
19108,Rensselaer,HOOSICK FALLS (V),Hoosick Falls (V),"Rogers Ave Tank replacement, water main replacement and LSL replacement., Upgrade Storage, Upgrade Distribution System",4500,7000000,40,903598952
19520,Cortland,HOMER (V),Homer (V),"New Water Storage Tank West of I-81, New Storage",3183,4048000,40,907646952
19143,Jefferson,CLAYTON (V),Clayton (V),"Water Main Replacement and New Raw Water Intake Line and Screen, Upgrade Distribution System",2732,8481020,40,916127972
18815,Schuyler,MONTOUR FALLS,Montour Falls (V),"Replace Aged Undersized Distribution Mains., Upgrade Distribution System",1800,4685856,40,920813828
19650,Allegany,BOLIVAR (V),Bolivar (V),"WM Replacement Throughout Village., Upgrade Distribution System",1600,4100000,40,924913828
19187,Dutchess,AMENIA WD #1,Amenia (T),"Water District No. 1 Improvements, New Ground Water Source, New Storage, New Distribution System",1010,13338500,40,938252328
19531,Allegany,ANGELICA (V),Angelica (V),"Replacement of WM and Formation of WD, Upgrade Distribution System",713,4610280,40,942862608
18858,Yates,DRESDEN (V),Dresden (V),"System wide replacement of aged mains and appurtenances, installation of new main to loop dead ends., Upgrade Distribution System",600,7984160,40,950846768
19591,Suffolk,RIVERHEAD WATER DISTRICT,Riverhead (T),"Well No. 5-2A PFAS removal, Upgrade Water Treatment Plant",190,2327800,40,953174568
19554,Albany,ALBANY (C),Albany MWFA,"Water main replacement and upgrade of associated appurtenances., Upgrade Distribution System",100000,7628722,35,960803290
19516,Ontario,CANANDAIGUA (C),Canandaigua (C),"Rehabilitation of settling basin equipment, New Other Expenses, New Other (OT)",39239,1266000,35,962069290
19536,Oneida,ROME (C),Rome (C),"Kessinger Dam Rehabilitation, Upgrade Surface Water Source",37300,14400000,35,976469290
18801,Orange,MIDDLETOWN (C),Middletown (C),"Phase 1A - Kinch Pond to Greenville Turnpike Raw Water Main Replacement, Upgrade Transmission",30452,8389500,35,984858790
19483,Orange,MIDDLETOWN (C),Middletown (C),"Phase 1B - Greenville Turnpike to Shawangunk Reservoir Raw Water Main Replacement, Upgrade Transmission",30452,9713930,35,994572720
19589,Cortland,CORTLAND (C),Cortland (C),"Groton Ave Improvements Project, Upgrade Distribution System",18670,2320361,35,996893081
19518,St. Lawrence,CANTON (V),Canton (V),"Transmission Main Upgrades and Water Storage Tank Replacement, Upgrade Transmission, Upgrade Storage",6314,17841238,35,1014734319
18761,Wyoming,WARSAW (T),Warsaw (T),"WD No. 1 WM Replacement Saltvale Rd., Upgrade Distribution System",5316,1397000,35,1016131319
19832,Greene,CATSKILL (V),Catskill (V),"Replacement of approximately 4,685 LF of Watermain.",3833,5000000,35,1021131319
19749,Orange,OTISVILLE (V),Otisville (V),"Water Storage and Distribution System Upgrades, Upgrade Storage, New Storage, Upgrade Distribution System",2169,14782560,35,1035913879
18544,Broome,PORT DICKINSON (V),Port Dickinson (V),"Replace Aged Water Mains Chenango St. and Rochelle Rd., Upgrade Distribution System",1699,7200000,35,1043113879
19549,Livingston,GENESEO (V),Geneseo (V),"Replace WM approx 3,300 LF on Oak and Second Streets, Upgrade Distribution System",240,2037550,35,1045151429
18925,Wayne,CLYDE (V),Clyde (V),"Main replacement on Glasgow St., Upgrade Distribution System",226,2950000,35,1048101429
19523,St. Lawrence,OGDENSBURG (C),Ogdensburg (C),"East David St. Infrastructure Replacement Project, Upgrade Distribution System",30,1926100,35,1050027529
19570,Westchester,PEEKSKILL (C),Peekskill (C),"Camp Field Reservoir dredging, Lower Wiccopee Dam spillway modifications, and water main replacement, Upgrade Surface Water Source, Upgrade Distribution System",25514,8166000,30,1058193529
19226,Niagara,PORTER (T),Porter (T),"Replacement of WM on 5 Areas of the Town, Upgrade Distribution System",6070,6785000,30,1064978529
18899,Wayne,WAYNE COUNTY WATER & SEWER AUTH,Lyons (T),"Replace approx. 23,000-LF of water main and appurtenances, Upgrade Distribution System",5500,14332625,30,1079311154
19279,Ulster,PORT EWEN WATER DISTRICT,Esopus (T),"Emergency interconnection infrastructure, WTP electrical updates, Water Main Replacement, Upgrade Water Treatment Plant, Upgrade Distribution System, New Inter-Connection",4500,3099200,30,1082410354
19202,Madison,HAMILTON (V),Hamilton (V),"NY Rt. 12B Water Main Replacement, new hydrants, valves and services, Upgrade Distribution System",4017,6446770,30,1088857124
18431,Warren,LAKE LUZERNE (T),Lake Luzerne (T),"Rehabilitate existing water storage tank and replace water mains, Upgrade Storage, Upgrade Distribution System",2500,2573000,30,1091430124
19816,Washington,HUDSON FALLS (V),Hudson Falls (V),"Warren Street Canal Crossing, Water Pumping Station Discharge Piping, Maple Street Canal Crossing, & Pearl Street WM Replacement, Upgrade Distribution System",2400,6444950,30,1097875074
19573,Sullivan,WURTSBORO (V),Wurtsboro (V),"Pennsylvania Ave and 1st St Well House Improvements, Upgrade Water Treatment Plant, Upgrade Ground Water Source",1265,1647200,30,1099522274
19160,Suffolk,SUFFOLK COUNTY WATER AUTHORITY,SCWA,"Replacement of Well No. 1A at the Adams Avenue Well Field., Upgrade Ground Water Source",1009264,1200000,25,1100722274
19765,Westchester,YONKERS (C),Yonkers (C),"Replacement of 750 LF of transmission main, Upgrade Distribution System",60070,1997720,25,1102719994
19551,Allegany,ALMOND (V),Almond (V),"Mill St. & Maple Ridge Water Main Improvements Project, Upgrade Distribution System",690,1025000,25,1103744994
19845,Dutchess,POUGHKEEPSIE WATER TREATMENT FACILITY,Poughkeepsie JWB,"Filter underdrain replacement, Upgrade Water Treatment Plant",74504,4415700,15,1108160694
19139,Suffolk,SUFFOLK COUNTY WATER AUTHORITY,SCWA,"Replacement of Well No. 2A at the Oval Drive Well Field., Upgrade Ground Water Source",3315,1200000,15,1109360694
19142,Suffolk,SUFFOLK COUNTY WATER AUTHORITY,SCWA,"Replacement of Well No. 3A at the Oval Drive Well Field., Upgrade Ground Water Source",3315,1200000,15,1110560694
19865,Nassau,WATER AUTH OF WESTERN NASSAU COUNTY,WAWNC,"Installation of additional AOP reactor at Station No. 57., Upgrade Water Treatment Plant",122276,1573000,10,1112133694
19148,Suffolk,SUFFOLK COUNTY WATER AUTHORITY,SCWA,"Replacement of 10,000 feet of water main., Upgrade Distribution System",34878,3427391,10,1115561085