APPLICANT NAME,REGION,DEP PROJECT RATING,STREET ADDRESS,CITY,COUNTY,PWSID,PROJRANK,FUND SOURCE,PROJECT COST,MTGDATE,PROJECT TYPE,PROJ. DESCRIPTION,PROB. DESCRIPTION,POPULATION,PV RATING,GREEN PROJECT,GREEN CATEGORY,BUSINESS CASE,GREEN AMOUNT
PITTSBURGH WATER & SEWER AUTH. - 2024 AND 2023 A2 SMALL DIA. MAIN REPL. (LEAD),V,76,441 SMITHFIELD ST.,PITTSBURGH,ALLEGHENY,5020038,1,DWSRF,"$7,390,224",10/15/2025,LSL,"Project will includes replacement of approximately 1,607 lead service lines, which includes an estimate 482 private lead service lines, 562 public lead service lines. Some customers will require both public and private side replacement while others will only receive either public or private replacement based upon where the lead pipe component is located.","Due to the advanced age of the pipes, replacement of these mains will reduce the frequency of water main breaks, which will minimize the risk to public health caused by the resulting potential exposure to infectious diseases and will reduce the impact of unplanned water outages and street closures required due to emergency repairs. The replacement of lead service lines will improve public health outcomes by reducing the amount of exposure to lead.","520,000",111,Yes,Water Efficiency,Not Required,"$75,000"
PENNSYLVANIA AMERICAN - COATSVILLE LSLR PHASE 1,I,75,"114 E. LINCOLN HWY, PO BOX 791",COATESVILLE,CHESTER,1150106,2,DWSRF,"$4,200,000",7/16/2025,LSL,"The proposed project includes replacement of 240 utility owned/private owned lead and galvanized lead impacted water service lines (complete water service line replacement), all located within the City of Coatesville Census Tracts 3054, 3055 and 3056 service areas. The proposed water service line replacement process includes excavating an approximate 5’x5’ pit at the existing water main generally within the paved roadway and an approximate 5’x5’ pit at the curb box generally near the public/private property line on the private property side of the roadway curb line. From those pits, it is proposed that the contractor will disconnect the existing lead line and pull a new service line through the same trench line between the two pits (main to curb box) and between the last pit and the home (curb box to home) for a complete lead service line replacement from the house to the watermain.",System has a number of owned/privately owned lead and galvanized lead impacted water service lines that are at least partially constructed of lead pipe. Lead is a large health issue with guidance to eliminate lead throughout the water system. Project will help eliminate lead and eliminate chance of lead poisoning within the service area.,"13,000",110,No,N/A,N/A,$0
PITTSBURGH WATER & SEWER AUTHORITY - 2025B LSLR,V,73,441 SMITHFIELD ST.,PITTSBURGH,ALLEGHENY,5020038,3,DWSRF,"$25,490,000",7/16/2025,LSL,"PWSA estimates that this project 2025B will replace around about 3,123 lead service lines. PWSA started efforts to replace public lead service lines in 2017 and included private lead service lines starting in early 2018. While great strides have been made in both corrosion control treatment (CCT) and Lead Service Line Replacement (LSLR), much work remains. As critical as CCT is to water quality, the issue of lead in drinking water will not be resolved until all lead service lines are removed from the system. PWSA’s goal is to remove all lead service lines by 2026 - – given the latest budget projections this has been extended to the end of 2027.","Based on PWSA's prioritization model run and following the previous Neighborhood LSLR Program 2023A, 2023B, 2024A, 2024B, and 2025A, PWSA estimates that this project 2025B will replace around about 3,123 lead service lines.","520,000",108,No,N/A,N/A,$0
"MERCERSBURG WATER AUTHORITY - WATER SYSTEM IMPROVEMENTS, PHASE 1",III,73,113 SOUTH MAIN ST,MERCERBURG,FRANKLIN,7280021,4,DWSRF,"$2,061,800",10/16/2024,"TREAT, WS, PS","This project includes construction of the Park Avenue water treatment facility which will treat water from the new Park Avenue Well (150-gpm). The new facility will contain systems for raw water straining, softening, nitrate removal, orthophosphate addition, sodium hypochlorite addition, and chlorine contact time. This project also includes construction of a 300,000-gal finished water storage tank and a 500-gpm booster pump station to deliver water from the new facility. The Buck Run water treatment facility will treat water from the existing Buck Run and Zimm wells, and will be submitted to PENNVEST as a separate project.","The Mercersburg Water Authority (Authority) owns the Buck Run filter plant which treats surface water from the Buck Run Reservoir. The existing reservoir and filter plant are in need of major rehabilitation or replacement as evidenced by numerous violations of the Safe Drinking Water Act which were recorded in a Notice of Violation (NOV) dated February 26, 2020. The Authority entered into a Consent Order and Agreement (COA) with the Department on September 10, 2020. This COA required the Authority to prepare an Existing Facilities and Treatment Alternative Study which outlined methods for compliance, the costs of those methods, and the Authority’s plan for achieving compliance. The Study concluded that the lowest cost, feasible compliance alternative was the development of a new groundwater source and the construction of two new water treatment facilities: the Park Avenue water treatment facility and the Buck Run water treatment facility. This alternative will allow the Authority to abandon the Buck Run Reservoir and existing filter plant.","2,350",88,No,N/A,N/A,$0
"MERCERSBURG WATER AUTHORITY – WATER SYSTEM IMPROVEMENTS, PHASE 2",III,73,113 SOUTH MAIN ST,MERCERBURG,FRANKLIN,7280021,5,DWSRF,"$3,845,572",1/21/2026,TREAT,"This water system improvement project includes abandoning the existing Buck Run water treatment facility and replacing it with a new greensand filtration facility. The new facility will treat water from the existing Buck Run Well with 50 gallon per minute capacity and the Zimm Well with 100 gallon per minute capacity using pH adjustment, oxidation and pressure filtration to remove iron, disinfection, and orthophosphate addition for corrosion control. The new facility, in conjunction with the Park Avenue well and treatment facility which are under construction, will allow the Authority to remove the Buck Run reservoir from service and continue to supply a reliable quality and quantity of water to its customers.","The Mercersburg Water Authority (Authority) owns the Buck Run filter plant which treats surface water from the Buck Run Reservoir. The existing reservoir and filter plant are in need of major rehabilitation or replacement as evidenced by numerous violations of the Safe Drinking Water Act which were recorded in a Notice of Violation (NOV) dated February 26, 2020. The Authority entered into a Consent Order and Agreement (COA) with the Department on September 10, 2020. This COA required the Authority to prepare an Existing Facilities and Treatment Alternative Study which outlined methods for compliance, the costs of those methods, and the Authority’s plan for achieving compliance. The Study concluded that the lowest cost, feasible compliance alternative was the development of a new groundwater source and the construction of two new water treatment facilities, the Park Avenue water treatment facility and the Buck Run water treatment facility. This alternative will allow the Authority to abandon the Buck Run Reservoir and existing filter plant.","2,350",88,No,N/A,Not Required,$0
WILKINSBURG-PENN JOINT WATER AUTHORITY - LEAD SERVICE LINE REPLACEMENTS PHASE 4,V,73,2200 ROBINSON BOULEVARD,WILKINSBURG,ALLEGHENY,5020056,6,DWSRF,"$10,000,000",1/21/2026,LSL,"Project includes replacement of 1,000 residential lead services lines throughout the service area with ¾ inch copper service line.","Authority has approximately 3,000 remaining service lines with lead that are mandated to be replaced by the latest edition of the Lead and Copper Rule. System also has very high unaccounted for water loss.","125,000",114,No,N/A,N/A,$0
PENNSYLVANIA-AMERICAN WATER COMPANY - UNIONTOWN LSLR PHASE 1,V,71,"300 GALLEY ROAD, P.O.BOX 1290",MCMURRAY,FAYETTE,5260020,7,DWSRF,"$5,400,000",10/15/2025,LSL,Project will include replacement of approximately 389 lead service lines as identified throughout the service area.,"To meet PADEP and EPA requirements, PAWC is required to replace all lead and lead impacted galvanized water service lines. PAWC has numerous lead service lines in the project areas and is working to replace the ones that we have currently identified.","23,125",106,No,N/A,N/A,$0
PITTSBURGH WATER & SEWER AUTHORITY- 2026A LSLR,V,70,441 SMITHFIELD ST.,PITTSBURGH,ALLEGHENY,5020038,8,DWSRF,"$31,510,340",1/21/2026,LSL,"Based on PWSA's prioritization model run and following the previous Neighborhood LSLR Program 2023A, 2023B, 2024A, 2024B, 2025A, and 2025B, PWSA estimates that this project 2026A will replace about 3,495 lead service lines. Total project cost is $34,847,620.83 including Pennvest $31,510,340.39 and Pittsburgh Water Capital $3,337,280.45.","PWSA started efforts to replace public lead service lines in 2017 and included private lead service lines starting in early 2018. While great strides have been made in both corrosion control treatment (CCT) and Lead Service Line Replacement (LSLR), much work remains. As critical as CCT is to water quality, the issue of lead in drinking water will not be resolved until all lead service lines are removed from the system. PWSA’s goal is to remove all lead service lines by 2026 - given the latest budget projections this has been extended to the end of 2027.","520,000",105,No,N/A,N/A,$0
THE MUNICIPAL AUTHORITY OF THE BOROUGH OF PORTAGE - WATERLINE & METER REPLACEMENT PROJECT,V,69,606 CAMBRIA STREET,PORTAGE,CAMBRIA,4110027,9,DWSRF,"$16,565,000",7/16/2025,"DS, LSL","The proposed project includes the installation of approximately 34,500 linear feet of water mains, approximately 15,700 linear feet of service lines, 24 fire hydrants, approximately 580 meter pits, and appurtenances by utilizing mostly open trench methods of excavation. Installations around railroad crossings and stream crossings will be completed by jack and bore to allow ease of replacement in the future, if required. The project also consists of replacing 6 identified lead and galvanized service lines and during construction, if any additional lead and galvanized service lines are encountered, the contractor will replace those as well.","Old, antiquated lines, exist in the system, many of which are nearing 100 years of service. This area has seen more breaks and leaks in recent months. Since the Authority has a high unaccounted water loss of 62.9%, this area seems to be a place to start water line replacement since it has a lot of older lines. As per a recommendation from the DEP, many of the meters will be removed from the structures and placed in meter pits at the property lines.","7,600",88,Yes,Water Efficiency,Not Required,"$13,323,800"
ERIE CITY WATER AUTHORITY - CUSTOMER SIDE GALVANIZED SERVICE LINE REPLACEMENT - PHASE 3,VI,68,340 WEST BAYFRONT PARKWAY,ERIE,ERIE,6250028,10,DWSRF,"$6,500,000",7/16/2025,LSL,"The project will replace galvanized, or wrought iron, lines on the customer (private) side that are currently or were previously downstream of a lead line, from the curb valve to the location where the service line enters the house. These services are often aged, deteriorated, and leaking as well. The project is Phase 3 of a 5 Phase effort. The project aims to replace approximately 860 total galvanized customer side service lines over a period of three years.","Existing galvanized, or wrought iron, lines on the customer (private) side that are currently or were previously downstream of a lead line, which can leach out lead in the water.","180,000",91,No,N/A,N/A,$0
ERIE CITY WATER AUTHORITY - CUSTOMER SIDE GALVANIZED SERVICE LINE REPLACEMENT - PHASE 4,VI,68,340 WEST BAYFRONT PARKWAY,ERIE,ERIE,6250028,11,DWSRF,"$10,000,000",10/15/2025,LSL,"The project will replace galvanized, or wrought iron, lines on the customer (private) side that are currently or were previously downstream of a lead line, from the curb valve to the location where the service line enters the structure, as well as where the public side of the service line was historically replaced over prior decades. The project is Phase 4 of a 5 Phase effort. The project aims to replace approximately 1,250 total galvanized customer side service lines within the City of Erie over a period of three years.","Erie Water Works (EWW) is on track to remove the majority of all lead goosenecks throughout the system. However, many galvanized requiring replacement customer side service lines remain where the public side of the service line was historically replaced over prior decades, most often due to leaks or ahead of street paving projects. In addition to being downstream of a gooseneck that was previously removed in prior years, many of these service lines when excavated, are found to be deteriorated, corroded, and often leaking.","180,000",103,No,N/A,N/A,$0
PENNSYLVANIA-AMERICAN WATER COMPANY - NEW CUMBERLAND LSLR PHASE 1,III,68,852 WESLEY DRIVE,MECHANICSBURG,CUMBERLAND,7210029,12,DWSRF,"$3,750,000",1/21/2026,LSL,"PAWC is proposing replacement of the customer-owned sides of each of the 382 service lines, which will result in a change in status from lead or GRR to non-lead. Line replacements will be completed using copper pipe and trenchless excavation. After an LSL replacement is completed, PAWC will provide the customer with a pitcher filter certified to ANSI/NSF Standard 53 (basis of design is the Brita OB06 model), six (6) months of replacement cartridges, and a sampling kit to be used for collecting the first draw and 5th liter tap samples. The customer will use the instructions provided in the kit to collect the required follow-up samples. A prepaid shipping label will be included with the kit so the customer can mail the samples to PAWC’s certified laboratory.","The Pennsylvania-American Water Company (PAWC) has applied for PENNVEST funding to replace lead service lines (LSL’s) within their “West” (also known as “New Cumberland”) service area (PWSID: 7210029). A partial service line inventory was provided on November 6, 2025. This inventory included a total of 382 service lines which are non-lead on the supplier-owned side and either lead or galvanized requiring replacement (GRR) on the customer-owned side. The pipe materials were identified through records reviews, customer surveys, or field-verification.","93,368",83,No,N/A,N/A,$0
WATTSBURG BOROUGH - STANDPIPE REPL. AND WATER TREATMENT PLANT UPGRADE ADVANCE FUNDING,VI,68,P.O. BOX 136,WATTSBURG,ERIE,6250094,13,STATE BYPASS,"$540,000",7/16/2025,TREAT,"Current project application is for advanced funding to cover design and permitting. Final project scope may include drilling a second well, replacing aging arsenic treatment system & building, and cleaning/repairing existing water standpipe.","Drinking water system is struggling to meet requirements from state and federal agencies and receiving violations from the DEP. Entire system is aging, more than 90% needs to be replaced.",378,103,No,N/A,N/A,$0
WESTERN BERKS WATER AUTHORITY - WATER TREATMENT PLANT IMPROVEMENTS,III,66,91 WATER ROAD,SINKING SPRING,BERKS,3060066,14,DWSRF,"$41,060,000",10/15/2025,TREAT,"The project includes additions and modifications to the Authority's water treatment plant (WTP) which will enable the facility to provide a long-term, reliable quality and quantity of water. A new sulfuric acid chemical feed system will be added so that the pH of the water entering the WTP can be regulated. The coagulant, fluoride, chlorine, polyphosphate, and ammonium sulfate chemical feed systems will be upgraded with new chemical feed pumps, storage tanks, feed lines, and appurtenances. The existing, outdated Greenleaf filters will be demolished and replaced with four new dual-media rapid rate gravity filters, each with a capacity of 2.67 million gallons per day (MGD). This will allow the WTP to operate at its maximum capacity of 8 million gallons per day(MGD) with one filter out of service. The existing clearwell will be baffled and a new 400,000-gallon clearwell will be constructed to enhance the resiliency of the WTP's disinfection system. Four new 1,800 gallons per minute high service pumps are proposed. Improvements to the sludge handling and processing systems will include a new 54,000-gallon backwash receiving tank, new sludge mixers and pumps, and an additional 3,000-square feet of sludge drying area. WTP's electrical, instrumentation, and process control systems will be upgraded to support the plant improvements.","The Authority's water treatment plant (WTP) serves approximately 25,000 residents in Berks County, PA. The WTP is nearly 50 years old, and many treatment plant components have reached the end of their service life. The Authority has identified deteriorating chemical feed equipment, suboptimal filter backwashing, lack of operational flexibility in the clearwell, and insufficient sludge handling capacity as problems that need to be addressed in a complete WTP rehabilitation. Additionally, the emerging presence of harmful algal blooms (HABs) and cyanotoxins in Blue Marsh Lake present treatment challenges that the current WTP is not equipped to handle.","25,000",81,No,N/A,N/A,$0
CITY OF LANCASTER - LEAD SERVICE LINE REPLACEMENTS 2025,III,66,150 PITNEY ROAD,LANCASTER,LANCASTER,7360058,15,DWSRF,"$1,709,338",7/16/2025,LSL,"The City of Lancaster (City) is applying for PENNVEST funding to replace 108 lead service lines (LSL's), most of which are located in the northwest and west-central regions of the city. All of these lines are lead on the system-owned side according to the City’s records and/or visual observations during the course of other utility work in the street. On the customer-owned side, eight (8) of these lines are lead, 10 are galvanized requiring replacement (GRR), and the remaining 90 are non-lead. All materials on the customer-owned sides of the service lines were field verified within the residences.","The LSL Replacement Plan states that only the lead or GRR segments of the LSL’s will be replaced with copper pipe (the existing copper segments will not be replaced), which is in accordance with DEP’s “Service Line Inventory Form” (3930-FM-BSDW0042a) revised October 2024. After an LSL replacement is completed, the City will provide the customer with a pitcher filter certified to ANSI/NSF Standard 53, six (6) months of replacement cartridges, and a sampling kit to be used for collecting the first draw and 5th liter tap samples. The customer will use the instructions provided in the kit to collect the required samples. The City will then pick up the samples and deliver them to the lab for analysis. This is the same procedure that the City currently uses for regular distribution system lead monitoring, and it has been approved by the Department’s Operations and Monitoring Section.","120,000",101,No,N/A,N/A,$0
CITY OF PHILADELPHIA EAST PARK BOOSTER PUMPING STATION,I,63,1101 MARKET STREET,PHILADELPHIA,PHILADELPHIA,1510001,16,DWSRF,"$68,775,000",1/22/2025,PS,"A new East Park Booster Pump Station will be constructed to replace the aging station and to provide upgrades to existing operations. The proposed project includes constructing a new building in the vicinity of the existing booster pump station. The new station will improve emergency resiliency by providing four pumps with 24 million gallon per day (MGD) capacity each, which provides an additional pump to allow for maintenance and repairs along with on-site emergency backup.","The existing East Park Booster Pump Station, built in 1937 near the intersection of Girard Avenue and 33rd Street, is a critical station in Philadelphia Water Department’s distribution system feeding the sole water transmission main that moves water from the east to the west side of the Schuylkill River. The station’s two main functions are to provide approximately seven (7) MGD of water into the Belmont gravity district during typical operation, and to act as the only emergency backup to the Belmont Water Treatment Plant during events, such as treatment plant upsets and large transmission main breaks. The existing station has three (3) pumps with a rated capacity of 25 MGD.","1,600,000",78,Yes,Energy Efficiency,N/A,"$8,150,000"
CITY OF PHILADELPHIA GEORGE'S HILL PUMP STATION,I,61,1101 MARKET STREET,PHILADELPHIA,PHILADELPHIA,1510001,17,DWSRF,"$47,650,000",10/15/2025,PS,"This project includes a new pump station at George's Hill Reservoir that will have the capacity to meet the typical peak daily demand of the Belmont High Pressure District at 21 million gallon per day (MGD) with six (6) pumps, redundant feed systems, standby generator, and on-site stormwater management. The upgrades to the existing Belmont station will include replacement of the pumps and interior modifications.",The new George's Hill Pump Station is required to provide redundancy to the Belmont High Service Pressure District and will draw water from the lower regions of West Philadelphia and pump it up to the northern section of this region. The existing Belmont High Pump Station must be upgraded to allow it to work in tandem with the new station. This critical infrastructure will improve functionality and increase resilience during emergency operations.,"1,600,000",76,Yes,Energy Efficiency,Not Required,"$1,760,000"
BOROUGH OF BRACKENRIDGE - WATER FILTRATION PLANT CONSENT ORDER IMPROVEMENTS,V,61,1000 BRACKENRIDGE AVENUE,BRACKENRIDGE,ALLEGHENY,5020006,18,DWSRF,"$5,950,000",4/23/2025,TREAT,"The Borough proposes to upgrade its existing water treatment plant to remedy structural and operational deficiencies. The project includes site piping improvements for the Clearwell and on-site distribution storage tanks to provide automatic shutdown capability isolating the Clearwell from distribution storage, construction of a new flocculation tank with flash mixing, installation of new Lamella plate clarifier equipment inside the existing clarifier tank, repairs and improvements to backwash equalization chamber and piping, improvement in general electrical control systems, and demolition of exterior circular clarifier in accordance with consent order and agreement (COA) with the Pennsylvania Department of Environmental Protection (PADEP).","Brackenridge Borough entered into a COA with the PADEP on June 27, 2024, to improve the water treatment plant. Improvements to the Clearwell and on-site distribution storage tanks are necessary to provide automatic shutdown capability isolating the Clearwell from distribution storage. As part of this project other improvements are proposed to remedy structural repairs needed which include clarifier improvements.","3,700",80,No,N/A,N/A,$0
CLEARFIELD MUNICIPAL AUTHORITY - MONTGOMERY RUN WATER TREATMENT FACILITY UPGRADES,IV,61,107 EAST MARKET STREET,CLEARFIELD,CLEARFIELD,6170008,19,DWSRF,"$25,900,000",4/23/2025,TREAT,"The project will construct a new treatment building which will house the membrane filtration system and associated equipment, as well as a new below grade baffled concrete Clearwell with new high service pumps. Several pieces of process equipment, chemical feed systems, pumps, valves, instrumentation, SCADA, and electrical equipment will also be replaced.",The Montgomery Run Water Treatment Facility is currently under a CO&A with the department and was constructed in 1990. Specific equipment no longer meets DEP regulations and is no longer reliable to produce drinking water to its customers. This project is step one in allowing CMA to move forward to rehabilitate the reservoir.,"14,000",84,No,N/A,N/A,$0
SCHUYLKILL COUNTY MUNICIPAL AUTHORITY MOREA SYSTEM IMPROVEMENTS,II,61,77 MAIN STREET,MOREA COLLIERY,SCHUYLKILL,3540021,20,DWSRF,"$8,450,000",1/22/2025,"SRC, TREAT, DS","The project consists of constructing a new treatment facility including iron and manganese removal, chemical supplication, and disinfection. The system will produce 144,000 gallons per day (GPD) of drinking water. A new 100 gallon per minute (gpm) submersible well pump and two 100 gpm high service booster pumps will be installed as well as 830 linear feet of 8-inch diameter ductile iron transmission main from the treatment plant to the distribution system. Additionally, 120 service lines will be equipped with new meters and any private service lines found to be lead will be replaced and all public service lines will be replaced.","Catastrophic failure hit the Morea Citizens Water Company (MCWC) on December 25, 2022, with a system tank completely failing. With failure of the tank, there was no water storage for operational, emergency, or fire purposes. An emergency interconnection was made to Schuylkill County Municipal Authority (SCMA) and the use of Well No. 2 was discontinued. SCMA has taken over the MCWC system and plans to complete the needed upgrades for source reliability in the event of emergencies or fire service needs.",225,86,No,N/A,N/A,$0
