APPLICANT NAME,REGION,DEP PROJECT RATING,STREET ADDRESS,CITY,COUNTY,PWSID,PROJRANK,FUND SOURCE,PROJECT COST,MTGDATE,PROJECT TYPE,PROJ. DESCRIPTION,PROB. DESCRIPTION,POPULATION,PV RATING,GREEN PROJECT,GREEN CATEGORY,BUSINESS CASE,GREEN AMOUNT
BUCKINGHAM TOWNSHIP HEARTHSTONE PFAS TREATMENT,I,60,3103 PHILMONT AVENUE,HUNTINGDON VALLEY,BUCKS,1090137,21,DWSRF,"$2,672,152",7/16/2025,PFAS,"The proposed treatment system will include a new building to house the proposed treatment system, air stripper, transfer pumps, granular activated carbon (GAC) filtration, and a backwash holding tank. The project will require an air stripper to reduce the radon that will be absorbed. SCADA controls will be installed to tie the PFAS system into the main control system. The project will be located at the Hearthstone Treatment Facility, which serves as a combined treatment facility for wells CS-3 and CS-4.","The Buckingham Township Cold Spring System serves residents in the northern portion of the Township. Samples of water collected at Entry Point (EP) 102 for wells CS-3 and CS-4 have been analyzed for PFOA and PFOS. Analytical results indicate PFOS levels of 12.56 ppt and PFOA level o 13.31 ppt at EP 102. It was also determined that an air stripper will be required to reduce the radon level in the water which impact the carbon disposal. The radon level, while not excessive, would cause a higher level of radioactive carbon for disposal which could cause higher disposal or reconditioning costs for the carbon.","4,760",65,No,N/A,N/A,$0
2025 NORTHAMPTON BUCKS COUNTY MUNICIPAL AUTHORITY CHURCHVILLE PUBLIC WATER PROJECT,I,58,111 TOWNSHIP ROAD,RICHBORO,BUCKS,1090089,22,DWSRF,"$19,919,605",4/23/2025,"DS, PFAS, TREAT","The scope of work currently proposed includes extension of the Northampton Bucks County Municipal Authority public water system to residences without water main access in the Churchville Manor and Hillside Manor subdivisions of Northampton Township, in addition to the connections to homes in the Churchville area that currently have water main access (for a total of 334 connections). The proposed work includes the construction of 8-inch water main, water service connections, fire hydrant and flushing station installations, and trench restoration. Project also includes PFAS treatment upgrades to all the NBCMA public wells that supply the PWS.","The Northampton, Bucks County Municipal Authority (NBCMA), is planning the connection of numerous parcels identified by NBCMA and Northampton Township to the public water system (PWS), in addition to treatment upgrades to all the NBCMA public wells that supply the PWS. NBCMA is currently participating in an Environmental Services Cooperative Agreement (ESCA) with the United States (US) Department of the Navy related to past activities which occurred at the former Naval Air Warfare Center (NAWC) Warminster facility neighboring Northampton Township to address groundwater contamination issues resulting from perfluorooctanesulfonic acid (PFOS) and perfluorooctanoic acid (PFOA). As per current ESCA modification No. 000004 “it is anticipated that future connections to the PWS will be required in addition to the construction/installation of new treatment systems to the public well number 7.” NBCMA is committed to fulfilling the ESCA with the Navy. NBCMA also will be required to install additional treatment systems to each of its public wells that supply the PWS as the new EPA MCLs of per- and polyfluoroalkyl substances (PFAS) will be enforced in approximately five years. Well source has PFOA level of 12.9 ppt and PFOS level of 6.8 ppt. Recurring exceedances of the proposed EPA PFAS MCLs, there have been exceedances of the Pennsylvania PFAS MCLs at Wells 2 and 4 in 2024. Furthermore, inquiries from residents about public water connection and access has spiked in recent times as residents have become more aware about the potential contamination issues.","36,750",63,No,N/A,N/A,$0
PITTSBURGH WSA - 2023 SMALL DIAMETER WATER MAIN REPLACEMENT (NON-LEAD),V,53,441 SMITHFIELD ST.,PITTSBURGH,ALLEGHENY,5020038,23,DWSRF,"$62,672,221",10/16/2024,DS,"This project will replace an estimated 52,880 feet of 8-inch and 12-inch water lines thus replacing older and undersized mains. 2023 Small Diameter Water Main Replacement – Contract A1, 2023 Small Diameter Water Main Replacement – Contract B1, and 2023 Small Diameter Water Main Replacement – Contract B2 include the replacement of aging 8” to 12” diameter pipes with new zinc coated ductile iron pipe ranging from 8” to 12”. This work includes the replacement of water mains, valves, fire hydrants, and water service lines. Water mains were selected for replacement based on a number of risk-factors, including the prioritization of undersized mains, and mains with a history of break.","Due to the advanced age of the pipes, replacement of these mains will reduce the frequency of water main breaks, which will minimize the risk to public health caused by the resulting potential exposure to infectious diseases and will reduce the impact of unplanned water outages and street closures required due to emergency repairs. The replacement of older, leak prone mains will also provide for more efficient management of water resources by reducing the amount of treated water that is lost from the system. Furthermore, the additional volume of water that will be able to be delivered to areas with inadequate flow will reduce restrictions on development within the affected areas","520,000",84,Yes,Water Efficiency,N/A,"$68,646,695"
PITTSBURGH WATER & SEWER AUTH. - 2024 AND 2023 A2 SMALL DIA. MAIN REPL. (NON-LEAD),V,53,441 SMITHFIELD ST.,PITTSBURGH,ALLEGHENY,5020038,24,DWSRF,"$70,350,208",10/15/2025,DS,"This project will replace an estimated 49,710 feet of 4-inch and 16-inch water lines thus replacing older and undersized mains. 2023 Small Diameter Water Main Replacement – Contract A2, 2024 Small Diameter Water Main Replacement – Contract B, and 2024 Small Diameter Water Main Replacement – Contract C include the replacement of aging 4” to 16” diameter pipes with new zinc coated ductile iron pipe ranging from 4” to 16”. This work includes the replacement of water mains, valves, fire hydrants, and water service lines. Water mains were selected for replacement based on a number of risk-factors, including the prioritization of undersized mains, and mains with a history of break.","Due to the advanced age of the pipes, replacement of these mains will reduce the frequency of water main breaks, which will minimize the risk to public health caused by the resulting potential exposure to infectious diseases and will reduce the impact of unplanned water outages and street closures required due to emergency repairs. The replacement of older, leak prone mains will also provide for more efficient management of water resources by reducing the amount of treated water that is lost from the system. Furthermore, the additional volume of water that will be able to be delivered to areas with inadequate flow will reduce restrictions on development within the affected areas.","520,000",80,Yes,Water Efficiency,Not Required,"$86,181,584"
PA AMERICAN WATER COMPANY - BERWICK PFAS WTP,IV,51,P O BOX 267,BERWICK,COLUMBIA,4190013,25,DWSRF,"$25,450,000",10/15/2025,"TREAT, PFAS","This project includes constructing a new water treatment plant (WTP). Raw water from the four wells will be conveyed from the Canal Street well site via a new pipeline to the new WTP. The WTP will have a buried clearwell, wetwell, and granular activated carbon (GAC) pressure filters. Disinfection and corrosion control will be included at the new facility. Sodium hypochlorite will replace the existing gas chlorine system. A corrosion inhibitor will be used, consistent with the current chemical used at the existing treatment site. The finished water will be conveyed from the new WTP to the existing distribution system via a new finished water transmission main.",The project aims to add the perfluoroalkyl and polyfluoroalkyl substances (PFAS) removal capabilities at the Pennsylvania American Water Company (PAWC) Berwick facilities. Current well source has identified PFOA level of 11.5 ppt. The project will reduce the PFOA levels in the finished drinking water to the customers.,"16,000",70,No,N/A,N/A,$0
ALTOONA WATER AUTHORITY - HORSESHOE CURVE AND KETTLE WATER TP OZONE SYS. UPGRADE,III,51,20 GREENWOOD ROAD,ALTOONA,BLAIR,4070023,26,DWSRF,"$9,750,000",7/16/2025,TREAT,"The existing ozonation systems at the Kettle WTP (one treatment train) and the Horseshoe Curve WTP (two treatment trains) will be replaced with new equipment including systems for liquid oxygen storage and preparation, nitrogen generation, ozone generation, gas injection, ozone destruction, and ambient gas monitoring. Additionally, the aluminum sulfate and sodium hydroxide bulk chemical storage tanks will be replaced at the Horseshoe Curve WTP.","The Altoona Water Authority (Authority) operates six (6) water treatment plants (WTPs), all of which use ozone for the dual purposes of taste/odor control and oxidation of iron/manganese. Ozonation systems were first installed in each of the WTPs in the 1990s, and those systems started reaching the end of their design life after almost 30 years of use. The old systems are no longer manufactured and the Authority has found it difficult to acquire spare parts. The Authority has upgraded the ozone systems at the Mill Run, Plane Nine, and Tipton WTPs and upgrades at the Bellwood WTP are currently under construction. Similar upgrades are now planned for the Kettle WTP and the Horseshoe Curve WTP.","62,500",66,No,N/A,N/A,$0
LIVERPOOL MUNICIPAL AUTHORITY- 2025 WATER SYSTEM IMPROVEMENTS,III,50,P O BOX 241,LIVERPOOL,PERRY,7500014,27,STATE BYPASS,"$930,000",7/16/2025,DS,"The Borough has identified a section of watermain pipe located within Front Street between State Route 17 and Perry Street as a high priority for replacement. This project includes the replacement of approximately 3,640 linear feet of existing 6-inch cast iron pipe with new 6-inch diameter ductile iron (DI) pipe. The project will also include the replacement of 65 water service lines and curb stops, the installation of four (4) fire hydrants, and the installation of 13 gate valves. The new water main will allow for the safe distribution of finished water to the Borough’s existing and future customers.","Liverpool Borough's water distribution system includes aged cast iron watermains which are 60 years old. Despite leak detection and repair efforts, the distribution system has been experiencing an increasing number of main breaks resulting in service disruptions to customers and unaccounted water loss.",934,65,Yes,Water Efficiency,Not Required,"$1,913,100"
MASONTOWN BOROUGH WATER METER REPLACEMENT PROJECT,V,49,2 COURT AVENUE,MASONTOWN,FAYETTE,5260013,28,DWSRF,"$4,498,972",10/15/2025,METERS,The proposed Project is to install exterior meter pits and replace meters at all service connections in order to reduce Borough water losses from the service connection to the customer water meter (currently located in the home).,Water meters are currently located within the customer's house and therefore all water losses from the water main to the customer are borne by Masontown Borough. The intent of the Project is to relocate the water meter to the legal line of ownership.,"3,700",72,Yes,Water Efficiency,N/A,"$4,498,986"
CONEMAUGH TOWNSHIP MUNICIPAL AUTHORITY-METER PIT INSTALLATION PROJECT,V,48,"BOX 13, R D #3",HOLLSOPPLE,SOMERSET,4560048,29,DWSRF,"$12,581,250",1/21/2026,METERS,"The Conemaugh Township Municipal Authority meter and meter pit installation project consists of approximately 2,200 new meter and pits in the water distribution system. Meter pits will be placed on the property line of each customer and connected to the existing service lines.",The Conemaugh Township Municipal Authority has experienced high water loss (64 percent in 2023) and the existence of many long service lines that do not currently have meter and meter pits. Several meters are located within homes nd need manual reading wvery month. This project will reduce water loss and increase revenue for the Authority.,"8,200",71,Yes,Water Efficiency,N/A,"$12,581,250"
CHESTER WATER AUTHORITY SUSQUEHANNA PUMPING STATION RELIABILITY IMPROVEMENTS,I,48,P.O. BOX 467,CHESTER,CHESTER,1230004,30,DWSRF,"$19,277,386",10/15/2025,"PS, TREAT","The scope of the major station improvements is to replace the existing three constant feed pumps (Pumps #1-3) with 1,500 HP vertical turbine pumps with new variable frequency drives (VFDs); o Remove existing variable speed pump (Pump No. 4); Install a 2800 kW backup generator capable of running (2) of the 1,500 HP pumps on VFDs; replace the existing switchgear equipment and transformer; replace the existing 1,000 kW generator with a smaller power generator used for house power and SCADA reliability; remove hydraulic system on discharge valves and replace with combination electrical and individual hydraulic actuators capable of the necessary valve closing times during an emergency pump stop; remove unnecessary bypass and backflush piping; replace permanganate dry chemical system with liquid skid-mounted sodium permanganate chemical system with two (2) positive displacement pumps; demolish existing Chemical Building and constructing a new Chemical Storage Room next to the Pumping Station Building; replace existing control system equipment with up-to-date hardware and network infrastructure.","Chester Water Authority (CWA) is seeking funding for reliability improvements of their Susquehanna Booster Station. The Susquehanna Raw Water Pumping Station provides the only alternate source water to Chester Water Authority’s Octoraro Water Treatment Plant’s primary source water, the Octoraro Reservoir. In recent years, operational challenges have limited the station’s functionality. Some of the station’s components have reached their serviceable lifespan and are due for replacement. Other systems require upgrades to improve operational functionality and reliability. These improvements will provide increased station functionality and reliability with additional flow control, reduced maintenance, and improved emergency power systems. The project location will be within Fulton Township in Lancaster County; however, these facilities are permitted by the DEP Southeast Regional Office as the facilities serve customers in Chester and Delaware Counties.","138,453",73,No,N/A,N/A,$0
JACKSON TOWNSHIP WATER AUTHORITY - WATER DISTRIBUTION SYSTEM IMPROVEMENT PROJECT,V,47,"R.D. #8, BOX 112",JOHNSTOWN,CAMBRIA,4110021,31,DWSRF,"$4,477,000",10/15/2025,"PS, DS, WS","The Jackson Township Water Authority (JTWA) plans to rehabilitate several of their current facilities including the George Wyse Pump Station, the Whitetail Road Pump Station, and the Mile Hill Storage Tank. The George Wyse Pump Station and the Whitetail Road Pump Station rehabilitation will include replacing pumps, controls, variable frequency drives (VFDs), and interior piping within the existing pump station structure. Approximately 5,000 linear feet of 8-inch polyvinyl chloride (PVC) waterline will be installed between the George Wyse Pump Station and SR 22 in order to replace the existing 6-inch waterline. Existing services will be upgraded with a new 0.75-inch plastic pipe up to or near the property line, where it will be reconnected to the existing curb stop or meter pit. The project also consists of increasing the height of the Mile Hill Storage Tank from approximately 29 feet to approximately 89 feet. This involves installing new tank panels at the bottom and jacking up existing panels of the glass lined steel tank. No modifications to the tank foundation are proposed initially.","The Authority currently serves 1,444 customers all of which are located within Jackson Township, Cambria County. The major problems that are going to be resolved with this project are the existing overall condition of the George Wyse Pump Station, the insufficient pumping capacity of the George Wyse Pump Station and the Whitetail Road Pump Station, and the insufficient storage capacity of the Mile Hill Storage Tank. The George Wyse Pump Station has been at or past its life expectancy for many years now. It was originally constructed in the 1950’s and has never had a major renovation. Additionally, an increase in water demand in the Mile Hill Storage Tank zone has placed additional strain on the existing George Wyse and Whitetail Road Pump Stations.","3,198",52,Yes,Water Efficiency,N/A,"$1,850,000"
THE MUNICIPAL AUTHORITY OF THE TOWNSHIP OF WASHINGTON - WATER SYSTEM IMPROVEMENTS,V,46,1390 FAYETTE AVE,BELLE VERNON,FAYETTE,5260009,32,DWSRF,"$5,100,000",7/16/2025,"TREAT, DS","The Authority is proposing to replace the motor control center, raw water pump, and supervisory control and data acquisition (SCADA) system at its existing water treatment plant as well as the replacing approximately 15,000 linear feet of 6-inch, 8-inch and 12-inch diameter water lines. The project also includes the rehabilitation of the water treatment plant filters. Air scour will be provided through new underdrains within the filters. New filter media and filter troughs will also be provided as a part of the project.","Most of the equipment within the motor control center is outdated and reached the end of its useful life. If the motor control center failed, the Authority would not be able to produce water for a number of days. The Department has identified several issues with the filters, including loss of media and leaking troughs. Furthermore, the Department has recommended that the Authority add an air scour system to the filters. The SCADA system was installed on the water distribution system in 2006. Much of the control system equipment is now outdated. The Authority has also identified ten sections of water lines throughout the system that need to be replaced. Most of these water lines are 2-inch diameter, which is not properly sized for fire hydrants. Additionally, this reduced line size results in higher pumping costs to the Authority. These water lines also have a history of breaks which cause water outages to the Authority’s customers as well as excessive and costly damages to public roads and private property.","9,100",65,Yes,Water Efficiency,N/A,"$3,326,400"
HIGHLAND SEWER AND WATER AUTHORITY - CROYLE WATER LINE PROJECT CONTRACT 2025-W-02,V,45,120 TANK DRIVE,JOHNSTOWN,CAMBRIA,4110017,33,DWSRF,"$8,226,760",1/21/2026,"DS, METERS","The Highland Sewer and Water Authority (HSWA) is proposing the Croyle waterline improvement project located in Cambria county. This second phase, called Contract 2025-W-02, includes the installation of 45,000 linear feet (LF) of water line, water service lines from the water main to the property line, and water appurtenances necessary for the system. The project will also include the installation of new meter pits and residential service meters for all Croyle customers to modernize metering and allow for better integration into the HSWA system.","Highland Sewer and Water Authority (HSWA) owns and operates a water treatment plant and public water distribution system which serves over 10,000 customers in 17 different municipalities within Cambria County, PA. Additionally, HSWA sells “bulk” water to 13 smaller water utility owners which distribute and re-sell water to their customers. One of these utility owners is Croyle Township Water Authority (CTWA) (which servers 4 different municipalities). CTWA purchases all their water from HSWA. Due to difficulties managing and maintaining a public water system, CTWA is proposing to transfer ownership and operation of their water system to HSWA. Ownership will be transferred to HSWA, and HSWA will take over billing for these customers. There will be no interruption of service or changes in water quality because of this transfer. Prior to assuming ownership, HSWA is proposing many of the older or problematic water lines be replaced within the CTWA system. The pipes and appurtenances within the system are past their anticipated useful life and are prone to breaks and water loss.","24,310",70,Yes,Water Efficiency,Not Required,"$240,000"
WOODBURY WATER AUTHORITY - MILL STREET (T-635) WATERLINE REPLACEMENT,III,45,BOX 66,WOODBURY,BEDFORD,4050023,34,STATE BYPASS,"$984,768",7/16/2025,DS,"The project consists of the replacement of 2,375-ft of existing 6-inch watermain within Mill Street (T-635) with new 6-inch diameter C-900 PVC watermain. There are two potential add alternates including the replacement of 250-ft of 4-inch diameter watermain in the Hickory Bottom Road right of way with new 4-inch diameter C-900 PVC watermain, and the replacement of 225-ft of ¾-inch waterline running north from Mill Street with 2-inch diameter C-900 PVC waterline. The project also includes reestablishing 34 existing service connections and the installation of three (3) fire hydrants and one (1) blowoff assembly.","The Woodbury Water Authority owns existing water main pipes within Mill Street (T-635) between Main Street and Hickory Bottom Road. This section of watermain is aging and there have been past instances of pipe breakages, leaks, service interruptions, and boil water notices.",295,50,Yes,Water Efficiency,Not Required,"$1,508,370"
AQUA PENNSYLVANIA WATER MAIN REPLACEMENTS (2024-2027) (PROFI),I,45,762 LANCASTER AVE.,BRYN MAWR,CHESTER,1460073,35,DWSRF,"$77,500,000",7/17/2024,DS,"The Proposed work includes twenty-one (21) water main replacement projects for planned construction in years 2024 through 2027. Construction for the first phase of projects is planned to commence in spring of 2025; identification of the individual projects that will be included in the first phase is dependent on the receipt of any relevant approvals and other requirements. As identified above, the water main replacements will take place throughout fourteen (14) municipalities and four (4) counties in the southeastern region of Pennsylvania. The total estimated linear footage of water main replacement is nearly 133,400 lineal feet with pipes ranging from 8 to 20 inches in diameter.","Aqua is initiating several capital improvements collectively titled Aqua PA Water Main Replacements (2024-2027) to be located in multiple streets within the municipalities of Bensalem Township, Hatboro Borough, Lower Southampton Township, and Warminster Township, Bucks County; Tredyffrin Township, Uwchlan Township, and West Bradford Township, Chester County; Aldan Borough, Haverford Township, Marple Township, Nether Providence Township, Springfield Township, and Upper Darby Township, Delaware County; and, Collegeville Borough, Lower Merion Township, and Perkiomen Township, Montgomery County. The new water mains will be installed within existing roadway, public right-of-way, and previously disturbed and maintained areas. These projects will construct new water mains to replace existing water mains that are at the end of useful life, history of leaks, and/or in poor condition.","747,460",60,No,N/A,N/A,$0
"YOUNGSVILLE BOROUGH - WATER RESERVOIR, WELL, AND TREATMENT SYSTEM UPGRADES",VI,45,40 RAILROAD STREET,YOUNGSVILLE,WARREN,6620039,36,STATE BYPASS,"$2,191,511",7/16/2025,TREAT,"The proposed project involves improvements/replacements to the chlorine feed room ventilation system; structural rehab, drain installation, ventilation system replacement, and roof system replacement at the water storage reservoirs; electrical system upgrades, roof replacement, cosmetic rehab at the water storage reservoir access building; and the installation of a new operation monitoring system.",The Youngsville Borough has a 60+ y/o reservoir that is at risk of failing and needs structural improvements. Backup reservoir also needs repairs.,"2,004",60,No,N/A,N/A,$0
