Rank,Points,Project Title,Project Number,Benefited Population,Problem Description,Project Description,Applicant Name,County,Leg District,Cong District,W/S,PFA,Public/Private,System Size,Disadvantaged,Start Date,End Date,Total Cost ($),Green Cost ($),MDE Funding Requested ($),CD Code,Loan Interest,Audit,Plan,Green Type,Design Date,Project Type,Compliance,pwsid,requested_funding
1,117,NEW WINTERS RUN WATER TREATMENT FACILITY,DW0016,15500,70-YEAR OLD PLANT SITUATED IN 100-YR FLOOD PLAIN + TREATMENT REQUIRED FOR CRYPTOSPORIDIUM IN SUPPLY,CONSTRUCT NEW 2 MGD WATER TREATMENT PLANT IN STAGES TO REPLACE AGING PLANT,"BARRY L. SUITS, MARYLAND AMERICAN WATER",Harford,34B,1,N,3,PRIVATE,Large,0,09/01/2022,06/30/2024,"$18,000,000","$9,000,000","$9,000,000",1,Y,Y,Y,,06/01/2021,TREATMENT,,MD0120003,9000000
2,110,POCOMOKE CITY WIIN-CIPP LINING MARKET STREET MAINS - PHASE I,DW0004,4075,HIGH RUST AND CONTAMINANTS IN WATER SYSTEM,RELINE WATER MAINS USING CIPP LINING PROCESS,"LINDA MCNEIL, POCOMOKE CITY",Worcester,38A,1,Y,2,PUBLIC,Small,1,05/01/2023,05/31/2024,"$2,256,700","$843,923",$0,1,,Y,,,06/01/2022,TRANSMISSION/DISTRIBUTION,Y,MD023006,843923
3,100,BRIERCREST APARTMENTS WATER SERVICE,DW0017,60,CONTAMINATED DRINKING WATER SOURCE SERVING 24 APARTMENT UNITS,CONSTRUCT 94 LF OF 8-IN WATER MAIN TO CONNECT APARTMENTS TO FREDERICK CO CAMBRIDGE FARMS WATER SYSTEM (PWS MD 0100033),"RODNEY WINEBRENNER, FREDERICK COUNTY",Frederick,3B,6,Y,Y,PRIVATE,Small,0,10/01/2023,12/31/2023,"$121,178","$121,178","$121,178",1,Y,,,,01/01/2023,TRANSMISSION/DISTRIBUTION,Y,MD0100004,121178
4,97,WINCHESTER ROAD WATER LINE REPLACEMENT (LAVALE),DW0025,6218,AGING AND FAILING WATER MAIN REQUIRES REPLACEMENT,"REPLACE ~15,000 LF WATER TRANSMISSION MAIN ALONG WINCHESTER ROAD IN LAVALE","DAVID S. WENDT, LAVALE SANITARY DISTRICT",Allegany,1B,6,Y,Y,PUBLIC,Small,1,06/01/2023,12/31/2024,"$5,072,800","$4,602,800","$4,602,800",1,Y,Y,Y,,02/01/2022,TRANSMISSION/DISTRIBUTION,,MD0010016,4602800
5,97,SPRINGFIELD WELLS / FAIRHAVEN WELL HOUSE,DW0015,32673,PROVIDE A RELIABLE SUPPLEMENTAL AND BACKUP GROUNDWATER SUPPLY TO LIBERTY RESERVOIR,DRILL 2 ADDITIONAL WELLS AND RESTORE FAIRHAVEN WELL AND WELLHOUSE TO OPERATING ORDER,"JEFFREY D. CASTONGUAY, BOARD OF CARROLL CO COMMISSIONERS",Carroll,9A,8,N,Y,PUBLIC,Large,0,03/01/2023,05/31/2024,"$4,030,000","$1,000,000",$0,1,,Y,,,03/01/2021,SOURCE,,MD006002,1000000
6,95,SPRINGVIEW MOBILE HOME PARK WATER SERVICE,DW0021,93,SOURCE DRINKING WATER CONTAMINATED WITH PFOA AND PFOS,"INSTALL 1,321 LF 8-IN WATER MAIN + 2-IN CONNECTION ETC TO CONNECT TO NEW DESIGN WATER SYS IN FRED CO","RODNEY WINEBRENNER, FREDERICK COUNTY",Frederick,3B,8,Y,Y,PUBLIC,Large,0,11/01/2023,03/31/2024,"$632,772","$632,772","$632,772",1,Y,,,,01/01/2023,TRANSMISSION/DISTRIBUTION,Y,MD0100030,632772
7,90,COULBOURNE LANE WELL BACKUP POWER,DW0002,2150,NO BACKUP POWER TO LARGEST PRODUCING WELL FOR WATER SYSTEM,FURNISH AND INSTALL EMERGENCY GENERATOR AND AUTOMATIC TRANSFER SWITCH TO TOWN'S LARGEST PRODUCTION WELL,"RICK POLLITT, TOWN OF SNOW HILL",Worcester,38B,1,Y,Y,PUBLIC,Small,1,06/01/2023,07/31/2023,"$223,064","$218,064","$218,064",1,Y,,,,07/01/2022,SOURCE,,MD0230007,218064
8,90,EMMITSBURG NORTH SETON AVENUE WATER LINE REPLACEMENT,DW0018,2770,WATER PRESSURE COMPLIANCE AND RESOLVE WATER QUALITY COMPLAINTS,"REPLACE 1,584 LF OF DETERIORATING 6-IN AND 4-IN UNLINED CAST IRON PIPING WITH NEW 8-IN DUCTILE IRON PIPE ALONG N. SETON AV","CATHY WILLETS, TOWN OF EMMITSBURG",Frederick,4,8,Y,Y,PUBLIC,Small,0,10/01/2023,01/31/2024,"$1,170,552","$1,145,552","$1,145,552",1,Y,Y,,G,09/01/2022,TRANSMISSION/DISTRIBUTION,,MD0100010,1145552
9,90,EMMITSBURG DEPAUL STREET WATER LINE REPLACEMENT,DW0019,6925,WATER PRESSURE COMPLIANCE AND RESOLVE WATER QUALITY COMPLAINTS,"REPLACE 1,850 LF 6-IN AND 4-IN UNLINED CAST IRON PIPING WITH 8-IN DUCTILE IRON PIPE","CATHY WILLETS, TOWN OF EMMITSBURG",Frederick,4,8,Y,Y,PUBLIC,Small,0,10/01/2023,01/31/2024,"$1,135,000","$1,110,000","$1,110,000",1,Y,Y,,,09/01/2022,TRANSMISSION/DISTRIBUTION,,MD0100010,1110000
10,90,MACK WATER STORAGE TANK REPLACEMENT,DW0034,25580,TANK HAS EXCEEDED USEFUL LIFE AND DEVELOPS LEAKS. EXTENDED REPAIRS LEAVE FIRE PROTECTION VULNERABLE.,REPLACE 50+ YEAR OLD 1M GAL GROUND STORAGE TANK,"WILLIAM LUHN, CITY OF HAGERSTOWN -- UTILITIES DEPARTMENT",Washington,2C,6,Y,2,PUBLIC,Large,1,05/01/2023,12/31/2023,"$4,600,000","$4,000,000","$4,000,000",1,Y,Y,Y,,07/01/2022,STORAGE,,MD0210010,4000000
11,87,POWHATAN STREET WATER MAIN REPLACEMENT,DW0042,573,BARE CAST IRON MAINS WITH TUBERCULATION AND BREAKS,"REPLACE 1.85 MI SMALL DIA 4-IN, 8-IN, 10-IN & 12-IN WATER MAINS IN NEW CARROLLTON","CAVILLE STANBURY-WOOLERY, WASHINGTON SUBURBAN SANITARY COMMISSION",WSSC,22,5,Y,Y,PUBLIC,Large,1,06/01/2023,07/31/2024,"$2,461,000","$2,461,000","$2,461,000",1,Y,Y,Y,,10/01/2017,TRANSMISSION/DISTRIBUTION,,MD0150005,2461000
12,80,HORIZON WAY WATER MAIN REPLACEMENT,DW0041,610,BARE CAST IRON MAINS WITH TUBERCULATION AND BREAKS,"REPLACE 2.30 MI SMALL DIA 4-IN, 8-IN & 10-IN WATER MAINS IN FORESTVILLE AND DISTRICT HGTS","CAVILLE STANBURY-WOOLERY, WASHINGTON SUBURBAN SANITARY COMMISSION",WSSC,25,4,Y,Y,PUBLIC,Large,1,06/01/2023,10/31/2024,"$3,400,000","$3,400,000","$3,400,000",1,Y,Y,Y,,04/01/2018,TRANSMISSION/DISTRIBUTION,,MD0150005,3400000
13,80,TOWN OF GRANTSVILLE CHESTNUT RIDGE WATER SYSTEM,DW0030,920,AREA NOT SERVED BY PUBLIC WATER EXPERIENCING EXCESS SALT IN WELLS FROM RT 40,"CONSTRUCT NEW PUBLIC WATER SYSTEM FOR CHESTNUT RIDGE COMMUNITY, INCL 12-IN MAIN, NEW WTP, NEW WELL, & NEW 470,000 GAL TANK","ROBIN JONES, TOWN OF GRANTSVILLE",Garrett,1A,6,Y,Y,PUBLIC,Small,1,05/01/2023,08/31/2024,"$8,064,990","$8,035,000","$8,035,000",1,Y,Y,,,03/01/2022,OTHER,,MD,8035000
14,75,BOONSBORO DRINKING WATER RESERVOIR REPLACEMENT,DW0036,7528,"1.5M GAL DRINKING WATER RESERVOIR LEAKS 15,000-25,000 GPD",REPLACE LEAKING DRINKING WATER IMPOUNDMENT WITH PRESTRESSED CONCRETE SPLIT-TANK RESERVOIR,"PAUL MANTELLO, TOWN OF BOONSBORO",Washington,2A,6,Y,2,PUBLIC,Small,0,01/01/2023,12/31/2023,"$4,100,000","$1,000,000",$0,1,,Y,Y,W,02/01/2022,STORAGE,,MD0210002,1000000
15,72,MONTGOMERY KNOLLS WATER MAIN REPLACEMENT,DW0040,388,BARE CAST IRON MAINS WITH TUBERCULATION AND BREAKS,REPLACE 2.77 MI SMALL DIA 8-IN & 10-IN WATER MAINS,"CAVILLE STANBURY-WOOLERY, WASHINGTON SUBURBAN SANITARY COMMISSION",WSSC,20,8,Y,Y,PUBLIC,Large,0,03/01/2023,10/31/2024,"$4,416,000","$4,416,000","$4,416,000",1,Y,Y,Y,,10/01/2019,TRANSMISSION/DISTRIBUTION,,MD0150005,4416000
16,72,WC-1199 ASHBURTON PUMPING STATION REHABILITATION,DW0007,1800000,PUMP STATION FOR ASHBURTON RESERVOIR IS AGING/UNRELIABLE,"CONSTRUCT MAJOR MODS TO HYDRAULIC, MECHANICAL, AND ELECTRICAL SYSTEMS AS WELL AS THE STRUCTURE","AARON MOORE, MAYOR AND CITY COUNCIL OF BALTIMORE",Baltimore City,41,7,Y,Y,PUBLIC,Large,1,07/01/2023,07/31/2027,"$67,964,878","$27,818,640","$27,818,640",1,Y,Y,Y,,07/01/2014,TRANSMISSION/DISTRIBUTION,,MD0300002,27818640
17,72,WC-1199 ASHBURTON PUMPING STATION REHABILITATION,DW0022,?,PUMP STATION FOR ASHBURTON RESERVOIR IS AGING/UNRELIABLE,"CONSTRUCT MAJOR MODS TO HYDRAULIC, MECHANICAL, AND ELECTRICAL SYSTEMS AS WELL AS THE STRUCTURE","ROBERT BURROS, BALTIMORE COUNTY, MARYLAND",Baltimore County,41,7,Y,Y,PUBLIC,Large,0,07/01/2023,07/31/2027,$0,"$31,943,493","$31,943,493",1,Y,Y,Y,,07/01/2014,TRANSMISSION/DISTRIBUTION,,MD0300002,31943493
18,70,YOURTEE SPRINGS WATER DISTRIBUTION,DW0020,2363,FREQUENT BREAKS - 85-YEAR-OLD WATER LINE SUPPLIES 20% OF DRINKING WATER TO CITY OF BRUNSWICK - OUTAGES AND CONTAMINATION,RE-LINE THE ENTIRE 8-MILE YOURTEE DISTRIBUTION LINE,"DAVID DUNN, MAYOR & COUNCIL CITY OF BRUNSWICK",Frederick,04-Jun,6,Y,2,PUBLIC,Small,0,12/01/2022,12/31/2023,"$5,000,000","$4,200,000",$0,1,,Y,,,02/01/2022,TRANSMISSION/DISTRIBUTION,Y,MD0100005,4200000
19,70,TOWN OF WESTERNPORT - WATER DISTRIBUTION SYSTEM IMPROVEMENTS - PHASES 5-7,DW0038,2448,FAILING WATER MAINS OVER 100 YR OLD. CONTINUATION OF REPLACEMENTS.,"REPLACE 53,000 LF WATER MAINS, 2 PUMP STATIONS, 2 GROUND-MOUNTED WATER STORAGE TANKS, VALVES, HYDRANTS, & APPURTENANCES","AARON LATTANZIA, TOWN OF WESTERNPORT",Allegany,1A,6,Y,Y,PUBLIC,Small,1,12/01/2023,12/31/2024,"$18,192,000","$18,162,000","$18,162,000",1,Y,,,W,07/01/2019,TRANSMISSION/DISTRIBUTION,,MD0010033,18162000
20,70,TRANSMISSION MAINS REPLACEMENT-HAGERSTOWN,DW0033,108600,DETERIORATED 90+ YEAR OLD TRANSMISSION MAIN PIPING WITH INCREASING FAILURES,"PHASE 2 OF MULTI-PHASE PROJ. REPLACE 6,000 LF OF 2 PARALLEL 24-IN MAINS WITH DUCTILE IRON 36-IN MAINS","WILLIAM LUHN, CITY OF HAGERSTOWN -- UTILITIES DEPARTMENT",Washington,2C,6,Y,2,PUBLIC,Large,1,10/01/2023,12/31/2026,"$17,250,000","$15,000,000","$15,000,000",1,Y,Y,Y,,07/01/2022,TRANSMISSION/DISTRIBUTION,,MD210010,15000000
21,65,FRANKLIN AVENUE WELL REPLACEMENT,DW0003,5045,WELL #2 IS 58 YEARS OLD AND HAS OUTLIVED ITS USEFUL LIFE - REPLACEMENT NEEDED FOR REDUNDANT WATER SUPPLY TO SYSTEM,BUILD TEST WELL AND REPLACE WELL #2,"JEFF FLEETWOOD, TOWN OF BERLIN",Worcester,38C,1,Y,Y,PUBLIC,Small,1,06/01/2023,08/31/2023,"$160,000","$130,000","$130,000",1,Y,Y,,,07/01/2022,SOURCE,,MD0230001,130000
22,65,TOWN OF GRANTSVILLE WATER IMPROVEMENT PROJECT,DW0031,9200,"GRANTSVILLE WATER LEAKS, SERVICE SPRINGS GO DRY IN SUMMER, AGING INFRASTRUCTURE FROM 1930S","CONSOLIDATE GRANTSVILLE WTP AND GREEN WTP, ABANDON GRANTSVILLE WTP, EXPAND GREEN WTP CAPACITY + ADD 420,000-GAL TANK AT GREEN","ROBIN JONES, TOWN OF GRANTSVILLE",Garrett,1A,6,N,Y,PUBLIC,Small,1,05/01/2023,08/31/2024,"$9,182,990","$9,153,000","$9,153,000",1,Y,Y,,,03/01/2022,OTHER,,MD,9153000
23,60,MOUNTAIN LAKE PARK & LOCH LYNN HEIGHTS WATER LINE REPLACEMENT PROJECT,DW0029,3275,DETERIORATING PIPES LEAKING >40% INTO SURROUNDING AREA. AREAS OF LOW WATER PRESSURE AND LOW FIRE FLOW,"REPLACE 133,075 LF WATER LINE WITH ADEQUATELY SIZED PIPES","BOBBY WITT, GARRETT COUNTY SANITARY DISTRICT",Garrett,1A,6,Y,Y,PUBLIC,Small,1,08/01/2023,09/30/2028,"$1,602,274","$1,587,274","$1,587,274",1,Y,Y,Y,,07/01/2022,TRANSMISSION/DISTRIBUTION,,MD0110007,1587274
24,60,MIDLAND/GILMORE RAW WATER STORAGE TANK,DW0027,4500,DAM INSPECTION CLASSIFIED A HIGH HAZARD POTENTIAL AND RATED UNSAFE,"DECOMMISSION EXISTING MIDLAND GILMORE RESERVOIR, RESTORE ELK LICK RUN, AND CONSTRUCT 6 MG RAW WATER STORAGE TANK","TYLER RAYNER, TOWN OF LONACONING",Allegany,1A,6,Y,2,PUBLIC,Small,1,10/01/2023,11/30/2024,"$9,904,840","$9,904,840","$9,904,840",1,Y,,,,07/01/2022,STORAGE,Y,MD0010018,9904840
25,55,DEHAVEN/MASON ROAD WATER PROJECT,DW0026,95,50+ YR OLD WATER LINES CANNOT BE MAINTAINED BY 2 PVT WATER COMPANIES. TAKEOVER BY ALLEGANY CO WILL ENABLE TECH/MGRL COMPLIANCE,"REPLACE ~8,000 FT NEW WATER LINE + 35 WATER CONNECTIONS AND APPURTENANCES","JIM WEBBER, ALLEGANY COUNTY COMMISSIONERS",Allegany,1B,6,Y,3,PUBLIC,Small,1,01/01/2023,12/31/2023,"$1,000,000","$1,000,000","$1,000,000",2,Y,,,,06/01/2022,TRANSMISSION/DISTRIBUTION,,MD,1000000
26,55,NEW WINDSOR MD ROUTE 31 WATER MAIN IMPROVEMENTS,DW0014,163,AGING AND INADEQUATE SUPPLY LINES THAT DO NOT MEET CURRENT CODE,CONSTRUCT NEW PARALLEL WATER DISTRIB SYSTEM - 3900 FT 12-IN + 400 FT 8-IN + 450 FT 6-IN WATER PIPES + APPURTENANCES,"GARY P. DYE JR., TOWN OF NEW WINDSOR",Carroll,5,8,Y,Y,PUBLIC,Small,0,08/01/2022,08/31/2023,"$4,277,748","$1,960,000","$1,960,000",1,Y,,,,06/01/2017,TRANSMISSION/DISTRIBUTION,,MD0060008,1960000
27,55,SHARPSBURG WATER METER CRADLE REPLACEMENT,DW0032,1500,CURRENT WATER METERS AND CRADLES CONTAIN LEAD,REPLACE EXISTING WATER METERS AND CRADLES,"MARK BRADSHAW, WASHINGTON COUNTY BOARD OF COUNTY COMMISSIONERS",Washington,2A,6,Y,2,PUBLIC,Small,0,06/01/2023,01/31/2024,"$1,000,000","$700,000","$700,000",1,Y,Y,,,05/01/2022,OTHER,,MD0210017,700000
28,52,SOUTH END WATER MAIN REPLACEMENT PROJECT (NO. 2-22-W),DW0028,1325,"CAST IRON WATER MAINS, MOST OVER 120 YR OLD, FREQUENT BREAKS","REPLACE 7,000 LF 12-IN AND 5,000 LF 6-IN WATER MAINS","ROBERT SMITH, MAYOR AND CITY COUNCIL OF CUMBERLAND",Allegany,1,6,Y,Y,PUBLIC,Large,1,08/01/2024,05/31/2025,"$4,114,000","$4,114,000","$4,114,000",1,Y,Y,Y,,01/01/2023,TRANSMISSION/DISTRIBUTION,,MD0010008,4114000
29,52,WC-1243 CROMWELL PUMPING STATION REHABILITATION,DW0006,1800000,AGING PUMPING STATION NECESSARY PART OF SYSTEM TO PROVIDE SAFE/RELIABLE DRINKING WATER,"CONSTRUCT REPAIR/REPLACE/REHAB OF EQUIPMENT, SYSTEMS, AND STRUCTURE INC. CHLORINATION SYSTEM","AARON MOORE, MAYOR AND CITY COUNCIL OF BALTIMORE",Baltimore City,8,3,Y,Y,PUBLIC,Large,1,07/01/2022,07/31/2026,"$63,352,661","$17,654,544","$17,654,544",1,Y,Y,Y,,07/01/2015,TRANSMISSION/DISTRIBUTION,,MD0300002,17654544
30,52,WC-1243 CROMWELL PUMPING STATION REHABILITATION,DW0024,?,AGING PUMPING STATION NECESSARY PART OF SYSTEM TO PROVIDE SAFE/RELIABLE DRINKING WATER,"CONSTRUCT REPAIR/REPLACE/REHAB OF EQUIPMENT, SYSTEMS, AND STRUCTURE INC. CHLORINATION SYSTEM","ROBERT BURROS, BALTIMORE COUNTY, MARYLAND",Baltimore County,8,3,Y,Y,PUBLIC,Large,0,07/01/2022,07/31/2026,$0,"$29,775,751","$29,775,751",1,Y,Y,Y,,07/01/2015,TRANSMISSION/DISTRIBUTION,,MD0300002,29775751
31,45,RC WILLSON WTP CHEMICAL UPGRADE,DW0035,108600,WTP CANNOT RECEIVE CHEMICAL DELIVERIES DURING HIGH WATER EVENTS,"EXPAND STORAGE CAPACITY OF PRIMARY COAGULANT POLYMER TANKS + INSTALL CHLORINE SCRUBBER TO NEUTRALIZE CHLORINE LEAK OF 2,000LB","WILLIAM LUHN, CITY OF HAGERSTOWN -- UTILITIES DEPARTMENT",Washington,2C,6,Y,2,PUBLIC,Large,1,05/01/2023,12/31/2023,"$1,150,000","$1,000,000","$1,000,000",1,Y,Y,Y,,07/01/2022,TREATMENT,,MD210010,1000000
32,42,WC-1281 SOUTH ST & VICINITY (DOWNTOWN) WATER MAIN REPLACEMENT,DW0009,600000,DETERIORATION OF UNLINED CAST IRON PIPE PAST ITS USEFUL LIFE,"REPLACE 11,761 LF 3-IN THROUGH 20-IN DIA PIPE IN 1ST PRESSURE ZONE","AARON MOORE, MAYOR AND CITY COUNCIL OF BALTIMORE",Baltimore City,46,7,Y,Y,PUBLIC,Large,1,11/01/2023,11/30/2024,"$10,484,177","$10,484,177","$10,484,177",1,Y,Y,Y,,08/01/2022,TRANSMISSION/DISTRIBUTION,,MD3000002,10484177
33,42,"WC-1318 DOWNTOWN, BOLTON HILL, GUILFORD NEIGHBORHOODS & VICINITY WATER MAIN REPL",DW0011,600000,DETERIORATION OF UNLINED CAST IRON PIPE PAST ITS USEFUL LIFE,"REPLACE 30,995 LF 3-IN THROUGH 20-IN DIA PIPE IN 1ST, 2ND AND 3RD E PRESSURE ZONES","AARON MOORE, MAYOR AND CITY COUNCIL OF BALTIMORE",Baltimore City,REG,7,Y,Y,PUBLIC,Large,1,09/01/2023,03/31/2026,"$24,232,901","$24,232,901","$24,232,901",1,Y,Y,Y,,06/01/2022,TRANSMISSION/DISTRIBUTION,,MD300002,24232901
34,42,WC-1322 BELAIR RD NEIGHBORHOOD AND VICINITY WM REPLACEMENTS,DW0013,600000,DETERIORATION OF UNLINED CAST IRON PIPE PAST ITS USEFUL LIFE,"REPLACE 19,202 LF 6-IN THROUGH 16-IN DIA PIPE IN 2ND PRESSURE ZONE","AARON MOORE, MAYOR AND CITY COUNCIL OF BALTIMORE",Baltimore City,45,"3,7",Y,Y,PUBLIC,Large,1,11/01/2023,11/30/2025,"$14,327,306","$14,327,306","$14,327,306",1,Y,Y,Y,,08/01/2022,TRANSMISSION/DISTRIBUTION,,MD300002,14327306
35,42,WC-1229 VERNON PUMPING STATION REHABILITATION,DW0005,1800000,AGING PUMPING STATION NECESSARY PART OF SYSTEM TO PROVIDE SAFE/RELIABLE DRINKING WATER,"CONSTRUCT REPAIR/REPLACE/REHAB OF EQUIPMENT, SYSTEMS AND STRUCTURE INC. INSTALLATION OF EMERGENCY GENERATOR","AARON MOORE, MAYOR AND CITY COUNCIL OF BALTIMORE",Baltimore City,43,7,Y,Y,PUBLIC,Large,1,07/01/2022,07/31/2025,"$72,118,232","$33,949,188","$33,949,188",1,Y,Y,Y,,08/01/2015,TRANSMISSION/DISTRIBUTION,,MD0300002,33949188
36,42,WC-1229 VERNON PUMPING STATION REHABILITATION,DW0023,?,AGING PUMPING STATION NECESSARY PART OF SYSTEM TO PROVIDE SAFE/RELIABLE DRINKING WATER,"CONSTRUCT REPAIR/REPLACE/REHAB OF EQUIPMENT, SYSTEMS AND STRUCTURE INC. INSTALLATION OF EMERGENCY GENERATOR","ROBERT BURROS, BALTIMORE COUNTY, MARYLAND",Baltimore County,43,7,Y,Y,PUBLIC,Large,0,07/01/2022,07/31/2025,$0,"$28,847,293","$28,847,293",1,Y,Y,Y,,08/01/2015,TRANSMISSION/DISTRIBUTION,,MD0300002,28847293
37,40,SMITHSBURG WATER STREET WATER LINE REPLACEMENT PROJECT,DW0037,4478,"LACK OF WATER PRESSURE, ESPECIALLY IN THE EVENT OF FIRE SUPPRESSION. REMOVE CAST IRON PIPES AND LEAD JOINTS.","REPLACE ALL WATER LINES, SEWER LINES, AND UPDATE STORM WATER MANAGEMENT AT STREET LEVEL","CHAD ROONEY, TOWN OF SMITHSBURG",Washington,2A,6,Y,Y,PUBLIC,Small,0,10/01/2023,03/31/2024,"$1,653,123","$1,002,100","$1,002,100",1,Y,,,,08/01/2023,TRANSMISSION/DISTRIBUTION,,MD0210018,1002100
38,40,ANACOSTIA DEPOT RECONFIGURATION,DW0043,2100000,"IMPROVE EFFICIENCY OF OPERATIONS, FLOODPLAIN VULNERABILITIES OF LARGEST WSSC WATER DEPOT","RECONFIGURATION OF ANACOSTIA DEPOT LAYOUT, INCL ACCESS, CIRCULATION, AND RENOVATION OF BLDGS UP TO CURRENT CODE","BRIAN HALLORAN, WASHINGTON SUBURBAN SANITARY COMMISSION",WSSC,47A,4,Y,Y,PUBLIC,Large,0,01/01/2023,12/31/2026,"$42,838,000","$21,414,000","$21,414,000",1,Y,Y,Y,,07/01/2021,OTHER,,MD0150005,21414000
39,37,WC-1279 DISTRIBUTION WATER MAIN REPLACEMENT & REHAB SEFTON AREA & VICINITY,DW0008,1585,DETERIORATION OF UNLINED CAST IRON PIPE PAST ITS USEFUL LIFE,"REPLACE 19,420 LF 6-IN THROUGH 12-IN DIA PIPE IN 3RD E PRESSURE ZONE","AARON MOORE, MAYOR AND CITY COUNCIL OF BALTIMORE",Baltimore City,45,3,Y,Y,PUBLIC,Large,1,03/01/2023,09/30/2024,"$119,423,360","$11,942,336","$11,942,336",1,Y,Y,Y,,12/01/2021,TRANSMISSION/DISTRIBUTION,,MD300002,11942336
40,37,WC-1313 UPPER FELLS POINT & WEST CANTON,DW0010,1585,DETERIORATION OF UNLINED CAST IRON PIPE PAST ITS USEFUL LIFE,"REPLACE 25,924 LF 4-IN THROUGH 20-IN+30-IN+40-IN DIA PIPE IN 1ST AND 2ND PRESSURE ZONE","AARON MOORE, MAYOR AND CITY COUNCIL OF BALTIMORE",Baltimore City,46,1,Y,Y,PUBLIC,Large,1,05/01/2023,11/30/2024,"$16,002,796","$16,002,796","$16,002,796",1,Y,Y,Y,,02/01/2022,TRANSMISSION/DISTRIBUTION,,MD300002,16002796
41,37,"WC-1319 KESWICK ROAD, WEST 36TH STREET & YORK ROAD WATER MAIN REPL",DW0012,1628,DETERIORATION OF UNLINED CAST IRON PIPE PAST ITS USEFUL LIFE,"REPLACE 12,171 LF 4-IN THROUGH 20-IN DIA PIPE IN 2ND AND 3RD E PRESSURE ZONES","AARON MOORE, MAYOR AND CITY COUNCIL OF BALTIMORE",Baltimore City,REG,REG,Y,Y,PUBLIC,Large,1,08/01/2023,08/31/2024,"$13,900,478","$13,900,478","$13,900,478",1,Y,Y,Y,,04/01/2022,TRANSMISSION/DISTRIBUTION,,MD300002,13900478
42,35,BEACHES WATER CO-OP (BWC) REDUCING LEAD IN DRINKING WATER SERVICE LINE REPL,DW0039,2010,AGED PIPING AND FITTINGS WITH LEAD CONTAMINATION,REPLACE 2-IN OD OR LESS SECONDARY SERVICE LINES AND FITTINGS UP TO EACH RESIDENTIAL METER,"DENNIS DIBELLO, BEACHES WATER CO-OP",Calvert,2C,5,?,?,PUBLIC,Small,0,09/01/2023,09/30/2025,"$1,500,000","$1,500,000","$1,500,000",1,Y,,,,06/01/2023,TRANSMISSION/DISTRIBUTION,,MD,1500000
43,25,MARTINGHAM SMART WATER METER,DW0001,770,"REPLACE OLD, INACCURATE, DIFFICULT-TO-READ WATER METERS WITH SMART METERS",INSTALLATION OF SMART METER FOR 313 RESIDENTIAL PROPERTIES + 2 COMMERCIAL PROPERTIES,"JAY T. FRENCH, MARTINGHAM UTILITIES COOPERATIVE",Talbot,37B,1,Y,2,PRIVATE,Small,1,04/01/2023,07/31/2023,"$141,378","$141,378","$141,378",1,Y,,,G,09/01/2022,OTHER,,MD0200004,141378