Project #,County,System Name/Borrower,Description,Pop.,Project Cost,Score,Cumulative Total,CODES,List
19765,Westchester,YONKERS (C) / Yonkers (C),"Replacement of 750 LF of transmission main, Upgrade Distribution System","60,070","$1,997,720",25,"$1,113,326,729",,IIJA Gen Supp
19551,Allegany,ALMOND (V) / Almond (V),"Mill St. & Maple Ridge Water Main Improvements Project, Upgrade Distribution System",690,"$1,025,000",25,"$1,114,351,729",,IIJA Gen Supp
19959,Dutchess,POUGHKEEPSIE WATER TREATMENT PLANT / Poughkeepsie JWB,"Thickened Sludge Storage Tank Replacement, Upgrade Water Treatment Plant","77,048","$3,283,000",15,"$1,117,634,729",,IIJA Gen Supp
19845,Dutchess,POUGHKEEPSIE WATER TREATMENT PLANT / Poughkeepsie JWB,"Filter underdrain replacement, Upgrade Water Treatment Plant","74,504","$4,415,700",15,"$1,122,050,429",,IIJA Gen Supp
19742,Orange,GREENWOOD LAKE (V) / Greenwood Lake (V),"Phase II Water System Improvements, Upgrade Storage","3,000","$3,086,910",15,"$1,125,137,339",,IIJA Gen Supp