"PROJRANK","COUNTY","PWSID","PROJECT COST","DEP PROJECT RATING","APPLICANT NAME","STREET ADDRESS","CITY","PROJECT TYPE","FUND SOURCE","MTGDATE","REGION","POPULATION","PV RATING","GREEN CATEGORY","GREEN PROJECT","BUSINESS CASE","LOAN #","GREEN AMOUNT","PROJ. DESCRIPTION","PROB. DESCRIPTION"
"17","CAMBRIA","4110017","$8,266,350","45","HIGHLAND SEWER AND WATER AUTHORITY - CROYLE WATER LINE PROJECT CONTRACT 2025-W-03","120 TANK DRIVE","JOHNSTOWN","DS, METERS","DWSRF","4/15/2026","V","24,310","70","Water Efficiency","Yes","Not Required","82259","$360,000","The Highland Sewer and Water Authority (HSWA) is proposing the Croyle  water line improvement project located in Cambria County. The third phase called Contract 2025-W-03, includes installation of 51,000 linear feet (LF) of transmission and distribution waterline with all necessary appurtenances within Croyle Township, East Taylor Township, and Cambria Township. Work includes the installation of water line, water service line from the water main to the property line, and water appurtenances necessary for the system. Three new pressure relief valve (PRV) vaults are to be added to the system to reduce dangerous pressure levels that currently exist within the Croyle Township main lines. The project will also include the installation of new meter pits and residential service meters for all Croyle customers along the alignment to modernize metering and allow for better integration into the HSWA system.","Highland Sewer and Water Authority (HSWA) owns and operates a water treatment plant and public water distribution system which serves over 10,000 customers in 17 different municipalities within Cambria County, PA. Additionally, HSWA sells “bulk” water to 13 smaller water utility owners which distribute and re-sell water to their customers. One of these utility owners is Croyle Township Water Authority (CTWA) (which servers 4 different municipalities). CTWA purchases all their water from HSWA. Due to difficulties managing and maintaining a public water system, CTWA is proposing to transfer ownership and operation of their water system to HSWA. Ownership will be transferred to HSWA, and HSWA will take over billing for these customers. There will be no interruption of service or changes in water quality because of this transfer. Prior to assuming ownership, HSWA is proposing many of the older or problematic water lines be replaced within the CTWA system. The pipes and appurtenances within the system are past their anticipated useful life and are prone to breaks and water loss. The additional tanks and pump stations will also improve water pressure conditions as well as the longevity and serviceability of the system."
"18","CAMBRIA","4110017","$8,226,760","45","HIGHLAND SEWER AND WATER AUTHORITY - CROYLE WATER LINE PROJECT CONTRACT 2025-W-02","120 TANK DRIVE","JOHNSTOWN","DS, METERS","DWSRF","1/21/2026","V","24,310","70","Water Efficiency","Yes","Not Required","80317","$240,000","The Highland Sewer and Water Authority (HSWA) is proposing the Croyle  waterline improvement project located in Cambria county. This second phase, called Contract 2025-W-02, includes the installation of 45,000 linear feet (LF) of water line, water service lines from the water main to the property line, and water appurtenances necessary for the system. The project will also include the installation of new meter pits and residential service meters for all Croyle customers to modernize metering and allow for better integration into the HSWA system."," Highland Sewer and Water Authority (HSWA) owns and operates a water treatment plant and public water distribution system which serves over 10,000 customers in 17 different municipalities within Cambria County, PA. Additionally, HSWA sells “bulk” water to 13 smaller water utility owners which distribute and re-sell water to their customers. One of these utility owners is Croyle Township Water Authority (CTWA) (which servers 4 different municipalities). CTWA purchases all their water from HSWA. Due to difficulties managing and maintaining a public water system, CTWA is proposing to transfer ownership and operation of their water system to HSWA. Ownership will be transferred to HSWA, and HSWA will take over billing for these customers. There will be no interruption of service or changes in water quality because of this transfer. Prior to assuming ownership, HSWA is proposing many of the older or problematic water lines be replaced within the CTWA system. The pipes and appurtenances within the system are past their anticipated useful life and are prone to breaks and water loss."
"19","CAMBRIA","4560013","$4,195,560","45","WINDBER AREA AUTHORITY - MINE 40 WATERLINE REPLACEMENT PROJECT","1409 SOMERSET AVENUE","WINDBER","DS","DWSRF","4/15/2026","V","9,454","60","Water Efficiency","Yes","Not Required","82256","$3,119,528","This project primarily consists of the installation of approximately 9,650 LF of new 6-inch diameter through 12-inch diameter water distribution piping as well as associated infrastructure for both distribution piping and water service connections to approximately 224 users. Water service connection infrastructure is anticipated to include water service lines, appurtenances, and meter pits. The existing Authority-owned water service piping will be replaced to the customers’ private property line as part of the project. Work will in most cases end at the private property lines; however, several sections of Authority-owned service lines need to be replaced within private property boundaries. Easements will be obtained for these sections as needed.","The existing waterlines within the Mine 40 Area are a mixture of 120-year old 4-inch cast-iron pipe and approximately 40-year-old asbestos cement pipe. Most service lines in this area are composed of approximately 70-year old copper line. There are some 100-year old galvanized service lines present as well. Line breaks and reduced fire flow rates are an issue. In addition, Scalp Level Borough’s upcoming Sanitary Sewer & Storm Sewer Rehab/Separation Project is in the same project area and anticipated to put additional stress on the existing lines. The new sewer lines will cross the existing water lines in many locations. Water loss is also an issue system-wide. No lead service lines are known to exist within the project area."
"20","CAMBRIA","4110017","$8,516,670","44","HIGHLAND SEWER AND WATER AUTHORITY CROYLE WATER LINE PROJECT CONTRACT 2025-W-01","120 TANK DRIVE","JOHNSTOWN","WS, PS","DWSRF","10/15/2025","V","24,310","65","N/A","No","N/A","80304","$0","Highland Sewer and Water Authority (HSWA) is proposing the Croyle Water Project. The project is located in Cambria Township, Croyle Township, East Taylor Township, Jackson Township, and Summerhill Borough, Cambria County, Pennsylvania. HSWA is proposing to complete a water system improvement that includes the addition and replacement of all necessary appurtenances within the Beaverdam system through multiple phases. For the first phase (called as Contract 2025-W-1), the project consists of the installation of three water storage tanks and three pump stations (two new water tanks and a pump station will be added to the system; A tank and two existing pump stations will be also replaced) as well as all appurtenances and site work necessary to complete these installations and connection to the proposed waterline to be installed under the applications of future phases.","Highland Sewer and Water Authority (HSWA) owns and operates a water treatment plant and public water distribution system which serves over 10,000 customers in 17 different municipalities within Cambria County, PA. Additionally, HSWA sells “bulk” water to 13 smaller water utility owners which distribute and re-sell water to their customers. One of these utility owners is Croyle Township Water Authority (CTWA) (which servers 4 different municipalities). CTWA purchases all their water from HSWA. Due to difficulties managing and maintaining a public water system, CTWA is proposing to transfer ownership and operation of their water system to HSWA. Ownership will be transferred to HSWA, and HSWA will take over billing for these customers. There will be no interruption of service or changes in water quality because of this transfer. Prior to assuming ownership, HSWA is proposing many of the older or problematic water lines be replaced within the CTWA system.  The pipes and appurtenances within the system are past their anticipated useful life and are prone to breaks and water loss. The additional tanks and pump stations will improve water pressure conditions, the longevity and serviceability of the system."
"21","MONROE","2450063","$5,046,571","43","PENNSYLVANIA AMERICAN WATER COMPANY - PINE HILL WELL PFAS/MN TREATMENT IMPROVEMENTS","P O BOX 718","MOUNT POCONO","TREAT, PFAS","DWSRF","10/15/2025","II","17,860","58","N/A","No","N/A","80312","$0","The project includes the demolition of the existing wellhouse and construction of a new treatment facility at the existing Pine Hill well station, disposal of process wastewater, and other related work to address PFAS and iron and manganese in the raw water. The new treatment facility will include GAC adsorbers and green sand filters. New concrete tanks will be utilized for holding backwash waste. Further chemical feed system improvements to help meet the requirements. New 4-inch ductile will be installed for raw flow to the treatment building. The existing submersible well pump will be replaced, and the existing high service pumps will be replaced.","Pine Hill Well - The Pine Hill well shows PFOS level of 6.6 ppt and PFOA level of 4.7 ppt. Manganese sampling levels of 0.64 mg/L exceeding the secondary MCL of 0.05 mg/L."
"22","ERIE","6250028","$12,000,000","43","ERIE CITY WATER AUTH.- SIGSBEE/RSW PUMP STATIONS, VALVE VAULT & LINE REPL PRO-FI","340 WEST BAYFRONT PARKWAY","ERIE","PS","DWSRF","7/16/2025","VI","180,000","62","N/A","No","N/A","80293","$0","The proposed Pro-Fi application will include the following projects, with the Sigsbee Pump Station Upgrade planned to be the lead project:  Sigsbee Pump Station Upgrade; RSW WTP West Lake Pump Station and Low Duty Pump Station Variable Frequency Drives; RSW WTP Low Service Pump Station Variable Frequency Drives; Sigsbee Reservoir Valve Vault Reconstruction; Kuntz Road Water Main Replacement; McClelland Avenue Water Main Replacement; Frontier Area (Backyards) Water Main Replacements.","This application is being made in conjunction with the PENNVEST Programmatic Financing guidelines and addresses seven projects in the Erie Water Works Capital Improvement Plan.  The lead shovel ready project is the Sigsbee Pump Station Upgrade.  The soft starters at the Sigsbee Pump Station are obsolete and one of the existing three pumps is inoperable. There are no parts for the starters and if failure occurs they have to be replaced with new starters, however, Staff intends to utilize variable frequency drives (VFD) in the future to accurately control flow and pressure under any circumstance.  All three pumps will be replaced, electrical gear will be updated, the roof and windows will be replaced, and other miscellaneous facility improvements will occur."
"23","CLINTON","4180048","$8,800,000","43","CITY OF LOCK HAVEN - YOUNGDALE WELL FIELD DEVELOPMENT","20 E CHURCH ST","LOCK HAVEN","SRC, TREAT, TRANS","DWSRF","10/15/2025","IV","9,890","58","N/A","No","N/A","80305","$0","The project will include the development of two (2) groundwater wells that will be connected to the regional Central Clinton County Water Filtration Authority (CCCWFA) water treatment plant. The new well operation building will house electrical equipment, a supervisory control and data acquisition (SCADA) unit, transfer switch, and exterior emergency generator. Extension of 3-phase power to the well sites is also included. Approximately 9,545 linear feet of new 12-inch to 16-inch diameter well transmission line will interconnect to the water treatment plant by an exterior vault with all required internal plant pipe connections and chemical feed injection points. Additional treatment, filtration, disinfection, and finished water pumping will occur at the CCCWFA plant. A master pressure control and monitoring facility will be installed along Youngdale Road to regulate downstream system pressure and to meter water flow to the City service area.","Recent water shortages caused by drought and inadequate reservoir capacity have resulted in frequent usage restrictions. Sometimes water reserves have been so limited that alternative water supplies were employed to provide drinking water to the service area."
"24","CLARION","6160010","$7,346,392","43","REDBANK VALLEY MUNICIPAL AUTHORITY - WATER SYSTEM IMPROVEMENTS","212 LAFAYETTE ST","NEW BETHLEHEM","TREAT, TRANS, DS","DWSRF","1/21/2026","VI","3,150","74","N/A","No","N/A","80315","$0","This water system improvement project will include the installation of 9,880 linear feet (LF) of 6-inch diameter water line, 2,700 LF of 8-inch diameter water line, 1,800 LF of 10-inch diameter water line, fire hydrants, and appurtenances. In the water treatment plant, aging tube settlers will be replaced with inclined plate settlers and filter media.","Redbank Valley Municipal Authority has experienced 44 percent to 48 percent unaccounted for water losses in their distribution system. Leaks have been identified along the Olean Trail in Porter Township, and in New Bethlehem Borough. There is also a lack of fire protection along Broad Street in South Bethlehem Borough since the existing fire hydrants are not operable. The water treatment plant has also been underperforming. The existing project area has aging water lines that have had numerous breaks. The tube settlers need to be replaced to better trap the solids in the settling area."
"25","BUTLER","5100012","$28,500,000","43","PA AMERICAN WATER COMPANY - BUTLER WATER TREATMENT PLANT FILTER IMPROVEMENTS","2936 ELLWOOD ROAD","NEW CASTLE","TREAT","DWSRF","10/15/2025","VI","43,044","58","N/A","No","N/A","80306","$0","The Project includes upgrading the Butler Water Treatment Plant's sedimentation and filtration systems to address capacity limitations and ensure reliable treatment, the demolishing three (3) aging Aldrich purification units, and constructing a new treatment building and concrete tank structure. Within this facility, three (3) 6-million-gallons-per-day (MGD) Actiflo ballasted flocculation and sedimentation trains will be installed, along with four (4) 4-MGD dual-media gravity filtration units with air scouring capability providing 12.0 MGD capacity with one (1) unit out of service. The project also includes rerouting process piping (influent, effluent, wash water, wastewater, sanitary, and filter to waste lines), rerouting chemical feed lines, and electrical and control system modifications as well as related work. The improvements will be constructed in phases to maintain plant operation and minimize service disruptions.","The existing WTP utilizes three (3) Aldrich purification units to perform mechanical flocculation, sedimentation, and filtration. While the facility has a rated capacity of 11.9 MGD with all units in service, its capacity is reduced to 7.1 MGD when one unit is out of service, which will not meet the projected maximum day demand of the system. The existing water treatment plant has capacity limitations and needs improved water treatment reliability. With aging infrastructure, the sedimentation and filtration performance of the existing Aldrich units is no longer optimal, and the risk of system shortfall during peak demand or unit outages poses a threat to water system resiliency."
"26","CAMBRIA","4110041","$15,253,200","41","SOUTHWESTERN CAMBRIA COUNTY WATER AUTHORITY ~ WATERLINE REPLACEMENT PROJECT","1422 FRANKSTOWN ROAD","JOHNSTOWN","DS, METERS","DWSRF","4/15/2026","V","4,400","60","Water Efficiency","Yes","Not Required","82257","$255,000","This project mainly consists of the installation of approximately 34,000 linear feet (LF) of waterline, the majority of which is 6-inch in diameter, approximately 5,000 LF of service lines, three PRV vaults, the replacement of approximately 277 curb stop assemblies, and the installation of approximately 277 meter pits and meters. The project also involves the installation of a new large water holding tank to replace an existing Mizel Water Storage tank constructed in 1967. This entails the demolition of the current tank and construction of a new tank within the same footprint. The waterlines along Frankstown Road and Ragers Hill Rd are major feed lines for the system. Piping size and telemetry will be analyzed to increase service reliability and fire flows; thus, the replacement sizes may vary throughout the project.","A large portion of the Authority’s water system is comprised of asbestos-concrete pipe installed in the 1950s and early 1960s. It is evident through leaks and water loss that much of this pipe is at the end of its life expectancy. The past several years has seen an increase in volume of water purchased while maintaining a consistent customer base. Currently, the Authority’s customer meters capture only about 48% of the water purchased monthly. These issues have resulted in decreased water quality, distribution system operation issues, and decreased pressure to customers."
"27","CAMBRIA","4110297","$5,021,005","40","READE TOWNSHIP MUNICIPAL AUTHORITY- WELL LINE AND TANK PROJECT","P.O. BOX 153","GLASGOW","TRAN, WS","DWSRF","4/15/2026","V","1,746","63","N/A","No","N/A","80322","$0","The Reade Township Municipal Authority (RTMA) is proposing to replace 8,800 linear feet (LF) of existing 10-inch diameter raw waterline along Cambria Mills Rd. Project scope also includes replacing the section of waterline that runs along Sportsman Club Rd. In addition, a new 178,061 gallon glass fused bolted steel storage water tank will be installed at the same location as the existing 189,203 gallon water tank.","RTMA is supplying Glendale Valley Municipal Authority (GVMA) with finished water with sufficient reserve water capacity. RTMA is looking to supply DCNR Glendale Lake Park (Prince Gallitzin State Park) with approximately 45,000 gallons per day in addition to its supplies to GVMA. The source capacity is available but storage in the three existing tanks allows for only 1.5 days capacity on average. RTMA would like to install an additional storage tank to increase their storage to the DEP-recommended storage capacity of three days. The storage capacity concern is related to the raw waterline replacement as well. The existing ductile iron pipe that conveys raw water has had many leaks. The poorly draining acidic soil in the area has been noted to rot out the pipe in several locations."
"28","LANCASTER","7360058","$49,293,000","40","CITY OF LANCASTER - SUSQUEHANNA LARGE DIAMETER TRANSMISSION MAIN","150 PITNEY ROAD","LANCASTER","TRANS","DWSRF","1/21/2026","III","120,000","65","N/A","No","N/A","85229","$0","The Susquehanna large diameter transmission main project will include the construction of 7,200 linear feet (LF) of raw water transmission main between the Susquehanna Low Service Pump Station and the Susquehanna Water Treatment Plant (WTP) and 28,200 LF of finished water transmission main between the WTP and the Oyster Point Reservoir. All new pipe will be 42-inch diameter, ductile-iron/cement-lined pipe. The new raw and finished mains will parallel the existing raw and finished mains, providing redundancy and making the Susquehanna treatment system more resilient.","The City of Lancaster (City) withdraws about 70 percent of its water from an intake on the Susquehanna River at Columbia, PA. The water is moved from the Susquehanna Low Service Pump Station through a 42-inch diameter raw water transmission main to the Susquehanna Water Treatment Plant (WTP). Finished water from the WTP is moved through another 42-inch diameter water main to the Oyster Point Reservoir. Both the raw and finished water transmission mains are constructed of steel and are about 70-years old. While they are still in serviceable condition, the frequency of leaks and repairs is accelerating, and the City desires redundancy in these critical transmission mains for the Susquehanna system. It would not be feasible for the City to rely on their second WTP, the Conestoga WTP, to supply their entire service area due to water allocation limits on the Conestoga River and the presence of PFOA."
"29","MONROE","2450063","$4,844,000","38","PA AMERICAN WATER COMPANY SUMMIT POINT PFAS/MN TREATMENT IMPROVEMENTS","P O BOX 718","MOUNT POCONO","PFAS","DWSRF","7/16/2025","II","17,860","53","N/A","No","N/A","80302","$0","The project will demolish the existing wellhouse and replacement with a new facility. Two high service pumps will be installed in the treatment building. The well will receive a new submersible pump. The existing well discharge piping will be replaced from the well to the new treatment building. The column pipe and pitless adapter will be replaced. PFAS treatment system will include two GAC units and a 24-inch Greensand Plus filter for iron/manganese. Two sodium hypochlorite feed pumps, two sodium hydroxide chemical feed pumps, and a polymer batch aging and feed tank system. Two chemical feed pumps will be used to dose Zinc Orthophosphate into the post-GAC effluent line.","The most recent sampling shows PFOA levels at 4.1 ppt, manganese levels at 0.226 mg/L (limit 0.05 mg/L), and iron levels of 0.25 mg/L (limit 0.3 mg/L). Project will improve water quality for the service area."
"30","ERIE","6250028","$8,000,000","37","ERIE CITY WATER AUTH - WEST 12TH ST. MAINTENANCE FACILITY RENO. & DISTRIBUTION SYS PRO-FI","340 WEST BAYFRONT PARKWAY","ERIE","TREAT, DS","DWSRF","4/15/2026","VI","180,000","52","N/A","Yes","N/A","82258","$1,840,000","12TH STREET FACILITY BUILDING IMPROVEMENTS (77% of project cost): The Erie Water Works 240 West 12th Street facility, located at the intersection of West 12th Street and Myrtle Street in the City of Erie, Erie County, PA, houses the Distribution, Meters, and Engineering Departments as well as material inventory and a large portion of the fleet. Much of the facility was originally constructed in the 1930s and the majority of the facility is in need of significant updates. Work will include selective demolition, concrete work, structural steel, roofing, glazing, painting, flooring, install new fire protection system, new domestic water pipes, new gas pipes, utility connections, fixtures, appurtenances, water heater, air compressor, HVAC, panel boards, raceways, conduits, interior lighting, and exterior lighting. CURED-IN-PLACE PIPE (GIPP) LINER PROJECT (12% of project cost):Several important transmission mains throughout the system will be rehabilitated by Cured-In-Place Pipe (GIPP) technology under this project in order to economically extend life, and provide stability for continuous water supply through key parts of the distribution system. Funding may include hydraulic modeling as needed, site evaluations, and design, as well as the physical GIPP work. BIRD DRIVE WATER MAIN REPLACEMENT (11% of project cost): The existing water mains within this project area are 6"" cast iron mains from 1920s. Numerous water main breaks have occurred in these areas which interrupt water service to many customers, cause traffic disruptions, and lead to expensive pavement and lawn restoration. The existing mains will be replaced with approximately 1,500 feet of new ductile iron pipe. Fire hydrants and service lines will also be replaced.","This proposed Pro-Fi application includes the following projects. The first (12th Street Facility Building Improvements) is planned to be the lead project:12th Street Facility Building Improvements - The 12th Street facility houses the Erie Water Works Distribution, Meters, and Engineering Departments as well as material inventory and a large portion of the fleet. Much of the building is in need of upgrades. Cured-In-Place Pipe (GIPP) Liner Project - leaking The large diameter transmission main under railroad tracks in the City of Erie is leaking. There are several other important transmission mains throughout the system that can be rehabilitated by GIPP in order to economically extend life, and provide stability for continuous water supply through key parts of the distribution system. Bird Drive Water Main Replacement - The existing cast iron water mains are significantly aged and well past their useful life. These water mains were prioritized using the KLH Master Plan as well as EWW analysis of historical data of the frequency of main breaks per section of water main of equivalent age and material."
