"System Name","PWSID","Est. Loan Amount","Points","Rank","Population","Project Description","Est. Date to Close Loan"
"Backwood Village Water System, Inc.","1127022","2060000","43","2","750","Construction of a GAC treatment unit, GST, booster station, chloramination system, site piping and associated items.","June-24"
"West Monroe","1073056","6069000","25","7","13065","The project will allow increase in source water, disinfection, storage of treated water, modernize controls, and generators.","May-24"
"Savoy Swords Water System, Inc. (Loan 3)","1097024","913000","16","11","8306","Proposed project involves the construction of a new second water well at the Richard Well Field, two standby generators at booster station sites, and upgrade computer and PLC controllers for SCADA systems.","July-24"
"St. Martin Parish Waterworks District No. 3- Cade","1099028","4550000","13","13","3249","WWDN3 proposes to place additonal water lines, water wells, storage unit, and service pump in the system. Automatic read meters are also being proposed to replace the existing outdated meters.","August-24"
"Mire Branch Water Corporation, Inc.","1001024","6130000","12","15","9063","Replace Well #1 with a new 750 gpm well; piping modifications so new well and well #3 can supply both Plants #1 and #2; new filter and softener, new 500K grd storage tank and replace existing high service pumps and generator.","May-24"
"Town of Basile","1039001","750000","9","17","2400","Recoat failing coatings onexisting 250,000 gallon elevated storage tank. Bring the Town's facilities into compliance with Section 225(S) of the LA Water Standards, which requires that proper protectionshall be given to metal surfaces by paints or other protective coatings.","July-24"