Rank,Points,PIF #,Entity,Owner Type,PWS ID,Population,Project Description,Requested Phase(s),Total Project Cost,Disadv %,Green Type,GPR,Related PIF #s
1,182,14531,Menard,M,TX1640001,"1,471","Major rehabilitation, additions and modifications to the surface  water treatment plant and raw water wells to address  groundwater under the influence.",DC,"$5,250,000.00",70%,,,
2,173,14573,Eden,M,TX0480001,"2,766","The proposed project includes construction of a new 100,000  gallon clearwell; construction of a new 300,000 gallon ground  storage tank; installation of a new treatment feed pump  station; installation of new site piping and miscellaneous  appurtenances; and rehabilitation one of the City’s four  groundwater wells. The proposed project will also include the  development of an asset management plan.",PDC,"$3,541,000.00",70%,Yes-BC,"$3,541,000.00",
3,164,14472,Sandbranch  Development & WSC,W,,190,Install a water system to an existing development.,To Be  Determined,"$4,025,000.00",70%,Yes-BC,"$4,025,000.00",
4,161,14532,Barksdale WSC,W,TX0690011,210,New Well,PADC,"$800,700.00",70%,,,
5,135,14691,Grassland WSC,W,TX1530005,55,Addition of Reverse Osmosis system to reduce contaminant  levels.,PDC,"$440,000.00",,,,
6,130,14520,Westbound WSC,W,,"2,748","Westbound WSC has substantial head loss through smaller  diameter water lines, a lack of production water in certain  pressure planes, limited capability to control and monitor the  distribution system remotely, two pump stations that are old  and hydraulically undersized, in addition to very limited  emergency back up power. After the proposed improvements  have been constructed, the above mentioned issues should  be resolved.",PDC,"$5,416,000.00",70%, Yes-BC,"$5,416,000.00",
7,115,14625,Town North Estates PWS,W,,210,"The project involves the planning, design, and implementation  of rehabilitation and replacement if necessary of the existing  treatment system damaged in winter storm Uri in 2021.  Interconnection with Lubbock will be explored as a more  resilient long term supply.  An asset management plan will be  completed.",PDC,"$350,000.00",70%,,,
8,112,14373,Rose City,M,TX1810139,650,Water Distribution System Improvements,PADC,"$650,000.00",70%,,,
9,112,14610,Rose City,M,TX1810139,650,"Obtain potable water from Orange County WCID 1. Pipeline,  Ground storage tank, pumps, piping, building, controls",PADC,"$1,400,000.00",70%,,,
10,107,14510,Liberty Hill,M,,"2,041","The proposed project includes planning, design, and  construction of the first phase of a direct potable reuse water  treatment system for the City of Liberty Hill’s South Fork  Wastewater Treatment Plant.",PADC,"$28,650,000.00",70%,Yes-BC,"$28,550,000.00",
11,106,14511,Liberty Hill,M,,"2,041","The proposed project includes planning, design, and  construction of the first phase of a raw water intake at the  Gandy tract spring-fed pond, raw water pipeline, and surface  water treatment plant to provide the City of Liberty Hill with a  new source of drinking water supply and treatment capacity.",PADC,"$60,550,000.00",70%,,,
12,106,14512,Liberty Hill,M,,"2,041","The proposed project includes planning, design, and  construction of the first phase of an Edwards Aquifer well field  in the Georgetown area, raw water pipeline, and treatment  system to provide the City of Liberty Hill with a new source  water supply and treatment capacity.",PADC,"$27,500,000.00",70%,,,
13,97,14500,La Joya,M,,"4,253","The City of La Joya is seeking funding to expand their Water  Treatment Plant.  The city is experiencing the following  issues; Inadequate water treatment capacity; Inadequate raw  water pump capacity; and Trouble maintaining minimum  TCEQ required water pressure to provide residents during  peak times. The following items are needed to bring the water  treatment and distribution systems in compliance to the TCEQ  rules and regulations:  Expand Water Treatment Plant and  Install two 1,350 gpm pumps.",PDC,"$6,968,000.00",70%,,,
14,93,14400,Greenbelt MIWA,D,TX0650013,"21,422","The proposed project will install 3 proposed groundwater  wells, well field piping, electrical distribution equipment, a 12- mile transmission line to transport the water to the existing  Greenbelt Water Treatment Plant, and treatment plant  upgrades to incorporate the new water source into the  treatment process. The Greenbelt Water Authority has  already negotiated water rights from this property, acquiring  2,780 ac-ft/yr of groundwater rights.",PADC,"$18,537,820.83",70%,,,
15,84,14454,Corix Utilities,P,,"3,282",Improvements to the existing water treatment plant by  installing a new membrane filtration system to meet water  quality and capacity requirements.,PDC,"$9,883,000.00",70%,Yes-BC,"$9,883,000.00",
16,84,14422,Angelina & Neches RA,D,TX0030027,578,"Develop and construct a new water supply source,  transmission main and treatment plant/pump station for  delivering potable water that meets or exceeds state and  federal regulatory standards. Replace existing deteriorated  distribution system lines, valves and water meters, to include  new AMI/AMR meters.",PADC,"$7,192,110.00",70%,,,
17,81,14564,G-M WSC,W,TX2020067,"11,220","Construction costs for rehabilitation of a water well, GST,  pump building as well as installation of additional treatment  facilities.",C,"$4,580,000.00",70%,,,
18,80,14537,Mullin ISD,D,,130,The Mullin Independent School District (MISD) is addressing  the need to improve the school’s water quality by removing  nitrates from the water produced by their existing well by  upgrading their existing water treatment system.,PD,"$1,000,000.00",70%,Yes-BC,"$1,000,000.00",
19,78,14579,Silver Creek Village WSC,P,,248,Water Treatment Plant and System Upgrade,PDC,"$1,544,969.00",,,,
20,74,14548,Duval Co CRD,D,,360,Replace elevated storage tank and install arsenic treatment in  Concepcion,PDC,"$1,665,000.00",70%,,,
21,72,14581,Duval Co CRD,D,,"2,285",Replace media in arsenic removal units. Install second water  storage service pump.,PDC,"$420,000.00",70%,,,
22,72,14377,G-M WSC,W,TX2020067,"11,220",Upgrade existing plant components and replace water lines.  Includes the creation of an asset management plan.,PDC,"$3,160,000.00",70%,,,
23,68,14560,Smyer,M,TX1100010,474,The proposed project includes improvements at the water  treatment plant and distribution system to bring the system  into compliance with TCEQ requirements. An asset  management plan will be prepared as part of this project.,PDC,"$4,365,000.00",,Yes-BC,"$4,365,000.00",
24,68,14380,Bay City,M,,"17,487","This project includes prioritized rehabilitation of the City of  Bay City's (City's) drinking water distribution system to  address aging infrastructure and frequent line breaks. This  project will also include the rehabilitation or decommissioning  of an existing elevated storage tank that is in dire need of  repair or replacement. Lastly, this project will address  elevated levels of arsenic at two of the City's water wells.",PDC,"$26,625,000.00",,,,
25,67,14529,Gladewater,M,tx0920001,"6,441",Improvements to the water system.,PDC,"$2,830,000.00",70%,,,
26,67,14542,Paint Rock,M,,371,This project involves the replacement of meters with an AMR  system and the installation of water lines,PDC,"$300,000.00",,Yes-BC,"$120,000.00",
27,67,14545,Orange Co WCID # 1,D,,"14,937","This project will provide for a new estimated 2,000 GPM  water well and treatment facilities.",PADC,"$4,791,500.00",,,,
28,66,14582,Rowena WSC,W,,480,This project will reduce TTHM levels to gain compliance with  the Stage 2 DBP Rule as well as address the open TCEQ  compliance issues.,PDC,"$6,721,000.00",70%,Yes-BC,"$6,721,000.00",
29,66,14627,Cox Addition PWS,W,,150,"The project involves the planning, design, and implementation  of rehabilitation and replacement, if necessary of the existing  adsorption system damaged in winter storm Uri in 2021.  Interconnection with Lubbock will be explored as a  more resilient long term supply.  An additional storage tank is  needed. Asset management plan will be completed.",PDC,"$475,000.00",70%,,,
30,64,14525,Beach City WCID,D,TX0360126,408,Water Supply and Distribution System Improvements,PADC,"$2,365,000.00",,,,
31,64,14688,Orange Co WCID # 1,D,TX1810005,"14,937",This project will provide for a liquid ammonium sulfate (LAS)  system and related infrastructure at each of the District's  three water well sites to address total trihalomethane  maximum contaminant level issues.,PDC,"$837,936.00",,,,
32,64,14680,Silverton,M,TX0230001,731,"The proposed project for the City of Silverton, involves the  construction of a pump station, and a 200,000 gallon ground  storage tank. Additionally, the project includes the drilling, test  pumping, piping, site work, fencing and gates, electrical  equipment, and electrical controls for three water wells.",DC,"$13,530,000.00",70%,,,
33,62,14442,Blanco,M,,"2,256","This project consists of three waterline replacement projects,  as follows; -9th Street Waterline Replacement -Cielo Springs Waterline Replacement -Palomino Waterline Replacement",ADC,"$3,558,738.40",,Yes-BC,"$3,558,738.40",
34,59,14630,Commodore Cove ID,D,,370,"Remove 40 year old 60,000 gallon drinking water storage  tank and install new water storage tank with circulation /  aeration system. The circulation system will help further  reduce the TTHM's forming in the storage tank after  chlorination.",PC,"$299,976.00",,,,
35,59,14626,Plott Acres PWS,W,,204,"The project involves the planning, design, and implementation  of rehabilitation and replacement if necessary of the existing  adsorption system required to meet primary drinking water  MCLs damaged in winter storm Uri in 2021.  Interconnection  with City of Lubbock will be explored as a best long term  alternative.  USAF has provided bottled water to Plott Acres  customers due to PFAS plume and testing of the two wells is  ongoing.  If transmission funds allow service will be offered to  private wells.  An additional storage tank is needed. Asset  management plan will be completed.  Urgent Needs -  Securing Safe Water Initiative to meet primary drinking water  MCLs.",PDC,"$1,685,000.00",70%,,,
36,55,14423,Pflugerville,M,TX2270014,"55,453","Since July 2018, the City of Pflugerville's (City's) Water  Treatment Plant (WTP) has received numerous violations  under the Long Term 2 Enhanced Surface Water Treatment  Rule (LT2ESWTR). This project addresses the issues at the  WTP that have led to these violations. The design phase of  this project is scheduled to be completed in May 2022. This  project was selected to receive funding during the SFY 2022  DWSRF funding cycle; the City is now applying for  supplemental construction funding for the WTP expansion.",C,"$91,532,030.00",,,,
37,55,14475,New Home,M,TX1530004,326,"The City has had high Arsenic and Fluoride levels that
exceed the MCL of .01 and 4 MG/L for several, consecutive
years and the City is under EPA enforcement action.",PADC,"$1,438,155.25",,,,
38,55,14427,Arimak WSC,W,TX1330135,108,"The Arimak Water Supply Corporation (WSC) is the recipient  of an Administrative Order from the United States  Environmental Protection Agency (EPA) for non-compliance  of the Safe Drinking Water Act (SDWA) as it pertains to  radionuclides levels in drinking water. The WSC is addressing  this matter through the implementation of a groundwater  treatment project.  Also, the ground storage tanks (GSTs)  have reached the end of their useful life and are in need of  replacement. The project will include development of an asset  management plan.",PDC,"$1,755,000.00",,Yes-BC,"$1,755,000.00",
39,53,14504,Gordon,M,TX1820007,744,"Water treatment plant improvements including clarifier  replacement, plant piping, SCADA, and distribution line  replacements.",PDC,"$1,962,000.00",70%,Yes-BC,"$625,000.00",
40,53,14390,Sharyland WSC,W,TX1080033,"90,846","SWSC seeks funding from the Texas Water Development  Board's Drinking Water State Revolving Fund in order to be  able to better serve their customers and improve the overall  performance, reliability, and redundancy of their water  distribution system. Proposed projects include, but are not  limited to: pressure zone expansions to address identified low  pressure zones throughout the system and improve the level  of service for customers; infrastructure relocation projects;  additional storage for compliance with TCEQ requirements;  capacity and performance improvements projects to  treatment facilities and the distribution system; and looping  and gridding throughout the system to improve redundancy,  reliability, and resiliency.",PADC,"$59,881,000.00",70%,,,
41,51,14619,Town North Village PWS,W,,650,"The project involves the planning, design, and implementation  of rehabilitation and replacement if necessary of the existing  treatment system damaged in winter storm Uri in 2021.  The project also investigates options of interconnection  with other PWS to provide blended water.  Urgent Needs - Securing Safe Water Initiative to meet primary  drinking water MCLs.",PDC,"$475,000.00",70%,,,
42,50,14570,Bistone Municipal WSD,D,,"24,929","Bistone's transmission lines to its various wholesale  customers is aged and has issues with leaks. The project will  replace the portion of the transmission system known as the  1967 14"" steel cylinder concrete pipe. Bistone has also been  advised by TCEQ that a pressure sustaining tank (pressure  tank or elevated tank) is needed for the periods when the  Surface Water and Groundwater Treatment Plants are  providing water. Blending is isolated from the two sources  when the Surface Plant operates but this requires pumps to  provide needed pressure. The elevated tank will resolve this  issue and comply with the TCEQ Blending Exception.",PADC,"$24,861,000.00",70%,,,
43,47,14426,Pflugerville,M,TX2270014,"55,453","According to the City of Pflugerville's (City's) 2020 Water  Master Plan, the City is expected to outgrow its current water  supply capacity in the next few years. This project includes  the expansion of the City's existing Colorado River raw water  pumping and transmission system, which will nearly double  the City's raw water supply capacity. The expansion of this  system will provide sufficient water supply for the City's  rapidly growing population until 2039, when additional water  supply sources are anticipated to be brought online.",C,"$74,779,940.00",,Yes-BC,"$1,500,000.00",
44,47,14420,New Summerfield,M,TX0370028,"1,350",Water System Improvements,PDC,"$2,183,000.00",,,,
45,46,14514,Dawson,M,,767,The purpose of this project is to replace/upsize undersized  water mains that are causing issues within the system.  Replacement of ex. valves and installation of new valves are  also needed throughout for better operation and maintenance  of the overall system.,PDC,"$300,000.00",70%,,,
46,46,14521,D & M WSC,W,TX1740010,"5,320","Construct pump station improvements and drill a new well at  the F.R. Lewis or Moral Booster Stations based on the  findings of the EFR. In addition, construct new water lines and  replace targeted old deteriorated water lines.  The creation of  an asset management plan is also included.",PADC,"$3,520,000.00",70%,,,
47,45,14498,Presidio County,C,,"6,975",Presidio County has numerous needs for their groundwater  and drinking water facilities. This project contemplates  making significant improvements to these water facilities for  this seriously underserved community.,PDC,"$21,740,500.00",70%,Yes-BC,"$6,250,000.00",
48,44,14399,Wills Point,M,TX2340005,"3,889","The City of Wills Point has a 12 inch raw water supply line  which supplies water from the intake on Lake Tawakoni to the  City's Water Treatment Plant.  The raw water transmission  line, the raw water intake pump station, and the in-line  booster pump station are in need of repairs, upgrades, and  replacements.  The purpose of this project is to replace  38,400 linear feet of 12 inch raw water transmission line from  the Lake Tawakoni Intake to the City of Wills Point Water  Treatment Plant, make upgrades to the raw water intake  pump station, and make upgrades to the in-line booster pump  station in order to provide reliable raw water to the City's  Water Treatment Plant.",PDC,"$5,585,000.00",,,,
49,43,14418,Alamo,M,TX1080001,"19,613",Water Treatment Plant Rehabilitation & Expansion,PDC,"$9,355,000.00",70%,,,
50,43,14493,Huntington,M,TX0030002,"2,121",Drill a new water well and install aerators inside elevated  storage tanks,PADC,"$1,708,000.00",70%,,,
51,43,14488,Daingerfield,M,TX1720001,"4,047",Waterline Replacement and Pumping and Storage Upgrades,PADC,"$3,190,000.00",70%,,,
52,42,14613,Webb County,C,,348,"Webb County is proposing to extend the main water line from  the intersection of Mangana-Hein Road and Cuatro Vientos  Road up to the location of the proposed Southern Fire  Station, running approximately 1 mile east.",PADC,"$2,000,000.00",,,,
53,42,14614,Webb County,C,,348,"The main water line will extend along Cuatro Vientos Road  from Cielito Lindo, which is located in City of Laredo limits, to  the Mangana-Hein Road; (approximately 3 miles length). The  potable water will be provided by the City of Laredo and the  Certificate of Convenience and Necessity (CCN) will be  transferred to the City of Laredo.",PDC,"$5,000,000.00",,,,
54,42,14615,Webb County,C,,348,"The goal of this project is to install distribution water lines for  the residences in Colonia La Presa. Once the water line  extension from Cielito Lindo to the Mangana-hein corridor has  been installed, Webb County may begin to plat the area and  ultimately install water distribution lines.",PDC,"$6,500,000.00",,,,
55,42,14616,Webb County,C,,348,Webb County is proposing to install a distribution line from the  main water line on Mangana-Hein Road to the new fire  station. The new fire station will be located in the rural south  area of Webb County in Precinct 1.,PDC,"$750,000.00",,,,
56,42,14617,Webb County,C,,348,Webb County will extend a distribution line from the main  water line adjacent to Mangana-Hein Road to connect to the  Webb County La Presa Community Center and the park that  is located behind the center.,PDC,"$500,000.00",,,,
57,41,14461,Kirbyville,M,,"2,631",This project intends to replace an existing elevated storage  tank that is severely deteriorated.,PDC,"$2,256,000.00",70%,Yes-BC,"$2,060,000.00",
58,41,14497,Mercedes,M,TX1080007,"16,648","The City of Mercedes needs to update various critical water  system components of the treatment,  transmission/distribution, and storage systems.",PADC,"$10,335,208.00",70%,,,
59,39,14436,Paducah,M,,"1,186","The proposed project includes replacement of sections of the  aging and inefficient distribution system; replacement of the  main transmission line that transports the water from  Paducah’s well field to town; and rehabilitation of the three  remaining ground storage tanks at the well field to stop the  corrosion that is prevalent on each of the three tanks, and  addition of backup generators per the response to SB 3.",PDC,"$9,299,000.00",70%,Yes-BC,"$9,299,000.00",
60,37,14391,Anthony,M,TX0710001,"3,671","The Town of Anthony will need to construct a 250,000 gallon  elevated water tank, rehabilitate existing water wells, replace  booster stations, address leaking water lines, install a  chlorination control system, replace meters and build arsenic  treatment plant in order to provide enough adequate water to  the residents.",ADC,"$10,473,059.00",70%,,,
61,37,14505,Pearsall,M,,"9,346",This project extends 8-inch waterline to existing homes and  businesses on the north I-35 business road and replaces  waterline in the City some of which is Colorado St. 12-inch  main that is old and deteriorated with a history of breakage.  Project also includes a new well and elevated storage tank to  serve existing customers west of I-35. Completion of an asset  management plan.,PADC,"$13,605,000.00",70%,,,
62,36,14569,Junction,M,,"2,507",The City of Junction is currently be cited by TCEQ on various  issues at the WTP. The City's water system requires  equipment for emergency events. The City also has failing  ACP and lead pipes that are constantly needing repair.,DC,"$405,000.00",70%,,,
63,36,14451,Stephens Regional SUD,D,TX2150007,"3,173",SRSUD is proposing water system improvements to address  growth in portions of the distribution system which includes  upgrading a main arterial distribution main in the system to  areas which are currently limited by the size of main.   Improvements are also proposed for the water treatment plant  (WTP) of address issues with aging equipment and  operational improvements to increase treatment efficiency.,PDC,"$9,722,000.00",70%,Yes-BC,"$9,722,000.00",
64,36,14430,Albany,M,,"1,983","The proposed project includes improvements at the Water  Treatment Plant to address aging infrastructure including  replacement of existing membrane system trains, chemical  system improvements, high service pump station  improvements, electrical, SCADA, and Instrumentation and  controls improvements.",PDC,"$7,731,000.00",70%,Yes-BC,"$7,731,000.00",
65,35,14690,Eagle Pass Water Works  System,M,TX1620001,"67,211","Analysis for Production, Treatment, and Distribution of a  second groundwater source in Maverick County. Various  distribution and transmission pipeline extensions and   replacements. Demolition and New Elevated Storage Tanks",PDC,"$107,334,481.00",70%,,,
66,35,14431,Roma,M,,"19,123",The City is addressing the need for Phase I (6 MGD) of a new  water treatment plant (WTP) to serve City of Roma residents  and fully comply with all water treatment regulations. The  City's existing WTP was partially rehabilitated in the late  1990s and has reached the end of its useful life and requires  replacement.,PDC,"$9,625,000.00",70%,Yes-BC,"$9,626,000.00",
67,34,14429,Mertzon,M,TX1180002,700,"As a result of the recent historic ongoing drought, the City’s  water supply is still depleted. The City currently has five (5)  functional groundwater wells (of the original eight), caused by  continual pumping during the ongoing drought, and is in the  process of obtaining approval for a new sixth well. The City  has observed a steady decrease in production from its wells  over the past several years, to the point that three of the  original eight wells are essentially “dry” at this time. As the  water supply has dwindled, the quality of the water no longer  meets secondary drinking water quality standards.  In order to  support current water supply needs with water that meets  current drinking water quality standards, the City of Mertzon is  pursuing implementation of a major project to install a  treatment system to address the City’s groundwater quality  issues.",PDC,"$6,478,000.00",70%,Yes-BC,"$6,478,000.00",
68,34,14450,Spur,M,,"1,100","Replacement of various portions of the City’s potable water  distribution pipeline system, valves, and fire hydrants.",PDC,"$2,648,000.00",70%,Yes-BC,"$2,648,000.00",
69,34,14629,Magnolia,M,TX1700020,"2,124",Construction of a new water plant to meet increasing demand  on the City's water system.,DC,"$9,010,000.00",70%,,,
70,34,14519,Winters,M,,"2,580","Replacement of various portions of the City’s potable water  distribution pipeline system, valves, and fire hydrants.",PDC,"$2,480,000.00",70%,Yes-BC,"$2,480,000.00",
71,34,14417,Hidalgo Co MUD # 1,D,TX1080088,"8,400","The Hidalgo Co. MUD #1 is in need of a 500,000 gallon  elevated storage tank to comply with state (TCEQ)  enforcement standard requirements.",PDC,"$2,515,000.00",70%,,,
72,34,14452,Upper Leon River MWD,D,TX0470015,"15,089","The proposed project includes improvements at the Water  Treatment Plant (WTP) to address the aging infrastructure  including rehabilitation of existing media filters, rehabilitation  of Clarifier No. 2, clearwell improvements, and backup  generator improvements.",PDC,"$8,565,000.00",70%,,,
73,33,14409,Groveton,M,TX2280001,"1,094",System Study and Water Distribution Line Replacements,PDC,"$2,345,000.00",70%,,,
74,33,14392,Bartlett,M,,"1,633","Water meter replacements, water lines, and installation of  isolation valves",PADC,"$4,942,700.00",70%,Yes-BC,"$2,950,000.00",
75,33,14483,Laguna Madre WD,D,,"19,908",The proposed project consists of improvements to Long  Island Village (LIV) Water Distribution system located within  Laguna Madre Water District (LMWD) service area.,PDC,"$7,777,347.00",70%,Yes-BC,"$1,087,488.00",
76,33,14458,Rolling Hills WS,W,TX1110032,201,"Rolling Hills Water Service will be installing an AMI metering  system, and replacing portions of the distribution system.",PDC,"$2,685,000.00",70%,,,
77,33,14382,Cross Roads Community  WSC,W,,720,Construct a new public water supply well and install an  emergency generator,PDC,"$1,990,000.00",70%,,,
78,33,14549,Daisetta,M,,938,The City will be building a new water well site to allow the city  to begin producing their own water supply within their  distribution system.,C,"$1,908,868.00",70%,,,
79,33,14432,Santa Anna,M,,"1,099","Replacement of various portions of the City’s potable water  distribution pipeline, valves, and fire hydrants.",PDC,"$4,238,000.00",70%,Yes-BC,"$4,238,000.00",
80,33,14381,Coleman County SUD,D,,"5,000","The project includes construction of waterlines, backup power  generation, and construction of pump stations facilities.",PADC,"$10,510,000.00",70%,,,
81,33,14441,Crockett,M,TX1130001,"6,332","Development of a new water well, transmission main, and  treatment facilities",PDC,"$2,945,250.00",70%,,,
82,33,14428,Eastland Co WSD,D,,"11,559","Re-clear the pipeline ROW and replace the existing raw water  transmission pipeline with a new fusion-welded, high-density  polyethylene (HDPE) pipeline.",PDC,"$9,273,000.00",70%,Yes-BC,"$9,273,000.00",
