Rank,Points,PIF #,Entity,Owner Type,PWS ID,Population,Project Description,Requested Phase(s),Total Project Cost,Disadv %,Green Type,GPR,Related PIF #s
83,32,14460,Hardin WSC,W,TX1460009,"5,439",Replace undersized water lines throughout the water system,PDC,"$3,761,000.00",70%,,,
84,32,14465,Hardin WSC,W,TX1460009,"5,439","New groundwater production well, elevated storage tank and  related appurtenances.",PDC,"$3,551,000.00",70%,,,
85,31,14601,San Jacinto SUD,D,TX2040033,"4,008","The District is in need of a new water well due to the service  area of the system having two pressure planes. The City of  Coldspring, part of the District's service area and region of  most water demand, does not have sufficient water capacity  within its pressure plane to meets the demand.",PDC,"$1,500,000.00",70%,,,
86,31,14621,Christian Life Center,P,TX1520219,51,The Christian Life Center is a non profit community water  system which serves 17 connections in north east Lubbock  County.  The system is under enforcement for exceedance of  1-1 Dichloroethylene in the system's only well.  The project will fund a low profile tray aeration system to be installed to treat the well water to compliant standards.,PDC,"$300,000.00",,,,
87,31,14482,D Bar B Water & WW SC,W,TX0570082,240,Emergency generator for drinking water system,PDC,"$85,000.00",70%,,,
88,31,14631,Victoria Co WCID # 2,D,,515,The Victoria County Water Control Improvement District No. 2  plans to rehabilitate a portion of the existing Distribution  system to allow for better service to the community. The  project will consist of rehabilitating the existing dilapidated  cast iron line to a more resilient material and to increase the  ground storage capabilities of the system be adding a needed  ground storage tank to the existing system.,PDC,"$1,622,000.00",70%,,,
89,31,14489,Murchison,M,,610,The City of Murchison's existing water treatment is located at  an elevation of 967 feet. This water treatment plant is in need  of replacement. The City currently has a notice of violation  that the area on the northern end of the pressure plane has  low pressure when flushing lines.  The City proposes to  construct a new water treatment facility with elevated storage.,PADC,"$3,448,640.00",70%,,,
90,31,14467,Alto,M,TX0370001,"1,523",Remove and replace existing aged and deteriorated  waterlines within the distribution system as well as rehabilitate  existing deteriorated Storage Tanks.  Includes creation of an  asset management plan.,PDC,"$1,872,000.00",70%,,,
91,31,14407,Crescent Heights WSC,W,TX1070016,"1,935","A new public water supply well, pressure facilities, and line  upgrades. Includes the creation of an asset management plan",PDC,"$3,500,000.00",70%,,,
92,31,14509,Liberty Hill,M,,"2,041","The proposed project includes planning, design, and  construction of various system improvements for the City of  Liberty Hill’s water system.",PADC,"$6,000,000.00",70%,,,
93,31,14693,Van Horn,M,TX0550001,"2,175","The Van Horn Capital Improvements Project involves  developing an asset management plan, constructing water  and wastewater systems necessary to ensure the reliability of  existing systems, replace aging infrastructure and facilities,  comply with regulatory requirements, meet utility priorities,  and serve anticipated growth in the system. The total cost is  $15,398,732 ($11 million for water, $4.4 million for  wastewater).",PDC,"$10,943,444.50",70%,,,
94,31,14405,Hamilton,M,,"3,200",Replacement of water lines that are in poor condition  throughout the city.,PDC,"$2,326,000.00",70%,,,
95,31,14406,Grand Saline,M,TX2340003,"3,228",Rehabilitate existing elevated storage tank and upgrade the  existing water distribution system.  Hydraulic Water Modeling.,PDC,"$1,408,500.00",70%,,,
96,31,14547,Ballinger,M,,"7,145",Water transmission line replacements.  Additional ground  storage tank capacity.  Additional pressure maintenance  capacity.,PDC,"$8,749,000.00",70%,Yes-BC,"$8,749,000.00",
97,31,14551,Hidalgo,M,,"12,200",Proposed Construction of 5.0 MGD Surface Water Treatment  Plant,PADC,"$13,300,000.00",70%,,,
98,30,14481,Study Butte WSC,W,TX0220035,196,"This project involves the replacement of an existing ground  storage tank, rehabilitating an existing water well and/or  drilling a new water well, the replacement of existing water  lines and valves, and installing new water lines.",PDC,"$900,000.00",70%,,,
99,30,14562,Ericksdahl WSC,W,TX1270005,274,"Ericksdahl WSC has a history of high of TTHM levels and  water loss. The proposed project will include tank mixing,  disinfection improvements, water line replacement, and  automatic meter reading system to reduce TTHMs and water  loss.",PADC,"$1,697,500.00",70%,Yes-BC,"$160,500.00",
100,30,14388,Holiday Beach WSC,W,TX0040015,"1,316",Water Line Improvements,PDC,"$1,800,000.00",70%,,,
101,30,14580,Waelder,M,,"1,517",New Water Well 6 and associated Water Plant Improvements,PDC,"$2,942,000.00",70%,,,
102,30,14533,Navarro Mills WSC,W,TX1750024,"4,173",Upgrade existing pumping and transmission/distribution  facilities,PADC,"$3,240,000.00",70%,,,
103,30,14424,San Leon MUD,D,,"5,336",San Leon MUD has a dramatically undersized water system  that does not permit having properly spaced fire hydrants for  proper fire protection for the community. This project will  involve replacement of the vast majority of the undersized  mains as well as valves and fire hydrants.,DC,"$11,393,750.00",70%,,,
104,30,14561,Los Fresnos,M,,"6,280","The City of Los Fresnos is proposing a City-wide  rehabilitation of existing water distribution lines. The project  consists of the removal and replacement of Approx. 80,000  LF of water lines.",C,"$11,216,110.00",70%,,,
105,30,14682,Bonham,M,TX0740001,"10,408","Installation of approximately 33,520 linear feet (bid schedules  1, 3 5 & 6) of 6”-24” water line, encasement, valves, services,  fittings, fire hydrants, and associated appurtenances.  Maintenance problems, Leaks associated with aging  waterlines.",C,"$13,131,170.00",70%,,,
106,30,14459,Kingsland WSC,W,,"11,163","The main pressure zone of the Kingsland Water Supply  Corporation's (KWSC's) service area includes a relatively high  elevation causing operational challenges with consistently  maintaining pressures above 35 psi. This high elevation area  corresponds with lowest-income customers in the KWSC  service area. To address the system’s root problems with  insufficient elevated pressure head in this economically  disadvantaged part of the system, this project will include the  creation of a new boosted pressure zone within the main  pressure zone by constructing a new booster pump station,  elevated storage tank (EST), and performing system  distribution improvements. The second component of this  project will be improving the transmission capacity between  the EST located at the KWSC water treatment plant (WTP)  and the standpipe. This project will allow the KWSC to  maintain compliance with the TCEQ'S system pressure  requirements under all increasing demand conditions  throughout the entire service area.",DC,"$9,220,000.00",70%,,,
107,28,14558,Red River Co WSC,W,TX1940008,"6,738","The project involves constructing three 200-gpm wells around  the county, a 150,000-gallon elevated storage tank,  approximately 17,000 LF of line extensions to connect these  facilities into the system, and approximately 60,000 LF of line  replacement and upsizing around the system.",PADC,"$8,706,886.10",70%,,,
108,27,14546,Parker County SUD,D,,"4,113",This project will include the development of a brackish water  well to augment the District's source water supply for  treatment at its existing desalination WTP.,PDC,"$8,195,000.00",70%,Yes-BC,"$8,195,000.00",
109,27,14494,Olmito WSC,W,,"6,580","The proposed 1.0 MGD Expansion to Existing Water  Treatment Plant project includes expanding the current  existing 2.0 mgd plant to treat 3.0 mgd. The project consists  of expanding the existing raw water pumping, adding an  additional sedimentation and filtration treatment unit, adding  transfer pump capacity and making improvements to the  existing disinfection systems. Plant expansion is necessary to  meet current and future demands due recent accelerated  growth  north of the City of Brownsville in the Olmito WSC's  water service area.",PADC,"$6,090,000.00",70%,,,
110,26,14606,Oak Grove WSC,W,TX0190014,921,"In October 2018, Riverbend Water Resources District  (Riverbend WRD) completed a Regional Water Master Plan  Study (Study) funded through the TWDB D-Fund Program  that focused on the projected water needs of Riverbend  WRD’s participating entities located within Bowie, Cass, and  Red River Counties. The Study evaluated several alternatives  with a final recommendation of constructing a new regional  water system.",PADC,"$1,281,550.00",,Yes-BC,"$497,000.00",
111,26,14479,Hitchcock,M,TX0840004,"7,800",The purpose of this project is to improve the City's water  distribution system through the installation of additional valves  and the targeted replacement of undersized mains. The  project also includes the rehabilitation of its water production  facilities to provide safe drinking water to its residents.,DC,"$23,863,500.00",,Yes-BC,"$1,725,000.00",
112,25,14555,Jacksboro,M,TX1190002,"4,450",The City of Jacksboro's Water Treatment Plant (WTP) is  undersized and has reached the end of its effective useful life.  The capacity of the WTP needs to be doubled to satisfy  regulatory requirements and ongoing distribution system  pressure deficiencies require construction of a new elevated  storage tank (EST) and upsizing the main transmission line.,DC,"$25,000,000.00",70%,,,
113,24,14585,El Paso Co WCID # 4,D,TX0710018,"7,498","The existing I-10 Ground Storage Reservoir controls the raw  water feed quality to the existing Fe/Mn filters and Reverse  Osmosis facility and provides storage if the Wells become  non-operational. The reservoir is currently not in use due to  tank structural defects. Under this project, the Fabens Water  District (EPCWCID #4) proposes to demolish the existing 0.5  MG steel reservoir, including foundation and piping, and  replace it with a new 0.25 MG steel reservoir, including  foundation, piping, cathodic protection system, fencing, and  site grading.",DC,"$1,241,811.00",70%,,,
114,23,14689,Wharton,M,TX2410005,"8,756","The City has a history of high water loss and frequent  leaks/outages in a number of areas that still have old 2""  waterlines. These lines are also too small to provide any fire protection or allow the City to place fire hydrants in these  older subdivisions. After completion of planning,  environmental, and design the City intends to replace the 2""  steel waterlines with 8"" PVC waterlines improving water  quality, reducing leaks/outages, and providing fire protection.",PDC,"$1,153,360.00",70%,,,
115,23,14486,Greater Texoma UA,M,TX0490001,"16,502","Project includes replacement of a 14"" Water Transmission  Main along Foundry Road in Gainesville, Texas. Project will accomplish alleviating water  loss. Current Water Transmission Main has major leaks estimated to have lost 30 million gallons  over the past 5 years, and is 80+ years old.",C,"$2,724,620.00",70%,Yes-BC,"$2,000,000.00",
116,23,14456,Corix Utilities,P,,165,Addition of a well to replace existing well.,PDC,"$3,077,000.00",70%,Yes-BC,"$3,076,000.00",
117,23,14440,Streetman,M,TX0810016,248,"The project consists of a new 150 gpm water well, raw water  and treated water transmission mains, pump station  improvements, and water meter replacement with AMR  meters.",PADC,"$11,061,125.00",70%,Yes-BC,"$5,426,400.00",
118,23,14468,Green Creek WSC,W,,460,The WSC proposes to install a pump station with disinfection  facilities. The WSC received a violation from the TCEQ for  failure to provide a maximum hourly purchase rate of at least  2.0 gallons per minute (gpm) per connection. The WSC  currently purchases treated wholesale water from the City of  Dublin who also provides direct pressure to the WSC's water  system. The WSC proposes to install a pump station and  storage facility in order to provide a capacity of 0.6 gpm per  connection.,PADC,"$785,000.00",70%,Yes-BC,"$785,000.00",
119,23,14404,North Alamo WSC,W,TX1080029,963,Transmission System Improvements for Hargill,PADC,"$1,457,844.00",70%,,,
120,23,14683,Honey Grove,M,TX0740003,"1,715","Installation of 500 GPM pumping system with a 100,000  Gallon GST. Replacement of approximately 7,850 linear feet  of 6” water line and associated appurtenances.",DC,"$4,196,000.00",70%,,,
121,23,14526,Greater Texoma UA,M,TX0910011,"1,906",GTUA/City of Whitewright Water Improvements/Additional  Funds,DC,"$3,271,394.00",70%,,,
122,23,14513,Carrizo Springs,M,TX0640002,"5,828",The City of Carrizo Springs is proposing to bring its water  system up to date to correct numerous deficiencies according  to TCEQ regulations and Texas State Board of Insurance  requirements.,PDC,"$11,295,000.00",70%,,,
123,23,14434,Slaton,M,TX1520004,"6,052",The City of Slaton is proposing the installation of an AMI  system throughout their distribution system as well as the  installation of a new elevated storage tank.,PDC,"$6,030,000.00",70%,Yes-BC,"$6,030,000.00",
124,22,14490,Greater Texoma UA,M,TX0910148,"56,925","The primary purpose of this project will be expand the water  delivery capacity on the Collin-Grayson Municipal Alliance  (“CGMA”) water system. The work will focus at the pump station site and consist of the following components, 1)add a  4th pump and motor, VFDs, soft starters, 2) Add 2 additional  stages to the three (3) existing pumps, 3) additional ground  storage tank, 4)SCADA upgrades, 5)Backup Generator,  6)piping and pressure relief additions , 7)all associated electrical, plumbing and earthwork 8)and appurtenances. In order to add the stages to the pumps, the vertical turbine pumps will have to be removed and taken to a shop. During that process we would have the contractor inspect the pumps and motors and make any repairs should they be necessary.",C,"$7,531,300.00",,,,
125,22,14584,El Paso Co WCID # 4,D,TX0710018,"7,498","Per TCEQ requirements, the minimum pressure throughout a  system during a transient event (power outage) must be  greater than 20 psi. A surge evaluation of the existing I-10  booster station indicated that the system's pressure dropped  below the minimum TCEQ required pressure of 20 psi during  a power failure event.  Per TCEQ requirements, the El Paso  County Water Improvements District #4 (EPCWCID #4)  requires an elevated storage capacity of 100 gallons per  connection or a pressure tank capacity of 20 gallons per  connection to meet this requirement.  Under this project, the  EPCWCID #4 proposes installing a new 120-gallon bladder  tank to meet the pressure requirements in the event of a  power failure event specified by TCEQ.",DC,"$199,584.00",70%,,,
126,22,14586,El Paso Co WCID # 4,D,TX0710018,"7,498","The existing Cypress Well has been drilled but is currently not  equipped. When in service, the Cypress Well will have a 900  GPM capacity. Under this project, the Fabens Water District  (EPCWCID #4) proposes to fully equip Cypress Well #6,  including furnishing and installing a new well pump and  motor, a Well building and canopy, discharge piping, valves,  flow meter, electrical and instrumentation systems, generator  with ATS, site grading, and a new access roadway and  driveway.",DC,"$1,235,465.00",70%,,,
127,22,14587,El Paso Co WCID # 4,D,TX0710018,"7,498","The existing water distribution system piping on Elam  Subdivision has ruptured several times in the past and is  prone to leaks. The system also has physical deficiencies  such as non-functional valves and a lack of additional  isolation valves and curb stops.  Under this project, the Fabens Water District (EPCWCID #4)  proposes to abandon the existing distribution system in place  and furnish and install approximately 6,100 LF of new 6-inch  PVC C900 piping, including all related appurtenances and  2,000 LF of 6-inch PVC C900 pipe for the loop system  adjacent to railroad tracks including all related work and  appurtenances.",DC,"$4,412,000.00",70%,Yes-BC,"$3,616,200.00",
128,21,14374,Houston,M,,"3,563,653","Accelerated rehabilitation and replacement of small diameter  (2”-20”) water distribution infrastructure to address  deficiencies affecting water quality, fire flow availability, water  loss, sub-standard water lines, system design and asset age.  Includes replacement of lines undersized for current usage,  improve integrity of water supply, and replacement of end-of- life components (lines, valves, appurtenances). Work to be  performed within existing City rights-of-way under task order- based contracts.",C,"$40,000,000.00",,,,
129,21,14534,Houston,M,,"3,563,653","Accelerated rehabilitation and replacement of large diameter  (>20”) water distribution infrastructure to address deficiencies  affecting water quality, fire flow availability, water loss, system  design and asset age. Includes replacement of lines  undersized for current usage, improve integrity of water  supply, and replacement of end-of-life components (lines,  valves, appurtenances). Work to be performed within existing  City rights-of-way under task order-based contracts.",C,"$40,000,000.00",,,,
130,21,14484,Alba,M,TX2500005,753,"Rehabilitate existing EST and GST tanks, install new  generators, and replace old waterlines. Includes creation of  an asset management plan.",PDC,"$1,538,000.00",70%,,,
131,21,14435,Athens,M,,"12,777",The City of Athens needs to implement an asset management  plan. Also included in this project is the design and installation  of a SCADA system for the City's utility system.,PDC,"$713,000.00",70%,Yes-BC,"$578,000.00",
132,21,14413,Marshall,M,TX1020002,"23,935",Replace Existing Raw Water Main,PDC,"$9,645,000.00",70%,,,
133,20,14501,Moran,M,,178,"Replacing flush valves, isolation valves and water distribution  lines.",PDC,"$500,000.00",70%,Yes-BC,"$350,000.00",
134,20,14566,Rochester,M,TX1040002,464,"This project involves backup power generation, drilling of a  new water well and associated supply line, an AMR meter  system, and the replacement of old water line.",PDC,"$600,000.00",70%,Yes-BC,"$110,000.00",
135,20,14583,Rule,M,TX1040003,540,"This project involves the replacement of old cast iron lines  with new lines, an AMR meter system, GST rehab, EST,  rehab, and backup power generation.",PDC,"$930,000.00",70%,Yes-BC,"$157,500.00",
136,20,14524,Pure WSC,W,,774,Project to comply with the Emergency Preparedness Plan,PDC,"$504,600.00",70%,,,
137,20,14540,Pineland,M,TX2020002,888,"Construction of a pump station and storage facilities at the  Well 3 site to provide redundant system pressure  maintenance during times when the existing elevated storage  tank is taken offline for repair and maintenance. Proposed  facility will also support pressure maintenance in the northern  part of the City during normal operations. Upon completion of  the Plant 3 Pump Station, the existing elevated storage tank  will be repaired and rehabilitated.",PDC,"$2,144,800.00",70%,,,
138,20,14473,Millsap WSC,W,,"1,477","Millsap WSC proposes to replace a pressure tank at their  Pump Station No. 2, install generators at their pump stations  (3), install SCADA at their pump stations (3), master meter  and office, and install new water lines, and loop existing  distribution lines.",PDC,"$605,000.00",70%,Yes-BC,"$125,000.00",
139,20,14403,Grapeland,M,,"1,489",New industry developments in the City require additional  supply and storage.,PDC,"$3,709,000.00",70%,,,
140,20,14491,Grandview,M,,"1,841",This project consists of installing two new water wells and  installing a new backup generator at the elevated storage  tank site.,PADC,"$875,000.00",70%,,,
141,20,14567,Grandview,M,,"1,841",This project consists of replacing deteriorated distribution  lines.,PDC,"$2,809,750.00",70%,Yes-BC,"$2,809,750.00",
142,20,14487,Jefferson,M,TX1580001,"1,883",Waterline Upgrades,PDC,"$3,940,000.00",70%,,,
143,20,14414,Goodsprings WSC,W,TX2010016,"2,346",Replacement of old and/or undersized lines and creation of  loops in the system.,PDC,"$2,145,000.00",70%,,,
144,20,14578,Haskell,M,TX1040001,"3,195","Recoat and rehabilitation of the City's existing 500,000 gallon  elevated storage tank and replacement of vent on existing  250,000 gallon elevated storage tank.",PDC,"$525,000.00",70%,,,
145,20,14375,Dublin,M,TX0720001,"4,207","Proposed project will replace existing 14"" water supply line.",PDC,"$2,994,500.00",70%,Yes-BC,"$2,316,000.00",
146,20,14464,San Diego MUD # 1,D,,"4,753","Rehabilitation of the existing elevated and ground storage for  the San Diego MUD facilities. Replace 2-inch line with a 6- inch line from Well 7, and replace asbestos gaskets/line for  11,000 lf of 12- inch water main. Asbestos lines are a high  priority for removal and considered an emerging contaminant.  Rehabilitate broken chlorine sheds due to safety risks.",PADC,"$4,160,000.00",70%,,,
147,20,14410,Dean WSC,W,,"5,907",Construction of a new elevated storage tank at an existing  pump station.,PDC,"$2,858,500.00",,,,
148,20,14536,Raymondville,M,tx2450001,"11,284","The City of Raymondville is proposing to remove and replace  approximately 15,000 LF of existing waterlines",PDC,"$3,146,295.00",70%,,,
149,20,14554,Hidalgo,M,TX1080021,"12,200",0.5 MG Elevated Storage Tank Project,PDC,"$4,477,000.00",70%,,,
150,20,14681,Palo Pinto Co MWD # 1,D,TX1820075,"15,096",The Brazos Pump Station and Hilltop WTP is suffering from  aging infrastructure. A condition assessment of the facilities  was performed and identified several elements for upgrading  and replacing.,DC,"$11,779,000.00",70%,,,
151,20,14476,San Benito,M,,"24,371",City of San Benito Proposed Water System Improvements,PDC,"$5,714,424.00",70%,,,
152,20,14550,Military Highway WSC,W,,"46,000",Military Highway Water Supply Corporation will be performing  needed repairs on ground storage tanks at four existing site  locations. Total of 8 ground storage tanks,PDC,"$2,201,000.00",70%,,,
153,20,14515,Covington,M,,570,The purpose of this project is to replace/upsize undersized  water mains to improve water flow/pressure. This project will  also include replacement of lead service lines. Covington is  experiencing between 25-35% water loss in any given month.,PDC,"$300,000.00",,,,
154,18,14508,Hays County,C,,"213,366","Jacob’s Well is a karst spring, which originates from the  Middle Trinity Aquifer. It is located in the Cypress Creek  watershed in Wimberley, Texas. In the past, the spring has  stopped flowing due to prolonged drought exacerbated by  pumping influences in the areas that surround it.  A problematic well has been identified as the primary  controllable source of the problem. This project proposes to  decommission this problematic well and replace it with a new  well at a location that will not cause the same problem. The  well’s move and replacement below the Tom Creek Fault,  based on scientific and engineering analysis suggests that  healthy, consistent spring flow will be restored and preserved  long term.",ADC,"$7,353,841.10",,,,
155,18,14449,Danbury,M,TX0200011,"1,671",The City has an aging and deteriorating water system with no  remaining alternatives for water supply.  The City is proposing  to refurbish and update its water infrastructure to provide  better and more efficient water services as well as provide  water supply redundancy and disaster preparedness.,PDC,"$7,410,000.00",,Yes-BC,"$1,420,000.00",
156,18,14433,Santo SUD,D,TX1820010,"2,775",The proposed project includes improvements to various  portions of the water system to bring the system into  compliance with TCEQ requirements and provide capacity for  future growth. An asset management plan will be prepared as  part of this project.,PDC,"$11,572,000.00",,Yes-BC,"$11,572,000.00",
157,18,14455,Corix Utilities,P,,"3,513","Improvements to the distribution system including line  replacement, pump station improvements, elevated storage  tank improvements, and additional water production.",PDC,"$30,536,000.00",,Yes-BC,"$30,536,000.00",
158,17,14439,Knollwood,M,,590,"This project will include replacing/improving undersized water  mains in the City, replacing lead service lines and installing  new isolation valves to improve operation and maintenance.",PDC,"$300,000.00",,,,
159,17,14395,Springtown,M,,"5,500",This project consists of installing smart water meters and  repairing leaking water mains.,DC,"$4,958,750.00",,Yes-BC,"$4,958,750.00",
160,16,14608,Hidalgo Co DD #  1,D,,"180,000","Planning, Design, Permitting and Construction of a 1 MGD  Water Treatment Plant with intake pump station, reservoir  and distribution system.",PDC,"$25,759,700.00",,Yes-BC,"$25,759,700.00",
161,16,14506,Penelope WSC,W,,206,"Replace old, deteriorated and under capacity water mains.",PDC,"$300,000.00",,,,
162,16,14398,New Fairview,M,,206,"The City does not currently own public water infrastructure nor provide water to anyone. At present, small water supply corporations provide water to residences and businesses that do not have private groundwater wells within the city. However, these small co-ops are unable to meet the demands of growth occurring within the City. Therefore, the City wishes to obtain a CCN and construct infrastructure for providing public water to meet the needs of the City moving forward.",PADC,"$36,650,000.00",,,,
163,16,14416,Creedmoor Maha WSC,W,TX2270008,"9,728",The Twin Creek subdivision currently has undersized lines  that do not meet TCEQ requirements for serving the existing  customers. These lines also are in conflict with an upcoming  Travis County drainage project.,PADC,"$2,753,884.00",,,,
164,15,14457,Corix Utilities,P,,117,Addition of a well to increase system capacity.,PDC,"$1,779,000.00",,,,
