Rank,Points,PIF #,Entity,Owner Type,PWS ID,Population,Project Description,Requested Phase(s),Total Project Cost,Disadv %,Green Type,GPR,Related PIF #s
260,0,14563,Harlingen Water Works  System,M,,"75,330","The aging pipeline that conveys raw water to the Downtown  WTP Reservoir by gravity flow consists of a 5’ x 5’ concrete  box and a 42” reinforced concrete pipe, both of which require  increasingly frequent repairs that jeopardize continuous use  of the WTP.  The 42” segment limits flow to 67% of the plant’s  rated capacity, and under high continual demands or an  emergency condition in which the Downtown plant is the only  WTP in operation, the pipeline will limit HWWS’s ability to  keep up with system demand.  The proposed upgrade of the  pipeline will eliminate downtime and ensure sufficient supply  of raw water to the reservoir at the WTP’s rated capacity.",PADC,"$10,552,822.00",,,,
261,0,14492,Edinburg,M,TX1080004,"95,847",The City of Edinburg has an existing raw water reservoir  which provide raw surface water to the City's two water  treatment plant facilities. The reservoir was constructed over  40 years ago and are in need of rehabilitation. The raw water  reservoir side slopes have deteriorated and the reservoir is  currently leaking and losing storage water. Rehabilitation will  consist of restoring side slopes with concrete revetment to  prevent erosion and  installing  a geo synthetic liner to  prevent raw water leakage and raw water loss.,PDC,"$8,860,000.00",,,,
262,0,14594,Austin,M,TX2270001,"1,053,756",Convert the existing disinfection chemical feed at Ullrich WTP  from chlorine and ammonia gas to 'inherently safer  technology' of On-site Sodium Hypochlorite Generation  (OSHG) and Liquid Ammonia Sulfate (LAS).,C,"$50,986,660.00",,,,
263,0,14462,San Antonio Water  System,M,,"2,003,714","The Water Production Facilities Disinfection System  Upgrades Phase 4 project will design the upgrades needed to  convert the Anderson, Mission and Oliver Ranch pump  stations from chlorine gas to sodium hypochlorite generation  as a disinfectant for potable water",D,"$2,214,434.00",,,,
264,0,14463,San Antonio Water  System,M,,"2,003,714","The Seale Pump Station Improvements project, a part of the  multi-year pump station improvements program, will evaluate  and replace high service pumps, well pumps, and associated  electrical and SCADA equipment.",D,"$2,372,598.00",,,,
265,0,14384,Dallas,M,TX0570004,"2,561,490","DWU's water main replacement program provides for  rehabilitation or replacement of approximately 40 miles of  small diameter water mains annually. This program will allow  us to continue to replace water mains to reduce water main  breaks throughout the system; thereby reducing maintenance  costs, water losses and impact to the public. DWU targets a  break rate of 15 breaks per 100 miles per year and adjusts its  replacement program relative to meeting that goal. This is  consistent with the goal defined in the AWWA Partnership for  Safe Water Distribution System Optimization Program.",DC,"$34,000,000.00",,,,
266,0,14386,Dallas,M,TX0570004,"2,561,490","The Lake June Pump Station (PS) and Reservoirs, built in  1960, have exceeded their useful life and need to be  replaced. Lake June PS delivers 360 mgd of potable water to  four separate pressure planes within the DWU distribution  system. There is 21 MG of onsite storage capacity. The pump  station must remain in service until the new pump station and  reservoirs are built with minimal shutdown. The proposed  project is Engineering Design Services for the replacement of  Lake June Pump Station (PS) and Reservoirs.  This pump station is critical to Dallas Water Utilities' ability to  deliver potable water to south Dallas and represents the only  supply source for the Cedardale High Pressure Plane. The  Lake June Pump Station is a crucial component of DWU's  water delivery system and is highest ranked project on DWU's  Pump Station Criticality List.",D,"$7,500,000.00",,,,
267,0,14518,Dallas,M,TX0570004,"2,561,490",DWU's Elm Fork WTP Filter Complex -Phase 2 project will  complete the construction of the new BAF Filter Complex and  integrate it into the plant's treatment process.,C,"$127,400,000.00",,,,