Rank,Points,PIF #,Entity,Owner Type,PWS ID,Population,Project Description,Requested Phase(s),Total Project Cost,Disadv %,Green Type,GPR,Related PIF #s
165,15,14503,Southlake,M,,"31,265","The City has numerous existing water system components  that were installed prior to Jan 4, 2014 and therefore contain  small amounts of lead acceptable by code and statute prior to  that date. This project aims at replacing each of those  components so the City's water distribution system is 100%  free of any components or parts with any lead content.",AC,"$14,497,530.00",,,,
166,15,14378,Nueces River Authority,D,,"304,347",Water Resource and Flood Mitigation Planning Study,P,"$450,000.00",,,,
167,15,14535,Nueces River Authority,D,,"304,347",Water Resource and Flood Mitigation Planning Study,P,"$450,000.00",,,,
168,15,14393,Travis County,C,,"1,226,805",Travis County is interested in making water main  improvements to serve businesses and homes gain or  improve their water service.,DC,"$5,350,000.00",,,,
169,15,14443,Travis County,C,,"1,226,805",There are numerous areas within Travis County where  drinking water systems are completely inadequate. This  project will seek to address these inadequate systems and  make physical improvements to improve water service to the  residents.,DC,"$6,000,000.00",,,,
170,14,14412,Mooreville WSC,W,TX0730015,142,"The Mooreville WSC (MWSC) water distribution system and  single-phase high service pump station is old and has  reached the end of its useful life. The booster pump station is  undersized. The pump station must be upgraded to meet  TCEQ requirements of 1.5 gpm per connection (currently 108  gpm). Larger pumps require 3-phase power at the pump  station using phase converters.  In addition, a new diesel  standby power generator and new 2,000-gallon hydro- pneumatic pressure tank is required as well. The existing  distribution system is undersized, old and suffers from  significant water loss and frequent breakages. The proposed  project will replace all of MWSC’s distribution mains and will  upsize those mains that that are currently undersized and  result in poor water pressures and flows. The proposed  project will construct approximately 21,500 LF of new 4-inch  water mains, 10,500 LF of new 3-inch water mains, and  29,000 LF of new 2-inch water mains.",PADC,"$3,959,250.00",,,,
171,14,14496,Acton MUD,D,,"22,643",AMUD is proposing water system improvements to address  growth in the distribution system which includes upgrading a  main arterial distribution main in the system to areas which  are currently limited by the size of main.  Several areas also  require the extension of main lines to provide additional  pressure in areas where future developments are anticipated.,PDC,"$9,581,000.00",,Yes-BC,"$9,581,000.00",
172,14,14599,Wickson Creek SUD,D,,"22,644","This project will provide groundwater supply, treatment,  storage, high service pumping, and piping to deliver potable  water from an existing well to the existing distribution system.",PADC,"$20,963,600.00",,,,
173,14,14401,San Jacinto RA,D,TX1700197,"112,439",The existing wholesale 16/24-inch PVC water transmission  line along Woodlands Parkway between Carlton Woods Dr.  and FM 2978 which was installed between 2000 and 2003  has experienced nearly 30 failures between 2007 and 2021.   This project will replace the existing water line with new water  line pipe.,ADC,"$16,200,000.00",,,,
174,13,14387,Carl's Corner,M,,199,"The city's water well (State Well Number 32-64-203) only  produces 10 gallon per minute to serve 76 connections.  This  amount is woefully short of the TCEQ requirement of 0.6 gpm  per connection.  The city desires to increase its water supply  by constructing a new water well, or if necessary to obtain  other adequate water supply or emergency interconnection.",C,"$1,614,124.00",,,,
175,13,14623,"Seguro Water Co., LLC",P,TX2330051,201,"The ground storage tank has a significant leak, second water  well has been idle due to an equipment failure for  approximately 8-10 years and residents continue to install  septic systems and water wells jeopardizing the ground water  quality.",PADC,"$93,900.00",,,,
176,13,14419,Thorndale,M,,"1,263","Construction of new water well, transmission line from new  water well, water treatment plant improvements, and asset  management plan",PADC,"$14,396,000.00",,,,
177,13,14522,Laredo,M,,"259,151",Construction of the booster station in South Laredo and a  3MG elevated storage tank  in the sports complex area. This  is to meet TCEQ water storage requirements and pumping  capacity.,DC,"$27,500,000.00",,,,
178,13,14575,Laredo,M,,"259,151",The proposed Unitec Elevated Storage Tank will assist the  City in maintaining pressure in the Unitec/Hachar/Reuthinger  Industrial Parks and to meet the elevated storage  requirements for the El Pico SWTP Pressure Zone.,DC,"$6,750,000.00",,,,
179,13,14556,Swenson WSC,W,,38,"For this project, Swenson Water Supply Corporation (WSC)  will be making improvements to their high service pump  station and ground storage tank (GST) that serves their 30  customers.",PDC,"$1,684,000.00",,Yes-BC,"$1,684,000.00",
180,13,14528,Trent,M,,425,"Replacement of various portions of the City’s potable water  distribution pipeline system, valves, and fire hydrants.",PDC,"$1,530,000.00",,Yes-BC,"$1,530,000.00",
181,13,14437,Loraine,M,,602,Replacement of various portions of the City’s potable water  distribution pipeline and valves.,PDC,"$3,307,000.00",,Yes-BC,"$3,307,000.00",
182,13,14628,Chappell Hill WSC,W,TX2390003,645,Improvements throughout the entire water supply corporation  system.,PDC,"$4,668,735.00",,,,
183,13,14469,Keene,M,,"6,266","Replace approximately 16,000 linear feet of 2-inch through 8- inch water line. Install a new well and pump station facilities.",PDC,"$3,100,000.00",,Yes-BC,"$3,100,000.00",
184,13,14538,Orangefield WSC,W,,"6,531",The proposed project water system improvement will eliminate the use of private drinking water wells and address the human health needs by eliminating potential risks to public health and safety caused by the unsatisfactory water  quality.,PDC,"$8,900,000.00",,,,
185,13,14565,Abilene,M,TX2210001,"121,994","This project involves the replacement of existing water lines,  the installation of new water lines, the construction and/or  rehabilitation of pump stations, and storage tanks.",PADC,"$104,350,000.00",,,,
186,11,14421,Wilmer,M,,"4,772",The City of Wilmer is seeking to upgrade their water  distribution system to provide critical fire protection to  residents.,PADC,"$34,077,250.00",,,,
187,11,14624,Jim Hogg Co WCID # 2,D,,"4,838","Waterline replacement and street resurfacing of Maria Street  between David Street and Draper Street, Storage Tanks,  Chemicals, and Generators",PADC,"$3,898,691.00",,,,
188,11,14444,Creedmoor Maha WSC,W,TX2270008,"9,728",New Water Well,PDC,"$5,100,000.00",,,,
189,11,14445,Creedmoor Maha WSC,W,TX2270008,"9,728",CMWSC Water System Improvement to increase capacity  and serviceability,PADC,"$12,085,648.00",,,,
190,11,14447,Creedmoor Maha WSC,W,TX2270008,"9,728",The undersized lines currently have more connections than  allowed by TCEQ ?290.44(c) connection requirements.,PADC,"$2,837,385.00",,,,
191,11,14523,Laredo,M,,"259,151","Installation of 9,400 LF of 24'' water line along Loop 20 from  HWY 359 to Kansas City Southern Railroad and from HWY  359 to the new Cuatro Vientos Booster Station, providing  resiliency to the water system.",C,"$5,131,000.00",,,,
192,11,14568,Laredo,M,,"259,151","Installation of 9,000 LF of 16'' waterline on the west side of  Loop 20 from the Airport to US HWY 59, including borings, in  order to loop the system.",DC,"$7,168,000.00",,,,
193,11,14571,Laredo,M,,"259,151",Relocation of 24'' waterline on Loop 20 from Del Mar to  International. TXDOT US59 upgrade to IH69.,C,"$1,500,000.00",,,,
194,11,14572,Laredo,M,,"259,151",Replacing aging waterline infrastructure along Corpus Christi  St. from Cedar Ave. to Arkansas Ave.,C,"$4,500,000.00",,,,
195,11,14574,Laredo,M,,"259,151",Improve flow into the distribution system to maintain residuals  and pressure throughout the system and includes installation  of 24''pipe from South Laredo elevated storage tank to the  sports complex site.,DC,"$13,500,000.00",,,,
196,11,14576,Laredo,M,,"259,151","Construction of 12,000 LF of new 36"" Ductile Iron water main  from Jefferson WTP to intersection of Tilden Ave. and  Kearney St.",DC,"$30,736,000.00",,,,
197,10,14425,Johnson County SUD,D,TX1260018,16,"This project involves the installation and construction of  waterlines, pressure tanks and pump stations improvements  to bring two pressure planes into capacity compliance.",PADC,"$4,515,000.00",,,,
198,10,14679,Oglesby,M,TX0500003,484,"Development of a proposed new well for the City of Oglesby  to supplement their existing, dwindling water supply.",PADC,"$924,023.50",,,,
199,10,14470,Lone Oak,M,,786,The City of Lone Oak is experiencing issues with various  water lines in their system due to undersized lines and dead- ends.,PDC,"$600,000.00",,Yes-BC,"$600,000.00",
200,10,14517,Greater Texoma UA,M,,"1,374","New elevated storage tank planned for the Southmayd PWS,  will improve storage, pressure, and distribution of drinking  water. Upsizing of various 2-inch water lines to be identified in  planning phase.",PDC,"$2,424,200.00",,,,
201,10,14495,Loop 360 WSC,W,TX2270242,"1,770",The existing Loop 360 WSC Water Treatment Plant is over  thirty years old and many of the elements in the plant are in  need of replacement or improvement.,DC,"$8,481,414.00",,,,
202,10,14415,BCY WSC,W,TX0010018,"2,772","Planning, property acquisition, design, bidding, and  construction of a new drinking water well and new elevated  water storage tank.",PADC,"$3,878,000.00",,,,
203,10,14448,Greater Texoma UA,M,,"43,654",GTUA/City of Sherman Water System Improvements,C,"$2,785,875.00",,,,
204,10,14383,Johnson County SUD,D,TX1260018,"163,475","This project involves the installation and construction of  waterlines, storage tanks and pump stations to serve two  pressure planes.",PADC,"$26,000,000.00",,,,
205,10,14376,Austin,M,TX2270001,"1,053,756",The Center Street Pump Station will be replaced with a new  pump station including electrical improvements to bring the  station up to current design standards.,C,"$23,945,740.00",,,,
206,10,14592,Austin,M,TX2270001,"1,053,756",Building an additional reservoir in the Southwest B Pressure  Zone and its associated transmission main. This project is  required to provide storage and resiliency in the pressure  zone.,C,"$9,366,900.00",,,,
207,10,14593,Austin,M,TX2270001,"1,053,756",The proposed South IH-35 Reservoir is planned as a 3- million-gallon elevated reservoir 100'-150’ in height and will  include foundational piping for a future pump station.,C,"$14,397,850.00",,,,
208,10,14595,Austin,M,TX2270001,"1,053,756","Project infrastructure includes 8,500 feet of 72-inch diameter water pipeline along McNeil Drive from the 84-inch Jollyville Transmission Main to the 54-inch Martin Hill Transmission  Main and multiple 24-inch transmission mains at Parmer Ln.",C,"$34,217,000.00",,,,
209,8,14588,Mission,M,TX1080008,"77,058",City of Mission new 6 MGD Water Treatment Plant will  expand the total production capacity of treated water from the  permitted 25.5 MGD production capacity to 31.5 MGD for the  City of Mission CCN.,PADC,"$23,370,000.00",,,,
210,8,14553,McAllen,M,,"143,258",This Project consists of facility improvements at the Northwest  Water Treatment Plant such as to increase Capacity by a  minimum of 10 MGD.  The current plan is to install a parallel  treatment train that will essentially double capacity of the  North Water Treatment Plant.,C,"$25,300,000.00",,,,
211,7,14502,Greenville,M,,"32,000","Due to unprecedented growth, the City of Greenville needs to  expand the current water treatment plant.  Due to limited  available land to expand at existing plant, a new plant will  need to be built to better serve current and future growth  areas.",C,"$40,500,000.00",,,,
212,6,14589,Pearsall,M,,"9,346",Phase 1 for compliance with upcoming lead and copper rule  changes. Complete inventory of all service lines in the City of  Pearsall to determine which lines include lead in accordance  with EPA/TCEQ requirements. Overall plan for remaining  steps for compliance with new rules.,P,"$170,000.00",,,,
213,6,14516,Blum,M,,434,The purpose of this project is to replace/upsize undersized  water mains and replace non-working isolation valves.,PDC,"$300,000.00",,,,
214,6,14544,Fort Worth,M,TX2200012,"890,050","The Fort Worth Water Department is currently inventorying  service material throughout the city and removing city-owned  lead service lines, resulting in partial lead service line  replacement.  The Fort Worth Department would like to  continue with the removal of lead service lines on the  customer-owned portion.   The United States Environmental Protection Agency (USEPA)  Lead and Copper Rule Revision (LCRR) recommends full  service lead line replacement.  The rule also defines a lead  service as any galvanized service material currently or  previously downstream of a lead service line.  In addition, the  rule also considers any unknown service line material as lead  as well.  This project will involve the replacement of  approximately 1,200 known customer-owned lead service  lines and known galvanized service lines requiring  replacement.",C,"$12,000,000.00",,,,
215,5,14685,Wolfforth,M,TX1520005,"5,771","The City of Wolfforth relies completely on groundwater for our  water supply.  We are experiencing unprecedented growth,  and in need of expanding our water supply.  We are  requesting funding to develop six new wells.",PADC,"$9,350,000.00",,,,
216,5,14604,North Alamo WSC,W,TX1080029,"6,052","To address low water pressure concerns in the service area  south of Donna, Texas, North Alamo WSC will construct  37,000 lineal feet of waterlines.",PADC,"$2,722,705.00",,,,
217,5,14557,McAllen,M,,"143,258",McAllen Public Utility proposes to install large diameter  transmission lines such as to improve efficiency of water  delivery throughout the service area.  This loan will also be  used to fund the construction of a new elevated water storage  tower.,C,"$6,750,000.00",,,,
218,5,14591,Austin,M,TX2270001,"1,053,756",This project will replace galvanized services found in Austin Water’s system on both the public and private side of the meter.,C,"$6,038,000.00",,,,
219,4,14590,Austin,M,TX2270001,"1,053,756","Installation of approximately 6,200 linear feet of 24” reclaimed  water main.",C,"$7,845,000.00",,,,
220,4,14397,San Jacinto RA,D,TX1700197,"112,439",This project includes the replacement of 12 and 16-inch  asbestos cement water transmission lines along Grogan's Mill  Road south of Woodlands Parkway.,ADC,"$8,950,000.00",,,,
221,4,14402,San Jacinto RA,D,TX1700197,"112,439",This project includes replacement of 12-inch asbestos cement  water transmission lines along Lake Front Circle and  Pinecroft Drive between Grogan's Mill Road and IH-45.,ADC,"$10,900,000.00",,,,
222,4,14438,San Jacinto RA,D,TX1700197,"112,439","This project includes replacement of 12-inch asbestos cement  water transmission lines along Grogan's Mill Road between  Research Forest Drive and Woodlands Parkway, Lake  Woodlands Drive between Grogan's Mill Road and Pinecroft  Drive, and Six Pines Drive between Timberloch Drive and  North Millbend Road.",C,"$6,200,000.00",,,,
223,3,14687,Wolfforth,M,TX1520005,"5,771",Wolfforth needs to increase our water treatment capacity to  address the needs of our growing city.  We also intend to  develop an Asset Management Plan as a part of this project  to assist us in the future.,PADC,"$16,600,000.00",,,,
224,3,14453,Corix Utilities,P,,345,Addition of a new automatic meter reading (AMR) system and  a new SCADA system.,PDC,"$1,127,000.00",,Yes-BC,"$1,127,000.00",
225,3,14485,Tioga,M,,"1,366","The project involves constructing a new high service pump  station,  500,000-gallon elevated storage tank, 250,000- gallon ground storage tank, chlorination equipment, and a  400 gpm water well at the airport road site. Additionally, line  extensions to connect the elevated storage tank into the  distribution system are included.",PDC,"$11,022,459.00",,,,
226,3,14602,North Alamo WSC,W,TX1080029,"8,723","North Alamo WSC is proposing to install a new raw waterline  from the Delta Regional Water Plant No. 7 to the Engelman  Irrigation District. The project will provide Water Plant No. 7  with a secondary source of raw water. The improvements  include the installation of approximately 18,000 lineal feet of  pipeline with two control structures, a metering structure, and  roadway crossings. The improvements will provide the  treatment plant with two sources of raw water.",PDC,"$5,027,850.00",,,,
227,3,14559,McAllen,M,,"143,258",This Project consists of improvements to existing Back-up  Power facilities at both our South and Northwest Water  Treatment Facilities.,C,"$6,750,000.00",,,,
228,2,14466,Graford,M,TX1820003,830,"Replace existing water lines, install a SCADA System and  radio read meters",PDC,"$500,000.00",,Yes-BC,"$500,000.00",
229,2,14385,Dallas,M,TX0570004,"1,736,651","Dallas Water Utilities (DWU) is planning to build  approximately 32 miles of 120/96-inch diameter treated water  transmission pipeline along southern Dallas County. The  Southwest Pipeline project (Project) will transfer treated water  from the East Side Water Treatment Plant (ESWTP) located  in Sunnyvale, Texas through the southern portion of the DWU  service area to the Summit Ground Storage Tanks (GSTs)  located in Cedar Hill.",C,"$73,300,000.00",,,,
230,1,14389,Marsha WSC,W,TX2270040,680,"Marsha WSC is experiencing major and consistent water loss  in the distribution system. In order to prevent these losses,  the PWS will need to replace water lines and replace meters.  The system also needs to replace lines to accommodate fire  flow.",PADC,"$5,571,400.10",,Yes-BC,"$1,166,970.00",
231,1,14471,Parker WSC,W,,"3,000",The WSC wants to improve their water distribution system to  better service customers with sufficient pressure and  disinfectant residuals.,PDC,"$3,300,000.00",,Yes-BC,"$3,300,000.00",
232,1,14622,San Pedro Water  Resources,W,TX2330064,147,San Pedro water system requires a system upgrade to meet  capacity requirements by TCEQ,PDC,"$343,000.00",,,,
233,1,14478,Medina WSC,W,,780,"Expensive maintenance has been deferred over the years on  a Medina WSC storage tower that has been in operation  since 1967. A recent assessment indicates a need for repairs  and upgrades with a maintenance plan for the next 10 years  in order to maintain function and meet TCEQ standards.  The analog water meters used by Medina WSC develop  inaccurate readings, require manual readings, are not  accurate at identifying leaks on the customer or provider side  of the line, and are not able to accurately measure low water  flow, so the company is seeking to upgrade to ultrasonic flow  meters in order to conserve water by  reducing unaccounted  water loss, decrease contamination risks, and decrease labor  costs and hazards from meter reading and searching for  leaks.",C,"$394,756.00",,Yes-BC,"$138,406.00",
234,1,14686,Wolfforth,M,TX1520005,"5,771","The City of Wolfforth is experiencing significant growth, and in  order to meet our capacity needs, a new one-million gallon  Elevated Storage Tank must be constructed.",PADC,"$6,515,000.00",,,,
235,1,14446,Creedmoor Maha WSC,W,TX2270008,"9,728",Providing water services to those within the CMWSC CCN  who do not have it available.,PADC,"$5,527,971.00",,,,
236,0,14577,Bluegrove WSC,W,TX0390014,70,This project involves the construction of a new pump station  and the replacement of water distribution line to help with  water loss.,PDC,"$300,000.00",,,,
237,0,14543,Harrold WSC,W,TX2440002,141,Install a new supply line and repair the existing elevated  storage tank,PDC,"$300,000.00",,,,
238,0,14605,Weston WSC,W,TX0430050,283,Replace old waterlines with new PVC waterlines in the small  town of Weston to minimize losses and continual leak repairs.,P,"$259,008.80",,,,
239,0,14597,Conroe Bay Water-Sewer  Supply Corp,W,,345,"The existing water system of CB WSSC needs rehabilitation  and improvements due to the age of the facility.  Improvements include the addition of a new water well,  pressure tank, ground storage tank, and a generator system  for emergency event.",PDC,"$556,000.00",,,,
240,0,14612,Webb County,C,,348,This project will provide for the installation of a distribution  connection from the water main located adjacent to Mangana- Hein Road to the water Dispenser.,C,"$420,000.00",,,,
241,0,14379,River Oaks WSC,W,,375,"New Water Lines, Install Meters",PC,"$98,000.00",,,,
242,0,14527,Balmorhea,M,,408,Installation of control and remote monitoring equipment in key  locations along the drinking water transmission and  distribution lines.,PDC,"$300,000.00",,,,
243,0,14600,Woodloch,M,TX1700112,741,Repair and rehabilitate existing water well for the Town of  Woodloch's water system that is currently experiencing  capacity issues.,PDC,"$300,000.00",,,,
244,0,14408,Chatt WSC,W,,927,Water Meter Replacements,PDC,"$300,000.00",,Yes-BC,"$200,000.00",
245,0,14474,Bronte,M,TX0410001,949,"The City of Bronte currently has an area served with a 4""  water line.  Because of this, the area occasionally has low  water pressure during high usage and does not have  adequate flow for fire protection.  The proposed project would  replace the existing line with a 6"" or 8"" line so that adequate  pressure and flow can be provided.",PDC,"$300,000.00",,,,
246,0,14596,Stockdale,M,TX2470003,"1,413",The City of Stockdale proposes to install a new well to enable  it to continue to provide reliable drinking water to its  customers.,PADC,"$2,601,568.80",,,,
247,0,14499,Freer WCID,D,TX0660002,"2,461","This project consists of constructing one (1) composite  elevated tank, removing once (1) standpipe, rehabilitation one  (1) ground storage tank, and acquiring 1,000 smart water meters.",PDC,"$4,876,800.00",,,,
248,0,14477,Abernathy,M,TX0950001,"2,865","Construction and installation of a 500,000-gallon ground  storage tank and booster station near the city's wellfield to  extend the useful life of the City’s wellfield.",PADC,"$1,737,218.00",,,,
249,0,14480,Fairfield,M,TX0810001,"2,916","This project involves constructing a new high service pump  station at their existing well site, 400,000-gallon ground  storage tank, generator, and line extensions to connect the  tank into the distribution system.",PDC,"$3,450,748.30",,,,
250,0,14539,Olney,M,,"3,200",Rehabilitation or new construction of the existing water  treatment plant.,PADC,"$13,483,000.00",,,,
251,0,14507,Clifton,M,TX0180001,"3,442","The City of Clifton is pursuing funds to perform multiple  potable water system improvements, ranging from additional  waterline installations to provide system looping capabilities,  the drilling of a replacement well, and also the installation of  AMR meters",PADC,"$2,783,670.54",,,,
252,0,14530,Becker-Jiba WSC,W,,"3,618","300,000 gallon Single Pedestal Elevated Water Storage Tank  for extra storage and waterline extension.",PDC,"$3,140,000.00",,,,
253,0,14394,Justin,M,,"3,859",This project includes the addition of a ground storage tank  and high service pump station in order to increase the supply  that can be received from UTRWD.,DC,"$3,161,250.00",,,,
254,0,14598,Harris Co WCID #  92,D,TX1010124,"4,737",Water Plant & Distribution System Improvements,PDC,"$7,350,000.00",,,,
255,0,14396,Fort Stockton,M,,"8,424",The City of Fort Stockton is developing a project to diversify  its drinking water portfolio beyond the Edwards-Trinity Aquifer  for system resilience.,DC,"$12,970,000.00",,,,
256,0,14603,North Alamo WSC,W,TX1080029,"11,572",North Alamo WSC is proposing to construct a 1.0MGD  elevated storage tank within its service area to address  deficiency in elevated storage.,PADC,"$4,941,500.00",,,,
257,0,14411,Ennis,M,TX0700001,"20,678","Remove and replace existing old, undersized, and  deteriorating waterlines with a new larger diameter waterline.",PC,"$7,072,000.00",,,,
258,0,14541,Military Highway WSC,W,,"46,000","Military Water Supply Corporation will be upgrading 29,000  L.F. of existing waterline.",PADC,"$2,203,000.00",,,,
259,0,14552,Harlingen Water Works  System,M,,"75,330","HWWS’s two WTPs generate sludge that is stored in a single- cell lagoon at the MFR WTP. Sludge generated at the  Downtown WTP is temporarily stored in earthen basins, then  drained on the banks prior to hauling to the lagoon, while  MFR sludge is pumped directly to the lagoon.  Solids handling  improvements are proposed to discharge dilute sludge to the  sewer collection system and dewater it along with the WWTP  biosolids. Alternatively, Downtown WTP sludge will be  thickened / dewatered by mechanical methods prior to  hauling to the lagoon or to off-site disposal. The lagoon will  be divided two cells to allow drying and sludge removal from  one cell while the other continues in service.  Off-site disposal  options include land application, land filling, monofil, and  innovative use.",PAD,"$496,231.00",,,,
