call_label,severity,field,issue,suggestion
1_col_names,WARNING,Geographic Reference,Column not found in either data file. Data dictionary indicates 'No information' but column should be present for completeness.,Add Geographic Reference column or confirm intentional omission
1_col_names,WARNING,PWSID,Column not found in either data file. Data dictionary indicates 'No information' but column should be present for completeness.,Add PWSID column or confirm intentional omission
1_col_names,WARNING,Project Name,Column missing from ms-sfy27-base-gen-supp-fundable-list.csv. Data dictionary defines this as a standardized category.,Add Project Name column to fundable list file or use Project Title as equivalent
1_col_names,WARNING,Project Cost,Column not found in either data file. Data dictionary indicates 'No information' but column should be present for completeness.,Add Project Cost column or confirm intentional omission
1_col_names,WARNING,Funding Amount,Column not found in either data file. Data dictionary indicates 'No information' but column should be present for completeness.,Add Funding Amount column or confirm intentional omission
1_col_names,WARNING,Principal Forgiveness,Column not found in either data file. Data dictionary indicates 'No information' but column should be present for completeness.,Add Principal Forgiveness column or confirm intentional omission
1_col_names,WARNING,Population,Column not found in either data file. Data dictionary indicates 'No Information' but column should be present for completeness.,Add Population column or confirm intentional omission
1_col_names,WARNING,Project Rank,Column not found in either data file. Data dictionary indicates 'No Information' but column should be present for completeness.,Add Project Rank column or confirm intentional omission
1_col_names,WARNING,Expecting Funding?,Column not found in either data file. This is a key standardized category defined in the data dictionary.,"Add Expecting Funding? column with values derived from list membership (Yes for fundable list, No for planning list)"
1_col_names,INFO,Zip Code,Column found in both files but not defined in standardized categories. Spacing differs from typical conventions.,Define how Zip Code relates to Geographic Reference or confirm as supplementary field
2_types_nulls,ERROR,Loan Funds Requested,Column is character type but should be numeric according to data dictionary (Requested Amount should be a monetary value). Currency formatting with $ and commas prevents numeric operations.,"Convert to numeric type by removing $ and commas, or parse as currency/numeric data type"
2_types_nulls,ERROR,Loan Funds,Column is character type but should be numeric according to data dictionary (Requested Amount should be a monetary value). Currency formatting with $ and commas prevents numeric operations.,"Convert to numeric type by removing $ and commas, or parse as currency/numeric data type"
2_types_nulls,WARNING,Project Name,"3.4% NA rate (1 of 29 rows) in planning-list.csv. Dictionary specifies 'No information' for Project Name but does not explicitly allow nulls. The fundable-list uses 'Project Title' (0% NA) while planning-list uses 'Project Name' (3.4% NA), creating inconsistency in data completeness.",Either populate missing Project Name values or confirm that nulls are acceptable for planning-list records
2_types_nulls,INFO,Zip Code,"Column name uses escaped newline character ('Zip\nCode') in actual data structure, which is non-standard and may cause parsing issues in downstream systems.",Rename column to 'Zip_Code' or 'ZipCode' without special characters
2_types_nulls,INFO,Priority Points,"Column name uses escaped newline character ('Priority\nPoints') in actual data structure, which is non-standard and may cause parsing issues in downstream systems.",Rename column to 'Priority_Points' or 'PriorityPoints' without special characters
2_types_nulls,INFO,DC,Dictionary specifies standardized field 'Disadvantaged' but source data uses abbreviation 'DC'. The mapping is clear but terminology is not standardized.,Rename column to 'Disadvantaged' for consistency with data dictionary terminology
2_types_nulls,WARNING,Project,"Column combines PWSID/Project ID with borrower name (e.g., '04700071 - Town of Byhalia'). Dictionary treats these as separate standardized categories but source data merges them.",Split 'Project' column into separate 'Project_ID' (numeric prefix) and 'Borrower' (name suffix) columns to align with data dictionary structure
2_types_nulls,INFO,Project Title vs Project Name,Fundable-list uses 'Project Title' while Planning-list uses 'Project Name'. Dictionary standardizes to 'Project Description' but source uses different column names between files.,Standardize column naming across both files; rename both to match dictionary term 'Project_Description'
3_script_logic,ERROR,project_type,"The project_type classification uses 'project_title' column, but rows from the planning list have their project description stored in 'project_name' (not 'project_title'). After the bind_rows merge, planning list rows will have NA in 'project_title', causing all planning list projects to default to 'General' regardless of their actual content.","Use the merged 'project_description' column (already standardized from both lists) for the grepl checks in project_type case_when, or coalesce project_title and project_name before the type classification."
3_script_logic,ERROR,borrower,"Borrower is extracted using str_split_i(project, '-', 2), which takes only the second segment after splitting on '-'. If the borrower name contains hyphens (e.g., 'Mid-South Water'), only the portion between the first and second hyphen will be captured, truncating the borrower name.","Consider splitting only on the first hyphen and taking everything after it, e.g., using sub('^[^-]+-\\s*', '', project) or str_split_i with a fixed split count and recombining remaining parts."
3_script_logic,ERROR,project_id,"project_id is extracted using str_split_i(project, '-', 1), which takes only the first segment. If the project field format is 'ID - Borrower Name', this may work, but if IDs themselves contain hyphens, the ID will be truncated. This assumption about format is not documented in the dictionary and could silently produce incorrect IDs.","Verify the exact format of the 'project' field and document the parsing logic. If IDs never contain hyphens, add a validation check; otherwise adjust the extraction regex."
3_script_logic,WARNING,disadvantaged,"The dictionary specifies that planning list projects should have 'No Information' for Disadvantaged, which is correctly implemented. However, for the fundable list, projects where 'dc' is neither 'Y' nor 'N' (e.g., blank or unexpected value) will be coerced to 'No' by the ifelse, which may be incorrect.","Use a three-way condition: ifelse(dc == 'Y', 'Yes', ifelse(dc == 'N', 'No', 'No Information')) to handle unexpected or missing dc values."
3_script_logic,WARNING,project_type,"The dictionary specifies a long list of EC keywords including 'cyanotoxin', 'dioxane', 'IIJA EC', 'IIJA-EC', 'BIL EC', 'BIL-EC', 'emerging containment', 'emerging contaminant', 'lithium', 'manganese', 'Mn', 'Perfluoro-n-pentanoic acid', 'PFPeA', 'PFAS', 'PFOA', 'PFOS', 'DBP', 'disinfection byproduct', 'HAA5', 'haloacetic acid', 'trihalomethane', 'THM', 'Unregulated Contaminant Monitoring Rule'. The script uses an external variable 'ec_str' which is not defined in this script, making it impossible to verify completeness or correctness of the EC keyword matching.",Define or validate ec_str within this script or in a shared constants file and ensure it matches exactly the keywords listed in the data dictionary.
3_script_logic,WARNING,NA,The script filters out two specific project_ids ('0540013' and '0490006') from the planning list with no inline comment or documentation explaining why these records are excluded. This could silently remove valid records.,"Add a comment explaining the reason for excluding these specific records (e.g., duplicates, data errors). If they are duplicates from the fundable list, verify that logic is correct and consider a programmatic deduplication approach."
3_script_logic,WARNING,geographic_reference,"The dictionary defines 'Geographic Reference' as a required standardized column, but the script creates 'community_served' instead of 'geographic_reference'. The dictionary states 'No information' for this field, but the column name in the output does not match the standardized dashboard column name.","Rename 'community_served' to 'geographic_reference' to align with the data dictionary standardized column name, even if the value is NA."
3_script_logic,INFO,project_description,"The script applies replace_na(project_description, 'No Information') after the project_description is set from project_title or project_name. This is reasonable, but the dictionary does not explicitly state that missing descriptions should be 'No Information'; it describes it as text from source documents.",Confirm with the data governance team whether 'No Information' is the correct fill value for missing project descriptions or if such rows should be flagged differently.
3_script_logic,INFO,expecting_funding,"The dictionary notes a third value 'No Information' for Expecting Funding, but the script only assigns 'Yes' or 'No'. If a project's funding status is truly unknown, there is no path to assign 'No Information'.",Verify whether any rows in either source list could have unknown funding status and add handling for that case if needed.
4_script_data,ERROR,project_id / borrower,"str_split_i(project, '-', 1) and str_split_i(project, '-', 2) split on the first '-' only. The Project field uses ' - ' (space-hyphen-space) as a delimiter, but some borrower names themselves contain hyphens (e.g., 'STRAYHORN W/A-CROCKETT', 'G T & Y WATER DISTRICT INC'). More critically, project_id '04700071' in the fundable list head row is '04700071 - Town of Byhalia', so splitting on '-' yields '04700071 ' and ' Town of Byhalia' which after str_squish is correct. However, '0690006 - STRAYHORN W/A-CROCKETT' splits on the first '-' giving project_id='0690006 ' and borrower='STRAYHORN W/A' (the rest ' CROCKETT' is dropped). The borrower name is truncated for any entry containing a hyphen after the delimiter.","Use a regex split on the first occurrence of ' - ' (space-hyphen-space) rather than bare '-', e.g., stringr::str_split_fixed(project, ' - ', 2) and take columns 1 and 2, or use str_extract for the ID and str_remove for the borrower portion."
4_script_data,ERROR,project_type,"project_type classification uses 'project_title' column, but after the bind_rows merge the planning list rows have 'project_description' set from 'project_name' (the planning list column), not 'project_title'. The column 'project_title' does not exist in the planning list CSV (it has 'project_name'), so after janitor::clean_names() and bind_rows, 'project_title' will be NA for all planning list rows. The case_when grepl on a NA column will return FALSE, classifying all planning list projects as 'General' regardless of actual content.","Derive project_type from project_description (which is already standardized across both lists) rather than project_title, or create an intermediate unified column before the project_type classification step."
4_script_data,ERROR,project_id,"The first entry in the fundable list has Project value '04700071 - Town of Byhalia' — the project ID portion is '04700071' (8 digits), while all other IDs appear to be 7 digits (e.g., '0500008', '0520008'). The script does no validation or normalization of project_id length, so '04700071' will pass through as-is. If downstream deduplication or matching logic assumes 7-digit IDs this record will fail to match.",Add a validation check or log a warning when project_id length differs from 7 characters; investigate whether '04700071' is a data entry error (possibly '0470007' with an extra digit).
4_script_data,WARNING,project_score,"The fundable list Priority Points column name in the raw CSV is 'Priority\nPoints' (contains a newline character). After janitor::clean_names() this becomes 'priority_points'. The same column in the planning list also appears as 'Priority\nPoints'. The script references 'priority_points' which should work post-clean_names, but the Zip Code column also has a newline ('Zip\nCode' -> 'zip_code'). This is not a bug per se but should be confirmed that janitor::clean_names() consistently handles embedded newlines the same way across both files.","Add an explicit test or assertion after fread/clean_names that the expected column names ('priority_points', 'loan_funds_requested', 'loan_funds', 'project_title', 'project_name', 'dc') are present before proceeding."
4_script_data,WARNING,disadvantaged,"For the fundable list, disadvantaged is set to ifelse(dc == 'Y', 'Yes', 'No'). If dc contains any value other than 'Y' or 'N' (e.g., NA, lowercase 'y', whitespace), those rows would be silently coded as 'No' rather than 'No Information' or flagged.","Use a case_when instead: case_when(dc == 'Y' ~ 'Yes', dc == 'N' ~ 'No', TRUE ~ 'No Information') to handle unexpected values safely."
4_script_data,WARNING,project_description,"The planning list has 3.4% NA in Project Name. After str_squish(project_name) these remain NA, and the replace_na(project_description, 'No Information') is only applied in ms_clean after bind_rows. However, replace_na is applied to project_description in ms_clean but project_description was set in the individual list mutate steps before the merge. Confirm that replace_na in the ms_clean mutate block actually operates on the merged project_description column and that the NA rows from the planning list are correctly caught.",Verify that the replace_na call in ms_clean references the correct column name and is not inadvertently overwriting non-NA values or missing NAs introduced during bind_rows.
4_script_data,INFO,filter step / project_id,"The script filters out project_id '0540013' and '0490006' from the planning list. '0490006 - NORTH DISTRICT 1 WATER ASSN.' appears as the first row of the planning list sample, confirming it exists and will be filtered. No issue with logic, but the reason for exclusion is undocumented in the script.","Add a comment explaining why these two project IDs are excluded from the planning list (e.g., duplicates already present on the fundable list)."
