,Sponsor & Project Name,"SRF ProjectNumber",Project Description,"SC System IDNumber","Estimated TotalProject Cost","Requested SRFAssistance1","Sponsor'sServicePopulation","PopulationAffected byProject","TotalPoints"
51,"Lane, Town of - Lane Water SystemImprovements, Lead Service Line Inventoryand Replace Water Mains",4510056-04,"Repaint and repair tank, renovate well electrical, rebuild mastermeter connection and add SCADA.  Lead Service Line inventoryper DHEC guidance.  Replace asbestos-cement mains.",4510005,"$           1 ,000,000","$           1 ,000,000",443,264,30
52,"Lincolnville, Town of - Downtown WaterSystem Upgrades",1010007-01,"The town of Lincolnville's aging water system is no longer able tomeet the needs of the town's residents and commercialcustomers. The water lines and other system components are atthe end of their life expectancy. The town is also experiencinggrowth with a 27% increase in population between 2000 and2020. As part of the mapping effort of the SC Rural WaterAssociation, that agency also helped the town identify the areaswithin the town's system in greatest need. It is proposed toreplace/upgrade the water distribution lines in the most criticalneed. Additional lines will follow in the future as fundingbecomes available.",1010007,"$           1 ,500,000","$           1 ,500,000","1 ,147",2 50,30
53,"Lowcountry Regional Water System -Jackson Avenue Elevated Tank Rehab",2510001-01,"Rehab and repair a 200,000 gallon elevated tank that is nearing30 years old along with associated well piping and electricalupgrades.",2510001,"$              4 15,000","$              5 00,000",7017,823,30
54,"McCormick Commission of PublicWorks - Isolation Valve Installation",3510001-05,"This project will replace inoperative or aging valves to prevent acatastrophic loss of water and prevent dangerously low waterlevels in elevated storage tank.",3510001,"$           1 ,111,034","$              9 96,557",2320,885,30
55,"McCormick Commission of PublicWorks - Mechanical Barscreen and RawWater Pump Station Improvements",3510001-06,"This proposed application incorporates the raw water pumpstation improvements. The project proposes to install larger rawwater pumps with Variable Frequency Drives and a modernelectrical system.  SRF is funding engineering only.",3510001,"$           5 ,073,502","$              4 45,283","2 ,200","2 ,200",30
56,"Olanta, Town of - Lead Service LineInventory and Replace Water Mains",2110006-04,"LSL inventory per DHEC guidance.  Drinking water distributionsystem improvements including replacing galvanized andasbestos-cement mains.",2110006,"$           6 ,614,719","$           6 ,614,719",551,372,30
57,"Pelion, Town of - Pelion - Main StreetWater Main Replacement",3210010-01,"The Main Street Water Main Replacement Project will consist ofthe replacement of approximately 3,800 LF of 6” water main, fourfire hydrants and sixteen water services.  It is proposed that thenew main will be upsized to 10” in diameter.  When theinterconnect was made with the Commission, the main feedpoint to the Town was modified.  This increase in pipe size willallow for system flow improvement through the town to accountfor this change in hydraulics.   In addition, this upsize willimprove fire flows within the Town (most significantly to the fourschools).",3210010,"$              9 50,000","$              9 50,000","1 ,100",1 00,30
58,"Scranton, Town of - Scranton LeadService Line Replacement Project",2110009-01,"Complete Lead Service Line Replacement (LSLR) ofapproximately 343 services. Approximately 20,904 LF ofasbestos-cement (AC) and 10,097 LF of galvanized mains willalso need to be replaced to complete LSLR and completelyeliminate the potential for lead contamination.",2110009,"$           4 ,331,639","$           4 ,331,639",831,502,30
59,"Summerton, Town of - Goat Island WaterSystem Improvements",1410003-05,"Construction of a 150,000 gallon elevated water storage tankand waterline extensions connecting Gin Pond water system toGoat Island water system.","1450005, 1450012,1450008, 1450006","$           2 ,152,000","$           1 ,152,000",916,292,30
60,"Turbeville, Town of -Puddin Swamp Road Water MainExtension/Looping",1410004-01,"The projects consists of an extension of the Town's water systemto provide an interconnection with the existing 10"" water mainalong US Hwy. 378 with an existing 4"" or 6"" water main along SCHwy. 58 (Shiloh Road). The water main would extend alongPuddin Swamp Road and include an additional loop to serve S-14-521. The total project includes approximately 11,475 linearfeet of 8"" water main, 300 linear feet of 10"" HDPE horizontallydirectional drilled water main, 11 fire hydrants, approximately 41service connections and miscellaneous items such as pavementrepairs.",1410004,"$           1 ,015,000","$              9 41,400","1 ,680","3 ,180",30
61,"Abbeville, City of - Henry St. and HillcrestDr. Water Line Replacement",0110001-05,"Replacement of ~2,400 linear feet of old and deteriorating castiron water line with PVC pipe.",110001,"$600,000.00","$           1 ,000,000","5,362",475,30
62,"St. Matthews, Town of - WaterInfrastructure Evaluation & Planning Study",0910001-02,"Perform a study of the Town's supply and distribution system toidentify problem areas, prioritize improvements and identifyfunding sources.",910001,"$50,000.00","$              1 00,000","2,650","2,650",30
63,"Elloree, Town of - 2020 WaterImprovements",3810003-02,"Replace ~2,500 LF of aging asbestos cement water mains.",3810003,"$287,001.00","$              5 74,002","1,450","1,450",30
64,"Beech Island Rural Community Waterand Sewer District - Beech Island AvenueWater Line",0220004-01,"This project consists of a water line replacement and upgradeson Beech Island Avenue. The entity has old asbestos-cementwater lines on large transmission lines which are mostsusceptible to breaks. The water line on Beech Island Avenuefrom Tank 1 to Atomic Road currently moves nearly 700 gpm ofwater and supplies roughly half of the water to Kimberly Clark(Largest Industry) and all the water to the west and northwestportion of Town. Unfortunately, this line is a brittle asbestos-cement line that is sensitive to flow changes and pressurespikes. If this line breaks, Beech Island will have difficultysupplying water to these customers. The existing 8-inchasbestos cement line should be replaced with a new 12-inchwater line.",220004,"$           1 ,998,015","$           1 ,500,000","8 ,051","8 ,051",25
65,"Rural Community Water District ofGeorgetown County - Brick ChimneyRoad Well",2220001-01,"The proposed new groundwater well would be a 500 GPM wellon the western side of the system. This will provide redundancyand a second source of drinking water within the western portionof the system should there be a pipeline break that disconnectsthe northern and western service areas. With the installation ofthis well, the western part of the system will have adequatecapacity.  An existing water main is located adjacent to this siteto connect the new well to the western portion of the system.",2220001,"$           1 ,300,000","$           1 ,300,000","4 ,854","4 ,854",25
66,"Starr-Iva Water & Sewer District - WaterSystem Improvements",0420005-03,"The project includes replacement of various aging infrastructureto address capacity and resiliency while supporting futureeconomic growth opportunities and extension opportunities forunserved portions of the Starr-Iva service area.",420005,"$10,595,000.00","$              5 00,000","8 ,688","8 ,688",25
67,"Starr-Iva Water & Sewer District - KayeDrive Waterline Improvements",0420005-01,"Installation of ~3600 linear feet of water mains to improve adistribution system that was improperly installed and is non-compliant with state standards for public water supply.",420005,"$302,000.00","$              3 02,000","4,250",33,25
68,"Aiken, City of - Shaws Creek WaterTreatment Plant",0210001-03,"The replacement of the Shaw’s Creek WTP on the Northside toensure that the water service can continue uninterrupted and tomeet the increasing demands required to provide safe cleandrinking water. The existing water plant has been in operation foralmost seven decades and has reached the end of it service life.",210001,"$         7 2,600,000","$         5 8,100,000","2 3,389","2 3,389",20
69,"Aiken, City of - Southside Elevated Tankand Waterlines",0210001-04,"The City plans to construct a new elevated water tank andassociated lines on the southside of town to address growth andsystem redundancy. The City had a technical review of aSouthside Water Tank(s) and waterlines.  The determination wasmade that three projects be studied for a phase approach.  SouthAiken High EWT and Powderhouse Road pressure zone,Anderson Pond Road waterline, and Anderson Pond Road EWTand pressure zone, will be further investigated.",210001,"$         1 5,000,000","$         1 5,000,000","2 6,500","1 5,000",20
70,"Anderson Regional Joint Water System -Clemson Booster Station 5 MG GroundStorage Tank Addition",0420011-07,"The Ground Storage Tank project will consist of a 5MG waterstorage tank which will provide reliable water capacity to eight(8) water districts and municiplaities in Anderson and Pickenscounties while allowing plant operations to conserve powercosts. Additionally, ARJWS has trouble meeting peak hourneeds when the City of Clemson and Clemson Universityexperience massive increases in population during ClemsonFootball events. This problem will only intensify and becomemore common as the university expands and the cities served bythe Lake Hartwell plant grow. Eventually, the plant will have toundergo a major expansion or a new plant will need to be built,but in the meantime, the construction of additional storagecapacity is a cost-effective way to help remedy this problem.",420011,"$           8 ,820,000","$              7 00,000","2 20,000","2 20,000",20
70,"Anderson, City of - East Market Street &Wellington Mill Waterline Improvements",0410012-03,"The overall project consists of the installation of the followingwater facilities:East Market Street - Installation of approximately 2,500 LF of 6-inch waterline, 2,000 LF of 2-inch waterline, 2 fire hydrants, 60service reconnections, pavement replacement, associated valvereplacements, and all related appurtenances required for acomplete installation. The proposed waterlines will be the samesize as the existing waterlines they are replacing, see Figure 2for reference.Wellington Mill - Installation of approximately 5,000 LF of 6-inchwaterline, 9,050 LF of 2-inch waterline, 6 fire hydrants, 140service reconnections, pavement replacement, associated valvereplacements, and all related appurtenances required for acomplete installation. The proposed waterlines will be the samesize as the existing waterlines they are replacing, see Figure 3for reference.",410012,"$           3 ,250,000","$           3 ,000,000","3 8,204",4 50,20
71,"Andrews, Town of - Town Wide WaterSystem Modeling, Mapping, and CapitalImprovement Plan",2210003-01,"Perform system wide modeling and mapping to developmentCIP plans to improve the quality and delivery of water to theTown of Andrews existing customers.",2210003,"$                9 7,000","$                9 7,000",2866,2866,20
72,"Berkeley County Water & Sewer -  Hwy311/Popular Hill/Whitehouse Water Line",0820002-13,"This project will construct 2 segments of 6"" water line. The firstsegment is 1. 75 miles long and connects from an existing waterline near Forked Ln on SC 311, along SC 311, and connects toan existing water line at HWY 176. The second segment is 4.5miles long and will connect between 2 existing waterlines at SC311 and HWY 176 and run along Popular Hill Dr. Theseconnections will result in greater system reliability, lower outageimpact for maintenance, less flushing for water quality, fireprotection, and provide clean water for approximately 91 newrural customers.",820009,"$           6 ,825,000","$           1 ,825,000",10705,235,20
73,"Berkeley County Water & Sewer - St.Stephen/Pineville/Cross Water Line",0820002-14,"This project will construct 10 miles of 8"" water line down SanteeRiver Road (SC45) from Cross to St. Stephen. This connectionwill connect between two existing water lines and will will resultin greater system reliability, lower outage impact formaintenance, less flushing for water quality, fire protection, andprovide clean water for approximately 76 new rural customers.",820009,"$           8 ,650,000","$           2 ,000,000",10705,200,20
74,"Berkeley County Water & Sewer, - St.Stephen/Alvin/Jamestown Water Line",0820002-12,"This project will construct 13 miles of 8"" water line down SanteeRiver Road (SC45) from St Stephen to Highway 17A. Thisconnection will connect between two existing water lines and willresult in greater system reliability, lower outage impact formaintenance, less flushing for water quality, fire protection, andprovide clean water for approximately 140 new rural customers.",820009,"$           9 ,250,000","$           2 ,250,000",10705,360,20
75,"Berkeley County Water and Sanitation -Whitesville/Cane Bay Water Project",0820002-11,"Demolish water tower at Whitesville and construction of a new16"" water main and appurtenances along Black Tom Road andconstruct a new 1 MGD water tower to increase water pressurein service area and provide necessary SCDHEC storagerequirements",820002,"$         1 2,000,000","$         1 2,000,000","6 4,000","6 4,000",20
76,"Bucksport Water System, Inc. - WaterMain Extensions 2022- Gunters Island Rd",2620003-01,"Approximately 9,800 LF of new 6"" SDR21 PVC waterline onGunters Island Road to provide service to residents currentlyusing contaminated private wells.",2620003,"$              5 92,320","$              5 92,320",15297,35,20
77,"Chester Metropolitan District - HemphillWater Treatment Plant Renovation Project",1220002-02,Improvements at the Hemphill WTP,1220002,"$         1 6,893,610","$           5 ,506,000","1 4,739","1 4,739",20
78,"Donalds-Due West Water & SewerAuthority - Develop asset managementplan",0120001-03,"Project includes completion of a utility asset inventory anddrafting of a capital improvements plan to define priorityimprovements and to streamline long-term asset managementstrategy.",120001,"$              2 90,000","$              2 90,000","2,501","2,501",20
79,"Grand Strand Water and Sewer AuhorityBull Creek SWTP Expansion",2620004-30,"The project consists of expanding the water treatment plant toconvey 60 MGD through minimal equipment and pipingmodifications: addition of a single rapid mix basin, two (2) solidscontact clarifiers, four (4) cell cluster filters, one (1) 2.5 million-gallon clearwell, and additional chemical feed modifications. Atthe intake, modifications would be required to achieve a firmcapacity of 60 MGD through the addition of a second pumpheader. To convey the 60 MGD, an additional 36-inch raw watertransmission line would parallel the two (2) existing lines fromthe intake of the plant. This would then tie into a proposed 60-inch manifold and chemical feed vault before splitting betweenthe four (4) treatment trains.",2620004,"$         3 8,636,000","$         2 8,636,000","3 16,000","3 16,000",20
80,"Greenville Water - Adkins 60"" PotableWater Transmission Main - Phase 1A",2310001-03,"The scope includes a total of 30,900 feet of 60-inch finishedwater main from the Adkins Water Treatment Plant toapproximately Amberwood Rd.  Includes two (2) 60""Interconnections between parallel water mains.",2310001,"$         6 7,483,000","$         3 0,000,000","6 60,000","6 60,000",20
81,"Hilton Head Public Service District -Water System Improvements",0720006-07,"Water system improvements include an expansion of the ROWTP from 4 mgd to 6 mgd, new RO production well, new ASRwell, replacement of a booster pump station, and installation of agenerator.",720006,"$         1 8,700,000","$           7 ,700,000","2 5,500","2 5,500",20
82,"Marlboro County / Marlboro WaterCompany- New Production Well andTreatment Facility - Phase I",3420001-01,"The project includes the construction of a test well, newproduction well, pump, piping, electrical, and all necessaryappurtenances.  The new well will improve system hydraulicsand allow other system wells to be taken off-line and serviced.",3420001,"$              7 03,500","$              2 03,500",4588,2163,20
83,"Orangeburg, City of - Residuals & WaterPlant Improvements Project",3810001-03,"The project is located at the ODPU John F. Pearson WaterTreatment Plant, 395 Seaboard St NW, Orangeburg, SC 29115.Work will be at the WTP, at the WTP lagoon, and a portion ofproposed force main that will extend approximately 2,000 feet toconnect to existing sewer. Residuals Piping: New sludgecollector drain piping to separate alum sludge, new alum sludgepump station, and new force main to existing sewer off site.Chemical Storage: Remove existing sodium hydroxide storageand feed system, add lime slurry storage tank and transferpump.  Backwash Pump: Augment existing backwash pumpcapacity and create one redundant pump.  Alum Sludge Lagoon:Collection, removal, dewatering, and disposal of alum solids.",3810001,"$         1 2,145,000","$         1 1,500,000","4 9,000","4 9,000",20
84,"Summerville CPW, Sawmill Branch WaterSupply - Booster Pumping & StorageImprovements",1810003-01,"The project includes two (2) 1.0 million gallon ground storagetanks and a booster pump station downstream of SummervilleCPW's metered connection to the Santee Cooper Water System.Additionally, it includes an approximately 7,000 LF 30-inchtransmission main from the proposed booster pump station torun parallel to the existing 24-inch transmission main.",1810003,"$         1 0,064,410","$           8 ,000,000",80873,80873,20
85,"Union, City of - WTP Electrical andInstrumentation Upgrade",4410001-02,"Replacement of the main electrical feeders, breakers, and wiringat the City's Water Treatment Plant.The project will also includethe replacement and upgrades to the SCADA monitoring/controlsystem and the replacement of approximately 38 electric valveactuators for the filter piping system.",4410001,"$           1 ,100,000","$           1 ,000,000",11900,24645,20
86,"Myrtle Beach, City of - WaterTransmission Main Protective Measures -Pressure Reducing Valve Installation",2610001-03,"Upgrade 11 aging pressure reducing valves to regulate andmaintain proper pressures throughout the distribution system toprevent adverse impacts to system and maintain service forcustomers.",2610001,"$2,524,634.00","$           2 ,524,634","20,955","20,955",20
87,"Berkeley County Water & Sanitation -Whitesville/ Cane Bay Water Project",0820002-11,"Demolish water tower and construct a 16"" water main andappurtenances and  a 1 MGD water tower to increase waterpressure in the service area and to comply with necessarystorage requirements.",820002,"$11,000,000.00","$         1 1,000,000","64,000","64,000",20
88,"Fripp Island Public Service District -Fripp Island Automated MeteringInfrastructure",0720002-03,"Replacement of approximately 1,700 water meters with newmeters that include meter transmitting units and installation of aleast 4 data collectors to collect meter readings in real time. Ofthe 1,700 meters, 1450 are residential and the rest commercial.",720002,"$           1 ,700,000","$           1 ,700,000","3 ,536","3 ,536",15
89,"Grand Strand Water and Sewer AuhorityInternational Drive 36-in Transmission Main",2620004-27,"Install approximately nine miles of 36-in transmission mainand appurtenances to increase reliability and redundancyin the water supply to the northern end of the Bull CreekWater System.",2620004,"$         3 3,850,000","$         3 3,850,000","3 09,000","3 09,000",10
90,"Grand Strand Water and Sewer AuhorityConway Parallel Transmission Main",2620004-28,"24 inch PVC transmission main from Bull Creek SWTP to theConway BPS.",2620004,"$         2 4,250,000","$         2 0,238,000","3 16,000","3 16,000",10
91,"Grand Strand Water and SewerAuthority - Peachtree Ground Storage andHigh Service Pump Station",2620004-29,"Installation of ground storage tank and high service pumpingstation for delivery of potable water to existing customers inHorry County, SC.",2620004,"$         1 2,000,000","$         1 2,000,000","248,930","248,930",10
92,"Grand Strand WSA - International Drive 36in Transmission Main",2620004-27,"Install approximately nine miles of 36-in transmission main andappurtenances to increase reliability and redundancy in thewater supply to the northern end of the Bull Creek WaterSystem.",2620004,"$20,700,000.00","$         2 0,700,000","309,000","309,000",10
93,"Rock Hill, City of - Mt. Gallant Road WaterTank",4610002-10,"Construction of a new 1.0 MG elevated water tank. The tank willbe connected to the 24"" water line that was recently installedalong Mt. Gallant Road.",4610002,"$5,600,000.00","$           5 ,400,000","84,000","8,458",10
94,"Lane, Town of -  Heineman Road WaterProject",4510053-03,"Install new waterlines along Heineman Road. Approximately14,711 LF of 10"" mains, 3,154 of 3"" mains, 9 hydrants, 2 posthydrants and 25 services.",4510053,"$           1 ,388,700","$              5 00,000",443,264,0
95,"Pageland, Town of - Pageland WaterImprovement",1310003-01,"This project will extend a 12-inch waterline for a spec buildingand proposed 530 homes and 200 town homes.",1310003,"$           1 ,270,345","$              9 79,455",2535,,0