,Sponsor & Project Name,"SRF ProjectNumber",Project Description,"SC System IDNumber","Estimated TotalProject Cost","Requested SRFAssistance1","Sponsor'sServicePopulation","PopulationAffected byProject","TotalPoints"
1,"Darlington County Water and SewerAuthority - DCWSA Line ExtensionsPhase 22",1620001-04,"The project consists of adding water mains and services to areaswhere drinking water wells werecontaminated with PFAS. Well test reports were provided bySCDHEC and EPA.",1620001,"$           6 ,784,618","$           6 ,784,618","4 6,000",1 18,160
2,"Allendale, Town of -  Water SystemAssessement",0310001-01,"The assessment will update mapping of the water distributionsystem including location of fire hydrants, blow-offs, valves andbackflow devices. The assessment will result in a thoroughreview and evaluation of the town's water system. It will locateand document system components, detail needed repairs andimprovements, and provide a plan a to bring the system incompliance with State Primary Drinking Water Regulations.",310001,"$              2 50,000","$              2 50,000",2738,2738,135
3,"Eastover, Town of - Drinking Water WellFixed Emergency Generators",4010002-01,"The proposed project would include the purchase and installationof two fixed emergency generators for the town's water supplywells.",4010002,"$              2 00,000","$              2 00,000",8 13,8 13,135
4,"Berkeley County Water and Sanitation -Sandy Run Water Line",0820002-15,"This project will be 5250 feet of 8 inch PVC waterline connectingto an existing water line on Jedburg road that will serve homes inthe vicinity of Sandy Run Circle and a small community watersystem for a mobile home park in Summerville SC.  This projectwill include all construction  engineering, surveying, andpermitting. Project can serve the 15 trailers in the park andpotentially 28 additional dwellings along the road.",820002,"$              8 00,000","$              8 00,000","7 6,685",1 15,130
5,"Bennettsville, City of - Lime ChemicalFeed Systems and Roof Repairs for CIO2Building",3410001-04,"The proposed project includes lime chemical feed systems toreplace the City's old caustic feed systems and roof replacementfor the chlorine dioxide building. The new lime chemical feedsystem would correct their problem with low alkalinity at thesurface water plant. The low alkalinity caused the City to violateturbidity requirements resulting in a consent order in 2019. Theproject will also include a charge analyzer to assist WTP staff inidentifying proper coagulant dosage and pH during rapidlychanging water quality conditions. The City has a different WTPSuperintendent from the one that was at the WTP back in 2019.The new Superintendent understands the benefit to moving to alime feed system to aid in the operation of the WTP. The limefeed system at Lyall Street would ensure compatible water in thesystem.",3410001,"$              9 50,450","$              9 50,450","9 ,100","9 ,100",125
6,"Greeleyville, Town of - Water SystemReliability & Efficiency ImprovementsProject and Lead Service Line Inventory",4510001-03,"Renovate two regional connections #1 & #2 between theGreeleyville water system and the Williamsburg County watersystem, install SCADA on the water system, repaint the existingtank, and install roof over electrical panel at existing well #2.Lead Service Line inventory per DHEC guidance.",4510001,"$              4 50,000","$              3 46,904",377,425,115
7,"Hemingway, Town of - Highway 261Water System Upgrades",4510004-03,"Project to replace old 6"" and 8"" lead joint, cast iron water lines,small diameter galvanized water lines, and lead gooseneckservices, which are prone to leaks, water quality issues and lowpressures with new 6"" and 8"" PVC water lines and newpolyethylene services.",4510004,"$              9 99,250","$              9 99,250",385,62,110
8,"Gilbert-Summit Rural Water District -Siesta Cove Water Main Extension",3220001-05,"The project will start at a tie point to the Gilbert Summit RuralWater District water system along Shore Road then follow ShullIsland Road, State Road S-32-1157, Jesse Burton Road, JohnLong Road and then tying to the Siesta Cove Water System.See Maps for a better location description. The tie point to SiestaCove system is approximately 34d2'47.88""N and81d22'37.24""W.",3220001,"$           1 ,480,000","$           1 ,480,000","8 ,855",4 0,105
9,"Bamberg County - Elevated Water TankRehabilitation",0510002-03,"The Bamberg County Industrial Park Tank is located at the endof Industrial Road in the Airport Industrial Park, adjacent to anindustrial building and a short distance from the Bamberg CountyAirport, a regional airport facility. The area is a short distancefrom Heritage Highway (US Hwy 78) between the towns ofBamberg and Denmark.",510002,"$              5 81,500","$              5 81,500","3 ,500","3 ,500",95
10,"Batesburg-Leesville, Town of - FinishedWater Supply to Batesburg - Leesville fromJMWSC",3210002-04,"The existing source for the Town of Batesburg-Leesville hasPFOS and PFOA levels above the proposed regulatory limitsaccording to sampling performed in 2020.  The source fromJMWSC (West Columbia Lake Murray WTP) has PFOS andPFOA levels that are lower.",3210002,"$         1 7,100,000","$           7 ,100,000","7 ,800","7 ,800",95
11,"Joint Municipal Water & SewerCommission - Water Supply to Batesburg-Leesville",3220003-07,"The project will include the extension of approximately 40,000 LFof 24-inch water main, one booster station, one 500,000 GallonElevated Water tank, fire hydrants and associatedappurtenances.The existing source for the Town of Batesburg-Leesville hasPFOS and PFOA levels above the proposed regulatory limitsaccording to sampling performed in 2020.  The source fromJMWSC (West Columbia Lake Murray WTP) has PFOS andPFOA levels that are lower.",3220003,"$         3 2,477,382","$         2 2,477,382","4 9,761","7 ,800",95
12,"Winnsboro, Town of - WTP Improvements- Carbon Feed System Upgrades",2010001-02,"Upgrade from a manual carbon feed system at water treatmentplan  to an automated one. Addresses uncompleted item inDHEC consent order 11-071-DW, for non-compliance on TotalOrganic Carbon (TOC) regulations.",2010001,"$              5 11,250","$              4 75,000",7888,4418,95
13,"Turbeville, Town of - Cypress Street WellReplacement",1410004-02,"Install a well and appurtenances to maintain adequate watersupply after taking two aging wells off-line.",1410004,"$760,068.00","$              5 02,470","1,520","1,520",95
14,"Santee Cooper - Lake Marion RWSPFOA/PFOS/PFAS Treatment FeasibilityStudy",3820003-01,"This study will identify up to three alternatives to improve theexisting granular activated carbon (GAC) system's ability toremove PFAS. This may include procurement of alternative GACmedia, increasing the depth of GAC in existing contactors, ormodifying operational strategies to improve PFAS removal orextend media life. Qualitative pros, cons, and otherconsiderations will be identified for each alternative. Preliminarydesign criteria, including hydraulic impacts, will be developed.",3820003,"$                6 5,000","$                6 5,000","3 ,199","3 ,199",90
15,"Wallace Water Company - ReplacementGroundwater Well",3420002-01,"The project will consist of the drilling and development of a newgroundwater well to replace an existing well on Gainey Avenuewhich has elevated concentrations of PFAS. It is one of thehighest concentrations found in South Carolina to date with aPFOA of 32ng/L and PFOS of 17ng/L. Cost of treatment of thewater produced by the well is believed to be greater than cost ofreplacement of the well. Wallace Water Company is in theprocess of drilling a fifth well in another part of their system but itis not known yet if the water quality will meet current regulations,nor if the capacity will be comparable to that of Well No. 1.",3420002,"$              5 10,000","$              5 00,000","2 ,928","2 ,928",90
16,"Estill, Town of - Lead and Copper LineReplacement for the Town of Estill",2510002-01,"A significant portion of the Town's Water Service Lines areconstructed of copper and lead pipes. The exposure to thesematerials has caused a portion of the Town's water to becomediscolored and have a higher concentration of lead and/orcopper. The purpose of the project is to replace the copper andlead piping in the Town with new piping that will no longer pose ahealth threat to the residents.",2510002,"$           2 ,400,000","$           2 ,400,000","4 ,000","4 ,000",85
17,"Johnsonville, City of - LSL Replacements",2110011-02,"The project will include replacing approximately 500 LSLs inprimarily disadvantaged communities. The City is proposing toreplace the entirety of the LSL, from the water main to thefoundation of the building/building plumbing. Existing LSLs willbe replaced with HDPE service line of the appropriate size (3/4""to 1""). The City intends to contract with AECOM TechnicalServices, Inc. to manage the technical and engineering aspectsof the project and the costs for engineering services will beincluded in the total project cost in the application for funding.",2110011,"$           1 ,417,500","$           1 ,417,500","5 ,333","1 ,200",85
18,"Lake City, City of - Lead Service LineReplacement",2110007-01,"The City of Lake City proposes to replace the lead gooseneckfittings at approximately 300 water service addresses within thecity limits.  The water services will be replaced with fittings withcomponents that meet the requirements of 40CFR143, andcomply with State and local plumbing and building codes. Theproject will include restoring affected properties to the conditionsthey were in prior to construction.  The project will also includeengineering design, construction administration, and constructionobservation.",2110007,"$              8 58,750","$              8 58,750","5 ,929",7 53,85
19,"Saluda County Water & Sewer Authority -Emerging Contaminant Treatment System",4120001-03,"This project will include the addition of powdered activatedcarbon into the treatment process. This will involve a newpowder activated carbon tower (PAC) located prior to theheadworks, with a 400 gallon stainless steel mix tank and allother necessary appurtenances.",4120001,"$              5 25,000","$              5 25,000","5 ,850","5 ,850",85
20,"Charleston Water System - CharlestonWater System Lead Service LineReplacement",1010001-08,"The removal and replacement of known lead services lines in thedistribution system with no record of previous renewals and inareas below the SC median household income (MHI) level.Replacement project will include new service taps at thedistribution mains, installation of new copper service lines fromthe distribution main to the customer premise, the replacement ofthe private service line to water inlet of the structure, distributionof lead safe filter pitchers to all affected households, and allnecessary site restoration including landscaping and road work.",1010001,"$         3 3,929,743","$         3 2,138,311","4 50,000","3 ,416",80
21,"Florence, City of - Service LineReplacement for Lead and Copper Rule",2110001-05,"The City of Florence is requesting funding for the replacement ofservice lines on private property as well as the City's side as partof the lead and copper rule.  The service lines on privateproperty would be replaced up to the foundation of the house.  Inaddition the City is proposing to add the replacement of thegalvanized line on Bradford Street in the SRF loan.",2110001,"$           5 ,994,947","$           5 ,844,110","7 1,583","4 ,833",80
22,"Florence, City of - Pee Dee Regional WTP- Advanced PFAS Treatment Study",2110001-06,"A study, and subsequent pilot testing, will be conducted todetermine which process is recommended for the Pee DeeWTP. This study will involve pilot testing one or more of thetechnologies. This would allow the City to make informedchoices during the design of the current expansion to enableintegration of any advanced PFAS treatment process (e.g.,placement of tees with blind flanges in yard piping, allocation ofappropriate space). This would also allow the City to determine acost-effective phased plan of improvements to comply withupcoming PFAS and other emerging contaminant regulations.",2110001,"$              5 00,000","$              5 00,000","1 36,504","1 36,504",80
23,"Rock Hill, City of - Rock Hill Water PlantAlum Sludge Dewatering Facilities",4610002-11,"The project includes Alum Sludge Dewatering Facilities (with twocentrifuges), Improvements at Filter 1-6 and the Clarifier/LimeSilo/Flash Mix, and enhancement of the Front Facade of theAdministration Building. The new dewatering facility will allowsludge to be dewatered on site at the WTP and eliminate thedischarge of sludge to the Manchester Creek WWTP fordewatering. The additional plant improvements will enhanceplant performance and ensure reliable performance to maintaindrinking water quality standards.",4610002,"$         2 0,837,527","$         1 0,555,846","3 6,000","1 30,000",80
24,"Santee Cooper - Lake Moultrie RWSPFOA/PFOS/PFAS Treatment FeasibilityStudy",0820008-01,"The USEPA announced proposed Maximum Contaminant Limits(MCLs) for PFOA, PFOS, and 4 additional PFAS compounds.This project will evaluate the feasibility of different alternativesfor treating PFAS in the Lake Moultrie RWS. The study willculminate with a technical memorandum outlining different pathsforward that  Cooper may choose to pursue in the event thatPFOA, PFOS, and/or PFAS treatment is required to meet thenew MCLs described above.",820008,"$                8 5,000","$                8 5,000","2 24,352","2 24,352",80
25,"South Island Public Service District -Reverse Osmosis Water Treatment Plant#2",0720001-02,"A new Reverse Osmosis Plant will be built at 131 Dunnagan'sAlley. Project scope includes Engineering design & construction,construction, machinery/equipment purchase & installation, andassociated start-up costs.",720001,"$32,791,000.00","$         3 2,791,000","25,000","25,000",80
26,"West Columbia, City of - Riverside WaterTreament Facility Filtration Upgrades",3210004-04,"Generally the project includes upgrading the facilities 6 dualmedia gravity filters with new underdrains, cemetious wallcoatings, and granular activated carbon. Work will replace agingLeopold underdrains with new restrain compatible blocks andmedia retainers while adding granular activated carbon toaddress EPA's proposed MCL's for PFAS.",3210004,"$           3 ,200,000","$           3 ,200,000","1 10,000","2 1,000",80
27,"Rock Hill, City of - Rock Hill Water PlantAlum Sludge Dewatering Facility",4610002-11,"Construction of alum sludge dewatering facilities to allow thesludge to be dewatered at the WTP and then disposed of offsite.Also construction of a chemical feed facility.",4610002,"$         2 0,837,527","$         1 0,555,847","84,000","127,000",80
28,"Belton-Honea Path Water Authority -Water Treatment Plant Improvements",0410011-04,"This project includes upgrades to the water treatment plant toimprove treatment performance and remove emergingcontaminants (PFAS). Please see the attached narrative foradditional information about the project description andcommunity needs for the project.",410011,"$           3 ,250,000","$           3 ,250,000","2 ,277","1 7,389",70
29,"Coward, Town of - Coward WaterImprovements Old Georgetown Rd",2110012-02,"The Old Georgetown Road project will connect two dead-endwater mains, enabling the Town to provide safe, reliable drinkingwater to approximately 153 existing homes in the area that arecurrently without public water service. This project will includethe installation of approximately 31,756 LF of 8"" water mains and1,978 LF of 2"" water mains. This loop will help with systemstability and improve flow and pressure conditions on theexisting system, thereby also improving water service for allexisting water customers.",2110012,"$           1 ,873,746","$           1 ,500,000","2 ,289","2 ,681",70
30,"Starr-Iva Water & Sewer District -Assessment of Groundwater as anAlternative Source",0420005-02,"Perform an assessment of groundwater resources in the Starr-Iva service area to identify ""favorable zones"" with the greatestpotential for significant groundwater yields and conductsubsequent geophysical surveys to identify drill sites for up tofour (4) test wells to be completed in accordance with DHECstandards. The new test wells and a number of existing drinkingwater wells throughout the District would also be sampled toanalyze the quality of the groundwater including emergingcontaminants such as per- and polyfluoroalkyl substances(""PFAS"") in order to notify and plan for opportunities to servehomeowners with private wells found to be contaminated.",420005,"$              6 00,000","$              6 00,000","8 ,688","8 ,688",65
31,"Saluda County Water and SewerAuthority - Highway 39 Booster PumpStation",4120001-01,"The Project includes the construction of an in-line booster pumpstation to provide potable water to the town of Ridge Spring andaddress pressure issues due to the elevation in this area.",4120001,"$           2 ,010,250","$           1 ,000,000",3558,1486,40
32,"Belton, City of - Water SystemImprovements FY23",0410004-02,"This project will create improvements in water quality in theareas by upsizing small diameter lines to SCDHEC regs forhydrants currently on 4-inch water lines. Project will eliminatesome portions of undersized and maintenance intensivegalvanized water lines.",410004,"$8,671,960.00","$              9 90,000",4484,37,35
33,"Calhoun Falls, Town of - Water SystemImprovements FY23",0110002-07,"The project will holistically replace/upgrade leaking, dilapidated,tuberculated and undersized water lines of various material sizesand material compositions, including asbestos cement waterlines. Inclusive of the project, service line connections with “leadgoose necks”, will be replaced as well. The project benefit willcreate improvements in fire flow and water quality in the areasby providing upsizing small diameter lines, creating loops in thesystem and eliminate some portions of undersized andmaintenance intensive Asbestos Cement water lines.",110002,"$           1 ,500,000","$           1 ,500,000","1 ,727","1 ,727",35
34,"Greeleyville, Town of -  Lead Service LineReplacementProject",4510001-02,"Complete Lead Service Line Replacement (LSLR) of 210services. Approximately 18,884 LF of existing asbestos-cement(AC) mains and 3,785 LF of galvanized mains will also need tobe replaced to complete LSLR and completely eliminate thepotential for lead contamination",4510001,"$           2 ,843,918","$           2 ,843,918",377,425,35
35,"Lockhart, Town of - Summit DriveWaterline Upgrade",4420010-02,"Upgrade of the waterline on Summit Drive from the water tanksouth to the connection with Lockhart Drive. Project includes4,874 LF of 6"", 4"" & 2"" water lines; 50 valves; 11 fire hydrants;12 service reconnections; and pavement replacement",4420010,"$           1 ,446,615","$              9 46,615",533,245,35
36,"Saluda Commission of Public Works -Booster Pump Station EmergencyGenerators",4110001-02,"Standby diesel generators will be installed at booster pumpstations No. 1 and No. 2. These generators will be connected tothe SCADA system electrical system, and TTHM System via anautomatic transfer switch and will be programed to periodicallyexercise. These improvements will allow the stations to continueto operate in the event of power failure as well as notifyoperators.",4110001,"$              4 00,000","$              3 50,000","3 ,300","3 ,300",35
37,"Saluda County Water & Sewer Authority -Saluda County Water & Sewer RegionalUtility Evaluation",4120001-02,"Saluda CPW & the Town of Ridge Spring have approachedSCWSA regarding potential regional partnerships beyondwholesale contracts. This planning effort will evaluate thefeasibility of the water service from SCWSA and thedevelopment of a regional WWTP.","4120001, 4110001,4110002","$              4 00,000","$              3 00,000",4893,4893,35
38,"Calhoun Falls, Town of - Water SystemImprovements FY21",0110002-05,"Replacement or repair of leaking, dilapidated, tuberculated andundersized water lines.  Including aging water lines in the  millvillage area of town, many of which are located in rear yardeasements.",110002,"$3,400,000.00","$           6 ,800,000","2,004","2,004",35
39,"Bethune, Town of - Water TankRehabilitation",2810002-01,"Rehabilitation of existing elevated water tank to includesandblasting and painting of interior and exterior surfaces andimprovements to the water treatment equipment and facilities.",2810002,"$325,000.00","$              6 50,000",488,488,35
40,"Abbeville, City of - Haigler-HarrisburgWater Line Replacement",0110001-06,"This project includes the replacement of approximately 4,460 LFof aging 8"" and 10"" cast-iron water mains that includes nine (9)water main tie-ins, installation of fourteen (14) gate valves, one(1) new fire hydrant assembly and approximately forty-nine (49)service lines.",110001,"$              8 00,004","$              6 50,004",4958,55,30
41,"Aiken County / Breezy Hill Water andSewer Company   - Square Circle Road &Powerhouse Road Water Improvements",0220006-02,"Water extension along Square Circle Road involving 1,940 LF of6"" water mains to serve 27 residences; and water systemimprovements along Powerhouse Road involving 3,150 LF of 8""water mains to improve system pressures and supply to thesouth.",220006,"$              6 96,633","$              4 70,428",15282,69,30
42,"Bath Water and Sewer District, Town of -Town of Bath 2023 Water SystemImprovements Project",0220003-01,"Funds will be used to replace an existing 8-inch water line onMinter Street on the north and south side of U.S. 421 including ajack and bore, valves, hydrants, and service reconnections.  TheTown also wishes to replace cast iron pipes under railroadcrossings.  Finally, the Town wishes to loop the water system onthe north side of the railroad tracks for better water circulation,fire protection, and to provide redundant water connection pointsunder the railroad tracks.",220003,"$           1 ,500,000","$           1 ,500,000",6 30,6 30,30
43,"Blacksburg, Town of - Main Street LineReplacement and Grover Booster Pump",1110002-02,"The water line proposed for replacement is nearly 50 years old,undersized and primarily composed of cast iron pipe with leadjoints and an extensive repair history. Currently, there is notsufficient isolation valves within town and as a result duringbreaks and repairs, many customers are without water untilrepairs are completed. Funds will be used towards constructioncosts associated with the replacement of the Town's centralwaterline on Hwy 29 (Main Street) as well as the installation of abooster pump, to improve water pressure in the extremities ofthe Town of Blacksburg’s water system.",1110002,"$           2 ,200,000","$           1 ,500,000","4 ,488","4 ,488",30
44,"Branchville, Town of   - Water systemimprovements",3810005-01,"Water Distribution system improvements including replacing oldaging water lines that form the backbone of the water distributionsystem and the addition of valves to improve water systemcontrol.",3810005,"$           1 ,006,000","$              4 86,000",944,555,30
45,"Cheraw, Town of - Water PlantImprovements 2022",1310001-03,"Improvements to water treatment plant include: repair of tankfarm containment wall, rehab of 207 If of 18 and 21"" drain pipe,concrete beam repair, flash mix foundation repair and electricalbreaker replacement.",1310001,"$              4 67,165","$              4 22,465",6595,2860,30
46,"Coward, Town of - Coward Water SystemReliability & Efficiency Improvements",2110012-01,"Renovate Coward-Scranton Connection #1 and #2, regionalconnections between the two water systems. Add SCADA to theexisting water system.",2110012,"$              2 62,000","$              2 62,000",766,951,30
47,"Hemingway, Town of - Lead Service LineInventory",4510004-04,"A partial lead service line inventory will be completed, utilizing avac truck to expose and check the material type on service lines.",4510004,"$                7 5,000","$                7 5,000",400,400,30
48,"Honea Path, Town of - Water SystemImprovements FY22",0410011-03,"This project will create improvements in water quality and fireflow in the areas by providing upsizing small diameter lines,creating loops in the system and eliminate some portions ofundersized and maintenance intensive asbestos-cement waterlines.",410003,"$           1 ,000,000","$           1 ,000,000",3851,1600,30
49,"Jefferson, Town of - Downtown WaterlineUpgrades",1310005-03,"Project to replace old 6"" and 8"" cast iron and asbestos cementwater lines which are prone to leaks, water quality issues andlow pressures with new 6"" and 8"" PVC water lines.",1310005,"$           1 ,499,810","$              9 99,810",704,125,30
50,"Lane, Town of - Lane Lead Service LineReplacement Project",4510056-02,"Complete Lead Service Line Replacement of 264 services.Approximately 8,552 LF of 6"" asbestos-cement pipe and 12,051LF of 10"" asbestos-cement pipe will also be replaced. New radio-read meters and backflow preventers will also be installed at 264existing services.",4510056,"$           4 ,007,397","$           4 ,007,397",443,264,30
