call_label,severity,field,issue,suggestion
4_script_data,WARNING,pwsid,"The PWSID column is 3.3% NA in the comprehensive list. The script replaces NA with 'No Information'. However, the data dictionary states PWSID is 'Extracted from Project Title/Number/ Population in Comprehensive List', implying the PWSID may be embedded in that combined column, not a standalone column. The script uses a standalone `pwsid` column — if this is correct per the actual CSV structure (as suggested by the column summary showing a PWSID column), this is fine, but the DD reference to 'Project Title/Number/ Population' warrants a cross-check.",Confirm that the standalone PWSID column in the CSV matches what would be extracted from the 'Project Title/Number/ Population' combined column described in the data dictionary.
4_script_data,WARNING,project_rank / project_score,"project_rank is extracted from the `rank` column (character, 123 distinct values including '1','2','3' etc.) and project_score from `points` (numeric, range 10-125, 0.8% NA). The Rank column has 123 distinct values for 123 rows, meaning all ranks are unique — but Points has only 21 distinct values with ties (e.g., multiple projects scoring 125). The script uses str_squish on rank which is fine for character, and str_squish on points which is numeric — str_squish on a numeric may coerce unexpectedly depending on R version.","Convert points to character before str_squish, or use as.character(points) to avoid any implicit coercion issues."
4_script_data,INFO,project_id,"The script sets `project_id = as.character(NA)` per the data dictionary instruction ('No Information'). However, the data dictionary defines 'No Information' as a string value 'No Information', not NA. Other fields like pwsid use the string 'No Information' explicitly.",Change to `project_id = 'No Information'` to be consistent with how other No Information fields are handled per the data dictionary.
4_script_data,INFO,list,"Projects on the comprehensive list that are NOT on the fundable list get list='SFY25 comprehensive', while projects on both get 'SFY25 fundable'. This is the intended behavior per the author note. However, projects ranked 1-92 on the comprehensive list should all appear on the fundable list per the DD note. If any of the top 92 ranked projects fail to join (e.g., due to project_number mismatches), they would incorrectly show as 'SFY25 comprehensive' and get expecting_funding='No'.","After the join, add a validation check that all comprehensive list projects with Rank <= 92 successfully joined to the fundable list; log any that did not for manual review."
4_script_data,INFO,project_description,"The project_description append logic uses exact string matching (e.g., `== 'REPLACE APPROX 48,000 LF OF 2-IN OR LESS GALVANIZED SECONDARY SERVICE LINES UP TO EACH RESIDENTIAL WATER METER'`). After str_squish, extra spaces are normalized, but if the source data has any character encoding differences, trailing punctuation, or case differences, these exact matches will silently fail to append the FT tag.","Consider using grepl-based matching with key substrings rather than exact equality for robustness, or add a post-processing check that all Lead projects have an FT tag appended."
