Rank Order,Priority Points+,ATPI,Pop. Served,PWSID#,Local Government,County,Project Description,"Total Project Amount
($)",Estimated Amount for Green Project Subsidy ($),"Estimated Amount for Disadvantaged Communities Principal Forgiveness
($)","Estimated Amount for Small Systems Principal Forgiveness
($)",Anticipated Interest Rate (%),Expected Term (Years),"Expected Loan Award Date
(mm/yy)",Proposed Construction Start,Proposed Construction Completion
,,30,"25,851",TN0000024,Athens*,McMinn,"New Water Storage Tank (Construction of a 500,000 gallon Water Storage Tank and booster station; and the installation of approximately 3,000 LF of 12-inch diameter waterline along Hwy 305.)","$16,200,000",$                            -,"$ 5,000,000",$                        -,1.94,30,Oct-25,Mar-26,Jun-27
,,30,"10,013",TN0000090,Camden*,Benton,"Waterline Replacement (The replacement of approximately 21,000 linear feet of raw water transmission main along TN Highway 70.)","$5,100,000",$                            -,"$ 2,040,000",$                        -,1.94,30,Jun-25,Jun-25,Mar-30
,,10,"6,281",TN0000183,Decatur*,Meigs,"New Water Storage Tank (Construction of a 125,000 gallon WST and associated appurtenances.)","$500,000",$                            -,"$ 250,000",$                        -,1.06,15,Sep-25,Aug-25,Mar-25
,,20,"9,560",TN0000094,First Utility District of Carter County*,Carter,"Waterline Replacement (Replacement of approximately 31,400 LF of 2-inch, 4-inch, and 6-inch diameter waterlines along George Bowers Road, Dawn Drive, Willow Springs Road, Pearl Bowers Road, Blue Springs Road, Carl Taylor Toad, Rex Harrell Road, and Hodge Branch Road.)","$2,500,000",$                            -,"$ 1,000,000",$                        -,1.94,30,Oct-25,Mar-26,Feb-27
,,40,NA,NA,Hawkins County*,Hawkins,"Waterline Extension (Installation of approximately 9,300 LF of 4-inch diameter waterline along New Salem Road.)","$956,642",$                            -,"$ 286,993",$                        -,1.94,30,Apr-25,Jun-25,Jun-25
,,30,"91,111",TN0000299,Jackson Energy Authority*,Madison,GREEN- Water Meter Replacement (Replacement of existing water meters throughout the distribution system with AMI meters.)  Water Efficiency,"$2,065,000",$                            -,"$ 826,000",$                        -,1.72,20,Mar-26,Jul-26,Jun-27
,,30,"91,111",TN0000299,Jackson Energy Authority*,Madison,WTP Improvements (Construction of a new water well.),"$1,065,000",$                            -,"$ 426,000",$                        -,1.72,20,Mar-26,Jul-26,Mar-27
,,40,"14,491",TN0000405,Livingston*,Overton,Waterline Replacement (Phase III of replacing the waterlines in the distribution system throughout the city.)  Planning and Design,"$190,000",$                            -,$                        -,$                        -,1.46,5,Oct-25,NA,NA
,,40,"14,491",TN0000405,Livingston*,Overton,Waterline Replacement (Phase III of replacing the waterlines in the distribution system throughout the city.)  Construction,"$2,925,000",$                            -,"$ 877,500",$                        -,1.72,20,Mar-26,Jun-26,Mar-27
,,30,"7,149",TN0000442,Maynardville ++,Union,WTP and Distribution System Improvements (Installation a generator at the Lay Springs and Davis Springs WTPs; and the installation of SCADA and telemetry at the pump stations and WTPs.)  Planning and Design,"$110,000",$                            -,$                        -,"$ 55,000",1.46,5,Aug-25,NA,NA
,,80,"25,558",TN0000515,Northeast Knox Utility District,Knox,"GREEN - WTP Improvements (Improvements to the WTP to include replacement of the settling tubes, troughs, and weirs; and rehabilitation of the sedimentation basins.)   Energy Efficiency","$3,000,000","$ 500,000",$                        -,$                        -,2.87,20,Dec-26,Dec-26,Dec-27
,,80,"25,558",TN0000515,Northeast Knox Utility District,Knox,GREEN - Pump Station Replacement (Construction of a new 600 gpm pump station on Emory Road.)   Energy Efficiency,"$2,500,000","$ 500,000",$                        -,$                        -,2.87,20,Jun-26,Jun-26,Dec-27
,,0,"8,030",TN0000580,Ripley*,Lauderdale,GREEN - Water Meter Replacement (Replacement of water meters throughout the water distribution system.)   Water Efficiency,"$1,720,000",$                            -,"$ 860,000",$                        -,1.30,30,Oct-25,Dec-25,May-26
,,90,"60,893",TN0000667,Spring Hill,Maury,New WTP Expansion (Construction of an Advanced Purification Treatment Facility.),"$750,000",$                            -,$                        -,$                        -,3.24,30,Feb-26,Feb-26,Feb-27
,,90,"60,893",TN0000667,Spring Hill,Maury,"Waterline Replacement (Installation of approximately 7,700 LF of 12-inch diameter DIP waterline along US Hwy 31/Main Street.)","$3,773,000",$                            -,$                        -,$                        -,3.24,30,Feb-27,Feb-27,Dec-28
,,90,"60,893",TN0000667,Spring Hill,Maury,GREEN - (New WTP Expansion (Construction of an Advanced Purification Treatment Facility.) Planning and Design,"$525,000",$                            -,$                        -,$                        -,2.43,5,Jan-26,NA,NA
,,50,"3,980",TN0000746,White Pine*,Jefferson,"New Water Storage Tank (Construction of a 300,000 gallon WST in the Northeast portion of town and the installation of a 1,500 gpm pump station adjacent to the I-40 storage tank.)","$1,900,000",$                            -,"$ 570,000",$                        -,2.30,20,Nov-25,Jan-26,Sep-26
,,80,"12,069",TN0000758,Woodlawn Utility District,Montgomery,Waterline Extension (Installation of a 12-inch diameter water transmission main along Woodlawn Road.),"$5,933,159",$                            -,$                        -,$                        -,3.24,30,Sep-25,Oct-25,Aug-26